id,title,description,instructions,author/id,image,history/created,history/modified,history/shared,stats/views,stats/loves,stats/favorites,stats/comments,stats/remixes,remix/parent,remix/root
237875134,#GettingUnstuck17 - Average and max number,Sprite taken from the Scratch repository.,"Press Green flag and follow the instructions.

This project is part of #GettingUnstuck initiative #CreativeComputing, Day 17

""Create a project that asks the user to type in multiple words or numbers, stores the items in a list, then does something interesting with the items from the list""

Type numbers and, once done, type ""DONE"" in the textbox. This program will calculate average and max number (it should be easy to remix and calculate minimum number!)",1112440,https://cdn2.scratch.mit.edu/get_image/project/237875134_480x360.png,2018-07-31T16:29:38.000Z,2018-07-31T16:32:26.000Z,2018-07-31T16:32:16.000Z,3,1,0,0,0,,
237919755,# Unstuck 17 Multiple Words,I made this thinking about our production for this term. I felt the students could make their own one as an assessment to the term.,You have to spell the words correctly or it doesn't accept them. ,31492686,https://cdn2.scratch.mit.edu/get_image/project/237919755_480x360.png,2018-08-01T02:15:22.000Z,2018-08-01T02:51:31.000Z,2018-08-01T02:50:11.000Z,4,1,0,0,0,,
238078300,Shopping list getting unstuck day 17,"I've learned to manage lists: add, remove and move to another list.The biggest challenge is design a simple interface to do these actions. 
","A project to save a shopping list.
Add new item with ""nuevo"". 
Mark as shopped with ""Hecho"". 
You can see your shopped items with ""Lista Comprado""
",2680901,https://cdn2.scratch.mit.edu/get_image/project/238078300_480x360.png,2018-08-02T17:40:15.000Z,2018-08-03T07:53:56.000Z,2018-08-02T18:12:15.000Z,7,1,0,0,0,,
238079730,My game list Getting unstuck day 17,hi have learn to ad and remove elements ,,23020553,https://cdn2.scratch.mit.edu/get_image/project/238079730_480x360.png,2018-08-02T18:01:13.000Z,2018-08-02T18:38:12.000Z,2018-08-02T18:34:47.000Z,4,2,0,0,0,,
238258079,day-17,,,16822769,https://cdn2.scratch.mit.edu/get_image/project/238258079_480x360.png,2018-08-05T06:07:34.000Z,2018-08-05T06:19:19.000Z,2018-08-05T06:19:19.000Z,3,1,0,0,0,131337687,131337687
238257085,Getting Unstuck - Day 17,"The Getting Unstuck Challenge for day 17 is to: ""Create a project that asks the user to type in multiple words or numbers, stores the items in a list, then does something interesting with the items from the list.""

This program is inspired by one of my daughter's favorite youtube videos: https://youtu.be/frN3nvhIHUk

It took me awhile to get the ""Yes!"" and ""No!!"" sprites to hide and show together and at the right times.  But I failed forward! Work on one sprite to follow what you want and then just duplicate the scripts to the second!

Backdrop images from Pixabay:
https://pixabay.com/photo-1081543/
https://pixabay.com/photo-410330/","Enter your five favorite foods and then answer the prompts that follow by clicking on ""yes"" or ""no"".",24696341,https://cdn2.scratch.mit.edu/get_image/project/238257085_480x360.png,2018-08-05T05:37:59.000Z,2018-08-05T08:20:52.000Z,2018-08-05T08:08:51.000Z,3,1,0,0,0,,
238341658,Getting Unstuck - dag 17,#GettingUnstuck,Click the green flag to have a short chat.,25631396,https://cdn2.scratch.mit.edu/get_image/project/238341658_480x360.png,2018-08-06T11:07:45.000Z,2018-08-06T11:08:27.000Z,2018-08-06T11:08:27.000Z,3,1,0,0,0,,
238370277,Bubblesort - GettingUnstuck-17,"Bubblesort is one of many sorting algorithms, not the most efficient, but one of the simplest to implement so it was funny to play with it on Scratch.
This is just the first iteration: I would like to see the bubbles move when I swap them (and just those involved) instead of redrawing all of them like now. I used the parsing function from the day16.
And, thinking about thinking: bubblesort is not the way our brain sorts numbers, what kind of algorithm do we really use? Is it the same for all of us?","Green flag to start.
You can enter some numbers comma separated and they will be bubblesorted (https://en.wikipedia.org/wiki/Bubble_sort)",25876369,https://cdn2.scratch.mit.edu/get_image/project/238370277_480x360.png,2018-08-06T18:27:01.000Z,2018-08-06T21:40:50.000Z,2018-08-06T21:17:48.000Z,2,1,0,0,0,,
238410052,Program Steven,"I wanted to create a todo list for a sprite, then I realized that it is exactly what a computer program is! So I made a very simple programming language on top of Scratch.

I was surprised by how easy it was to build the ""interpreter"", i.e. the ""start"" sprite that reads from the list and broadcast messages to Steven. If I had more time I would implement more programming blocks and I would add the possibility of repeat loops.

Enjoy!
","Click on the blocks to create a program, then press the start button to let Steven execute it.",2286560,https://cdn2.scratch.mit.edu/get_image/project/238410052_480x360.png,2018-08-07T03:28:46.000Z,2018-08-07T18:58:18.000Z,2018-08-07T04:16:55.000Z,17,6,3,0,0,,
238474214,Getting Unstuck17 : the rainbow,,"
PRESS THE GREEN FLAG 
LIST IN ORDER THE COLORS OF THE RAINBOW
IF YOU FAIL PRESS THE GREEN FLAG AGAIN
WRITE IN BLOCK LETTERS PLEASE",16573108,https://cdn2.scratch.mit.edu/get_image/project/238474214_480x360.png,2018-08-07T20:36:17.000Z,2018-08-07T22:05:06.000Z,2018-08-07T21:58:51.000Z,3,1,0,0,0,,
238458517,An alphabetical story (Getting Unstuck #17),"Getting Unstuck activity #17 - ""Create a project that asks the user to type in multiple words or numbers, stores the items in a list, then does something interesting with the items from the list. ""

The story sorts the entered names alphabetically and uses them in the stories. I was going to have sprites using the entered names and have different backdrops etc, but the list logic took up too much time.","Click the flag. Enter the names and places as prompted and see what story comes out! 

Words expected are:

5 names
3 places",15872912,https://cdn2.scratch.mit.edu/get_image/project/238458517_480x360.png,2018-08-07T16:42:36.000Z,2018-08-07T22:22:22.000Z,2018-08-07T22:22:22.000Z,2,1,0,0,0,,
238545673,Getting Unstuck - Day 17,"I used a list to add elements of the story to. When the question has been asked multiple times, I loop through the list element by element to extract the lines and have the storyteller sprite say them.","You will need three people to play this story game!
You will create a story together with two other people. Each person will have time to write their own line in the story. The trick is that you can only see the previous line. At the end, the storyteller will read the completed story to you.

Press the green flag and follow the instructions.",25334812,https://cdn2.scratch.mit.edu/get_image/project/238545673_480x360.png,2018-08-08T14:02:27.000Z,2018-08-08T15:12:52.000Z,2018-08-08T15:10:49.000Z,1,0,0,0,0,,