id,title,description,instructions,author/id,image,history/created,history/modified,history/shared,stats/views,stats/loves,stats/favorites,stats/comments,stats/remixes,remix/parent,remix/root
237326824,Getting Unstuck #20: Sirtaki dance (redo),"Scratch project was created originally, as ""Getting Unstuck"" activity #15 and then, revised as part of the activity #20. More backdrops were created to better reflect the loudness of the room/music and the backdrop switch conditions improved.

From original project: Thanks to this challenge and ""Chromophobia"" https://scratch.mit.edu/projects/236675985/ by @karenb, I familiarized myself with the loudness sensor and its use!

Day #20 Challenge: First, create a studio and add all of your Getting Unstuck projects to it. Second, choose one of your projects from a previous day of Getting Unstuck, make a copy of it, and revise it. ","Adjust the speaker level to high volume, press the green flag and enjoy the music and the effect of the loudness sensor!",1202362,https://cdn2.scratch.mit.edu/get_image/project/237326824_480x360.png,2018-07-25T04:16:53.000Z,2018-07-25T10:06:05.000Z,2018-07-25T04:51:36.000Z,3,0,0,0,0,,
237340985,Fiore che danza copy,"Copia modificata per Getting Unstuck Day 20

Grazie a @Papami-chan per avermi ispirato con Meditation ",Press the green flag,17698999,https://cdn2.scratch.mit.edu/get_image/project/237340985_480x360.png,2018-07-25T07:51:15.000Z,2018-07-25T08:16:57.000Z,2018-07-25T08:16:20.000Z,5,1,0,0,0,,
236774142,unstuck day 14,,guess the word: you have to click on the letter (word has length 3),443100,https://cdn2.scratch.mit.edu/get_image/project/236774142_480x360.png,2018-07-18T18:19:20.000Z,2018-07-18T20:15:41.000Z,2018-07-18T19:21:08.000Z,30,1,0,0,0,,
134877243,Fibonacci_palla remix,"Thanks
","Partendo dai numeri della serie di Fibonacci abbiamo creato una palla
",443100,https://cdn2.scratch.mit.edu/get_image/project/134877243_480x360.png,2016-12-07T06:59:45.000Z,2018-07-25T11:47:10.000Z,2018-01-23T18:23:45.000Z,10,2,0,0,0,134366656,134366656
237272072,water clock,"Getting Unstuck day 20
by Massimo Marletta

In this project I simulated how a mechanical clock works.
The project is not intended to be a precise clock (there are obviously better ways to do it).
I started from a previous project of mine, where I used a pendulum performing a regular motion as the oscillator which gives ""tic"" to the clock. 
In this revised project I use drops of water dripping from a tap at regular time intervals to generate a ""tic"" broadcast message than make the needles move.
Each needle when receive the ""tic"" message rotates of a fixed amount, depending on the period of the drops falling and on the ""role"" of the needle (hours, minutes, seconds). In reality it depends on the gears that connect needles to the mechanism.
The drop block uses ""slide in N seconds"" to generate ""tic"" messages  at regular time intervals.

Credits for images:
www.flaticon.com
Tap by Pixel perfect
Drop & Recipient by Freepik
Clock by Dimitry Miroliubo","In this project I simulated how a mechanical clock works.
The project is not intended to be a precise clock (there are obviously better ways to do it).
A regular phenomenon, as the dripping of water from a tap, can be used as source of a regular pulse that make the clock move.
The clock synchronizes with the real time clock when the green flag is pressed (seconds are excluded, so that thin needle always starts at 00).
",4804940,https://cdn2.scratch.mit.edu/get_image/project/237272072_480x360.png,2018-07-24T16:46:49.000Z,2018-07-25T15:29:02.000Z,2018-07-25T09:22:45.000Z,25,7,3,0,0,,
237293812,walking on the random side - day 1 remix,".""Walk on the wild side"" cover by Chillz https://soundcloud.com/user-307337610/walk-on-the-wild-side
","The Scratch's cat does a random walk and will eventually touch Gobo or Pico.

If you open the project in edit mode then you can modify the ""coin"" behavior by adding more heads and/or tails to the list.

Try to bias the coin so that the Scratch cat meets only Gobo or Pico.

Would it be possible to bias the coin in such a way that the cat oscillates around the staring position without touching Gobo or Pico?",214,https://cdn2.scratch.mit.edu/get_image/project/237293812_480x360.png,2018-07-24T21:19:39.000Z,2018-07-25T18:54:33.000Z,2018-07-25T10:46:39.000Z,5,1,0,0,0,,
237349172,Getting Unstuck: Day 20-2,Andrés Gil Ruiz.,"Getting Unstuck Day 3 modified.

Now, you can play the piano with your mouse.

Enjoy it!",27636310,https://cdn2.scratch.mit.edu/get_image/project/237349172_480x360.png,2018-07-25T10:12:33.000Z,2018-07-25T11:17:45.000Z,2018-07-25T11:15:28.000Z,4,1,0,0,0,,
237353394,Make a Band,"I had an idea but I'm not sure if was my coding or the software that struggled with the sounds so it's a very simple version.

Version 2 is a bit closer to what I wanted after looking at other projects.","Each instrument practices its scales when clicked. Can you find the secret song?

Now you don't have to click (except for the secret sound). You can wave the mouse cursor over any instrument repeatedly.",30508500,https://cdn2.scratch.mit.edu/get_image/project/237353394_480x360.png,2018-07-25T11:37:24.000Z,2018-07-25T11:43:52.000Z,2018-07-25T11:39:52.000Z,2,0,0,0,0,,
237339520,new day 14,,guess the word: you have to click on the letter (word has length 3),443100,https://cdn2.scratch.mit.edu/get_image/project/237339520_480x360.png,2018-07-25T07:27:55.000Z,2018-08-08T13:55:19.000Z,2018-07-25T12:44:03.000Z,8,1,0,0,0,,
237355460,Getting Unstuck 20 - Day 7 update,"For this remade project, I decided to incorporate a fair isle pattern into the knitting animation. For now it can only draw a flower, but I would like to have it do a different design each time, either randomly or letting the user choose from a list of designs.

I was a few rows into putting all the stitches into one long script when I realized the top of the design is the bottom in reverse. That made it a lot quicker - I made each row a separate block then did them in reverse after I got to the middle. 

Music is Good Thoughts by Lobo Loco from the Free Music Archive.","Click the green flag to fill the screen with knitting. You can press shift while clicking the green flag to run it in turbo mode, which will create the whole pattern very quickly, as the regular mode is pretty slow. This does make the animation of the needles kind of go away though - I wish there was an in-between!

Also sometimes you need to click the green flag twice to get the needles to start moving? Not sure why.",18044195,https://cdn2.scratch.mit.edu/get_image/project/237355460_480x360.png,2018-07-25T12:18:22.000Z,2018-07-25T12:53:50.000Z,2018-07-25T12:49:44.000Z,7,2,0,0,0,,
237299470,Day 20 Getting Unstuck - revision of Day 13,"Create a sprite that reacts whenever the mouse pointer gets too close. If you leave the sprite alone for a few seconds, it should react differently.

""ceiling fan blue"" image from wpclipart.com

Reflect: Why did you choose this project to revisit?
I knew the path the balloon takes when blown could be better modeled by improving the mathematics used to determine the new location. I don't teach geometry or trigonometry so I had to do a little research and some trial and error modeling to figure out if my mathematics was correct so I also used this as a reason to use the Desmos online graphing calculator a little more fully. 
The mathematics required to determine the path the balloon should take when blown by the fan is demonstrated at https://www.desmos.com/calculator/pftuv8rh3f
","Move the fan close to the balloon to blow it around. If you leave the balloon alone for a few seconds, it will change color.  The balloon will return to the center if you blow it off the screen.",1013358,https://cdn2.scratch.mit.edu/get_image/project/237299470_480x360.png,2018-07-24T22:49:07.000Z,2018-07-25T13:03:27.000Z,2018-07-25T12:52:41.000Z,1,0,0,0,0,,
237145175,SCRIGNO42- LE VACANZEVariabili e liste remix,"Ho remixato il progetto di MartaMazzi (che ringrazio) perchè non riuscivo a destreggiarmi fra variabili e liste,
Progetto creato per Getting Unstuck, giorno 20 (remix del giorno 17)","Questo è un remix del progetto che ho inviato per il giorno 17.
Ho inserito degli sfondi nuovi...
CLICCARE SULLA BANDIERINA VERDE E RISPONDERE ALLA DOMANDA DI CAT. Potete scegliere fra 4 luoghi di vacanza (mare, montagna, campagna, lago)...Ricordatevi di scriverli in minuscolo; divertivi a rispondere ogni volta un luogo diverso e...(bisogna cliccare di nuovo la bandierina verde per dare una nuova risposta)
",14651357,https://cdn2.scratch.mit.edu/get_image/project/237145175_480x360.png,2018-07-23T13:22:24.000Z,2018-07-25T13:23:40.000Z,2018-07-23T14:35:58.000Z,5,0,0,0,0,97018607,97018607
237361227,Virtual Flowers v.2,"In this version, I moved the water and food over the flowers and then moved them back. I also got the flowers to react the way I wanted them to. Correlates to my ability to take care of flowers, or lack thereof. :) 

I still would like to add variables to monitor hunger, thirst, and light at some point.

I got the original idea from Scratch's Virtual Pet project - from a set of Scratch Coding Cards that I just received. https://scratch.mit.edu/projects/237145343/#editor","Click the Green Flag to begin.

Provide just the right condition for the flowers to grow to their fullest. Be careful not to overdo it!",1196430,https://cdn2.scratch.mit.edu/get_image/project/237361227_480x360.png,2018-07-25T13:35:05.000Z,2018-07-25T14:36:23.000Z,2018-07-25T14:36:09.000Z,2,0,0,0,0,,
237337132,Getting Unstuck Day20 (Day 5 copy),"
Getting Unstuck Day 20 modificato in base alle nuove competenze acquisite, ho programmato la variabile salto","Quando gli sprite ricevono il messaggio, premi  il tasto spazio",15572972,https://cdn2.scratch.mit.edu/get_image/project/237337132_480x360.png,2018-07-25T06:52:41.000Z,2018-07-26T13:49:46.000Z,2018-07-25T15:56:07.000Z,3,0,0,0,0,,
237381759,G.U. Day 20 -  Copia di  G.U. Day 16  SINGER ,"Le richieste sono sempre più difficili per me.
Ho aperto diversi progetti già caricati nella galleria, troppo complicati per me.

","Copia del Progetto 16-
Ho aggiunto due sprite.
Clicca sulla bandierina verde.
Non troverai risposte alle tue domande, ci lavorerò.",13746945,https://cdn2.scratch.mit.edu/get_image/project/237381759_480x360.png,2018-07-25T17:27:13.000Z,2018-07-25T17:52:44.000Z,2018-07-25T17:51:47.000Z,2,0,0,0,0,,
237387311,Unstuck - Day 20,"This project is a remix of a previous unstuck challenge.  It is just a variation of a traditional pong game.  We decided to count how many times the ball hits the Scratch Cat. When the score is greater than 10, then the ball moves faster. After 20 and 30 it also gets faster.  

I made these changes: 
Each time the ball goes behind the cat, the score decreases by 5.  When the score is less than 0, the game is over and a Game Over background  appears.
When the speed changes, the ball switched colors (changes costume)
","Click Green Flag to Start.
Move your mouse up and down and try to hit the ball.
Try to keep up!",2456527,https://cdn2.scratch.mit.edu/get_image/project/237387311_480x360.png,2018-07-25T18:25:41.000Z,2018-07-25T18:31:45.000Z,2018-07-25T18:31:45.000Z,1,0,0,0,0,,
237331300,Herding Sheep:Getting Unstuck:Day 20,"Background picture of Switzerland:
Dennis Jarvis from Halifax, Canada",Click green flag  to start.  Use left/right allow key to herd the sheep!,17257831,https://cdn2.scratch.mit.edu/get_image/project/237331300_480x360.png,2018-07-25T05:15:14.000Z,2018-07-25T18:50:08.000Z,2018-07-25T18:50:08.000Z,6,2,0,0,0,,
237399099,Getting Unstuck [Day 2] REVISED [Day 20],"This is getting unstuck day 20!
I made the flowers start out small when you place them then they grow.",Click on the hill to place the flowers,13594403,https://cdn2.scratch.mit.edu/get_image/project/237399099_480x360.png,2018-07-25T21:09:49.000Z,2018-07-25T21:12:58.000Z,2018-07-25T21:12:58.000Z,2,0,0,0,0,,
237400027,Day 20 of Getting Unstuck Maze Levels game ,"This was a fun project and I like to teach building mazes several ways, whether doing drawings like this, or using other maze type backgrounds. This simple game is any easy way to have kids draw their own backgrounds to create a project. I find kids really enjoy making starting projects like this.","Use the arrow keys to move through the mazes.

Day 20 of Getting Unstuck project using color and added another level to the game.

I would just keep going making more levels to just keep the game going.",588430,https://cdn2.scratch.mit.edu/get_image/project/237400027_480x360.png,2018-07-25T21:24:34.000Z,2018-07-25T21:31:32.000Z,2018-07-25T21:31:32.000Z,2,0,0,0,0,,
237398053,Day 20 Appearing Flower copy,"I'm enjoying having a reason and purpose to play on Scratch. Thank you!

Day 20, fresh eyes on this project: it's not quite doing what I wanted but It's more interesting than it was.","This is an add on from a previous project.
Click on the green flag to start.
Move the cursor to where you would like a flower and press the space bar. A flower will appear. Create a beautiful garden!",32833725,https://cdn2.scratch.mit.edu/get_image/project/237398053_480x360.png,2018-07-25T20:54:29.000Z,2018-07-25T21:43:25.000Z,2018-07-25T21:43:25.000Z,1,0,0,0,0,,
237392981,Day 20 - Getting Unstuck ,"A Koch (MAD) snowflake... 
=> Remix of my project ""Day 7 - Getting Unstuck""

I've had a lot of fun adding a Ladybug and and some other stuff  (variable, events, screen cleaning).

",Click to clean the screen.,26079479,https://cdn2.scratch.mit.edu/get_image/project/237392981_480x360.png,2018-07-25T19:37:45.000Z,2018-07-25T22:44:22.000Z,2018-07-25T22:24:57.000Z,4,1,0,0,0,236143961,236143961
237404612,Getting Unstuck: Day 12 copy Remix,"By Filipe Mendes
#CreativeComputing","Eat the fruit
Its a project that moves the cat behind three levels dor eat the fruit.
Use the arrow keys to move the cat, if you touch the colors then restart.
In the second level have a block that moves and in the 3rd level have a bat and a dragon flying...be careful and enjoy ;)

I update in 3rd level a square that go down in 5 and 5 seconds.",2980392,https://cdn2.scratch.mit.edu/get_image/project/237404612_480x360.png,2018-07-25T22:33:33.000Z,2018-07-25T22:43:11.000Z,2018-07-25T22:41:24.000Z,2,0,0,0,0,,
237415780,Getting Unstuck Day 9 copy-2,"My idea was to have the bear go across different colors which would then change the costume, but I can't seem to get it to work quite right. I attempted it with a number of different backdrops to see if I needed more of a color block, but I think I will have to do a bit more research to get it how I would like.","Challenge: Create a project that involves the touching color blocks in the Sensing category (i.e., touching color? and color is touching?). For example, you could have a sprite moving around on a colorful background, with the sprite behaving differently depending on which color it is touching, like in a maze game.",34245752,https://cdn2.scratch.mit.edu/get_image/project/237415780_480x360.png,2018-07-26T00:54:12.000Z,2018-07-26T01:03:42.000Z,2018-07-26T01:03:42.000Z,1,0,0,0,0,,
236968184,Question and Answer- Day 20,I added more to my Day 16 Project- Create a program that answers the user's questions.,"Press the green flag and answer the duck's questions with Yes or No.

",25165723,https://cdn2.scratch.mit.edu/get_image/project/236968184_480x360.png,2018-07-20T19:59:21.000Z,2018-07-26T13:55:23.000Z,2018-07-20T20:20:30.000Z,6,2,0,0,0,,
237429819,Getting Unstuck Day 20,"Getting Unstuck Day 20 Reflection:
I used the original version of this for Day 7.  I didn't like how my hexagon turned out, but that turned out to be a much easier fix than I expected it to be.  I decided to try creating other shapes and see if I could figure out how to make the shapes appear in different places (and disappear so the screen didn't get too cluttered).  The more time I spend on it, the more things I want to refine.  I think that's the point of today's challenge, though.  :)
",Press the green flag to start drawing a hexagonal spirograph.  Press the spare bar to clear the stage.,30095573,https://cdn2.scratch.mit.edu/get_image/project/237429819_480x360.png,2018-07-26T03:43:54.000Z,2018-07-26T04:24:39.000Z,2018-07-26T04:24:39.000Z,1,0,0,0,0,,
236629030,Unstuck 10,"This Project would definitely need a revision. I would really love to make music with instruments!
",,13846307,https://cdn2.scratch.mit.edu/get_image/project/236629030_480x360.png,2018-07-17T12:30:51.000Z,2018-07-26T09:03:16.000Z,2018-07-17T12:49:33.000Z,5,0,0,0,0,,
237453713,Day 20 of Getting Unstuck_Day 19 of Getting Unstuck copy,Day 20 of Getting Unstuck remixare un nostro progetto,Clicca la bandierina verde e....clona!!!,10086796,https://cdn2.scratch.mit.edu/get_image/project/237453713_480x360.png,2018-07-26T10:24:42.000Z,2018-07-26T11:38:30.000Z,2018-07-26T11:37:43.000Z,8,1,0,0,0,,
237476935,Getting Unstuck disegni copy per day #20,"#GettingUnstuck giorno 20
Scegli uno dei tuoi progetti da un giorno precedente e rivedilo.
Ho scelto il Progetto disegni del giorno 7 per poter utilizzare la funzione ""crea blocco"" e definire il disegno stella.",clicca sulla bandierina verde,17320587,https://cdn2.scratch.mit.edu/get_image/project/237476935_480x360.png,2018-07-26T16:07:39.000Z,2018-07-26T16:28:53.000Z,2018-07-26T16:28:15.000Z,3,1,0,0,0,,
237480844,Getting Unstuck Day 20 - revisit,"Getting Unstuck Day 20: choose one of your projects from a previous day of Getting Unstuck, make a copy of it, and revise it.

For this project I revisited an earlier game I made for Day 9 and 18. There was some code that I couldn't get working properly (the food sensing the ant and assigning points based on the costume). I had put a request in the forum and had some good advice. I still couldn't get the code working and gave up. Because the Scratchers giving me advice were ALOT more experienced than I, I figured they must know what they are talking about and the code should work. So I decided to revisit this same project, determined to figure out the code. After looking at it I found the problem (conflicting actions) and was able to make it work, just like they said it should!

I think several things worked:
1) I needed the break from the pervious day to see it all with fresh eyes
2) determination, knowing that the code SHOULD work. Therefore there was a problem somewhere that I needed to find
3) help from others","Press the green flag to get started. Your objective is to gather as many food pellets as possible to take to the feeding center.

Use the arrow keys to move the ant through the maze.

Red pellets = kills the ant and stops all action
Yellow/green = +1 point
Purple/pink = -1 point",2803184,https://cdn2.scratch.mit.edu/get_image/project/237480844_480x360.png,2018-07-26T16:58:37.000Z,2018-07-26T17:45:11.000Z,2018-07-26T17:36:48.000Z,3,0,0,0,0,,
237510660,Day - 20 Le Petit Prince revisited,"I worked with the Day 8 project to investigate different approaches to automating animation. 

Day 20 - Second, choose one of your projects from a previous day of Getting Unstuck, make a copy of it, and revise it. What's something about the project that would benefit from more time or fresh eyes? ",Click the flag to start,109272,https://cdn2.scratch.mit.edu/get_image/project/237510660_480x360.png,2018-07-26T23:50:53.000Z,2018-08-01T21:53:37.000Z,2018-07-26T23:52:10.000Z,6,4,1,0,0,,
188333934,ProgettoAdozione,,,13575540,https://cdn2.scratch.mit.edu/get_image/project/188333934_480x360.png,2017-11-23T09:19:06.000Z,2018-05-30T08:15:26.000Z,2018-05-10T18:00:01.000Z,5,0,0,0,0,,
237646149,Getting Unstuck Day 16 copy Day 20,,"Click sprite and you will be prompted to ask a question.  See what random response you get!

For Day 20 I revisited this project.  I tested an if then statement and the operator blocks.  This project could further be revisited by looking at gathering the responses into a final statement.",34190765,https://cdn2.scratch.mit.edu/get_image/project/237646149_480x360.png,2018-07-28T20:08:07.000Z,2018-07-28T20:21:17.000Z,2018-07-28T20:20:02.000Z,2,0,0,0,0,,
237716269,Unstuck Day 20 project copy,"I finally figured out one way to get the sprite to follow the mouse x coordinate only when I want to: I used boolean operators to permit the sprite to move only if the cursor is within a certain y coordinate value. I'm sure there are other ways to do this, but this one works and I was happy to add it to the project.

The new problem I had was assigning notes to the values of the x axis. I tried unsuccessfully to come up with a formula to solve it for me, so I ended up using lots of ""if x is greater than m and less than n, then play note p"" which was tedious, but hey, it works!

Unstuck Challenge Day 3 remixed for Day 20 #CreativeComputing","Drag the Scratch cats along the black lines to change the note!

The bottom line plays low notes, the middle line plays notes in the middle, and the top line plays high notes.

Press ""play chord"" to hear all 3 notes (low, middle, and high) together!",17786521,https://cdn2.scratch.mit.edu/get_image/project/237716269_480x360.png,2018-07-30T00:53:10.000Z,2018-07-30T02:51:16.000Z,2018-07-30T02:45:27.000Z,3,0,0,0,0,,
237740402,Unstuck Day 20,"I have a copy of my previous project day before, and revise it. I make it more colorful. ",,34216021,https://cdn2.scratch.mit.edu/get_image/project/237740402_480x360.png,2018-07-30T07:20:46.000Z,2018-07-30T07:23:12.000Z,2018-07-30T07:21:56.000Z,2,0,0,0,0,,
237785728,Getting Unstuck Day 20,"Getting Unstuck Day 20: Revise a previous project

When I first made this project on Day 5, I was able to figure out how to get the fish to reappear to keep the cycle going. Now after ""fresh eyes"" I was able to to get the fish to reappear every time. 

In honor of Shark Week 2018, I created a project to show how a great white shark feeds on their prey. 
. ",Click the green flag. ,10722024,https://cdn2.scratch.mit.edu/get_image/project/237785728_480x360.png,2018-07-30T18:51:03.000Z,2018-07-30T19:04:02.000Z,2018-07-30T18:56:54.000Z,4,1,0,0,0,,
235824121,Getting Unstuck Day 20 / Day 4,"I decided to use my day 4 project and develop it into a Very Hungry caterpillar story. I had great fun drawing the fruit.
The thing that I struggled with is getting the fruit to disappear when it is ""eaten""","Click the green flag to start.
Use the arrow keys to get the caterpillar to eat the fruit",3297086,https://cdn2.scratch.mit.edu/get_image/project/235824121_480x360.png,2018-07-08T14:10:50.000Z,2018-07-31T11:28:02.000Z,2018-07-08T14:31:03.000Z,22,6,1,0,0,,
237852135,Day 20 - Revision of Day 2,I used clones to make copies of the original flower. It just came natural to clone and move the new clone to the mouse position on the screen.,Just click the green flag and see what happens.,24154277,https://cdn2.scratch.mit.edu/get_image/project/237852135_480x360.png,2018-07-31T11:04:22.000Z,2018-07-31T11:14:07.000Z,2018-07-31T11:13:15.000Z,2,1,0,0,0,,
237869452,ALBERI OVUNQUE copy,"Getting Unstuck: Day 20 /day19

Creare 
First, create a studio and add all of your Getting Unstuck projects to it. Second, choose one of your projects from a previous day of Getting Unstuck, make a copy of it, and revise it. What's something about the project that would benefit from more time or fresh eyes? 

Potreste far passare ad altro schermo con altre trasformazioni per evitare il surriscaldamento globale",PORTA LA STELLA SULL'AUTO,21462276,https://cdn2.scratch.mit.edu/get_image/project/237869452_480x360.png,2018-07-31T15:18:05.000Z,2018-07-31T16:20:41.000Z,2018-07-31T15:40:27.000Z,3,1,0,0,0,,
237869558,Getting Unstuck: Day 20 copy of Day 15,"Getting Unstuck: Day 20 copy of Day 15
Challenge: choose one of your projects from a previous day of Getting Unstuck, make a copy of it, and revise it. What's something about the project that would benefit from more time or fresh eyes? 

This note was for Getting Unstuck: Day 15
Challenge: create a project that shows different backgrounds depending on how loud the room is.
Thanks to a project, I don't remember the name of the owner; I made the volume variable but now quite nothing works anymore.

Note for Getting Unstuck: Day 20
I looked other projects and I modified some block, now it's working better.
","Are you ready for a new experience? Look and listen!
Turn on the computer microphone.
Click on green flag to start. ",17615581,https://cdn2.scratch.mit.edu/get_image/project/237869558_480x360.png,2018-07-31T15:19:21.000Z,2018-07-31T16:07:48.000Z,2018-07-31T16:07:47.000Z,2,1,0,0,0,,
237856915,Getting Unstuck Day 20,"Made for the Getting Unstuck Day 20 activity which was to revisit an earlier project. In this case it was the one I did for day 2.
For this revision I added a slider so that the user can choose the line width of the flower. I also added a random element for the size of the flower.

Notes for the original, Day 2 project.
Inspired by Seymour Papert and Turtle Logo I thought I would use the pen tools and draw things that are a bit like crystal flowers. When doing any Logo I'm always reminded of a photo in the MIT museum of Seymour with one of the big early turtles.

I started with drawing the flowers in a random place but this felt a little strange so I changed it to draw at the mouse pointer to give the user more control. The random block is still there though, if you want to give it a try.
The next thing I'd like to do is let the user choose a colour from a palette. Maybe choose the line thickness as well.
","Click the Green Flag.
Click anywhere on the background to draw a flower.",287832,https://cdn2.scratch.mit.edu/get_image/project/237856915_480x360.png,2018-07-31T12:45:20.000Z,2018-07-31T20:04:48.000Z,2018-07-31T13:02:17.000Z,3,1,0,0,0,,
