id,title,description,instructions,author/id,image,history/created,history/modified,history/shared,stats/views,stats/loves,stats/favorites,stats/comments,stats/remixes,remix/parent,remix/root
237951449,#GettingUnstuck20 - Revising a project,"All sprites taken from the Scratch repository.

The URL to my #GettingUnstuck Studio is https://scratch.mit.edu/studios/5271929.

Please, feel free to remix anything you want and add a comment there!","Click the green flag and follow the instructions.

This project is part of #GettingUnstuck initiative #CreativeComputing, Day 20

""First, create a studio and add all of your Getting Unstuck projects to it. Second, choose one of your projects from a previous day of Getting Unstuck, make a copy of it, and revise it. What's something about the project that would benefit from more time or fresh eyes?""

I decided to revise this project (https://scratch.mit.edu/projects/236953553/) because the broadcasting isn't the best. Finally, I removed the broadcast blocks because they were not needed, and changed some small things (like counting the clones).",1112440,https://cdn2.scratch.mit.edu/get_image/project/237951449_480x360.png,2018-08-01T10:35:48.000Z,2018-08-01T10:48:17.000Z,2018-08-01T10:45:09.000Z,3,1,0,0,0,40896812,40896812
237994958,Would you dance with me? Day 20 Getting Unstuck  copy Day 6,"Getting Unstuck Day 20: choose one of your projects from a previous day of Getting Unstuck, make a copy of it, and revise it.

","Click on the green flag and read the balloons.
Remix: I changed the sprite and I add motion blocks.",8789156,https://cdn2.scratch.mit.edu/get_image/project/237994958_480x360.png,2018-08-01T21:01:25.000Z,2018-08-01T21:11:38.000Z,2018-08-01T21:11:38.000Z,2,1,0,0,0,,
238036264,#Unstuck 20 Clones copy,I needed to search up how to make a clone. Thank you to this Ytube clip https://www.youtube.com/watch?v=MU65TYkd6l4 ,Have you ever got sick of these pesty things. Wait and see what I am talking about. It feels like this winter has brought more and more. Revised this so it looked more like the slatters grew as they touched the wood.,31492686,https://cdn2.scratch.mit.edu/get_image/project/238036264_480x360.png,2018-08-02T05:52:15.000Z,2018-08-02T06:40:40.000Z,2018-08-02T06:39:35.000Z,3,1,0,0,0,,
238040541,Día 20,"Improve the sound so that it does not lock, I added illustrations and programming to the center.",,34199235,https://cdn2.scratch.mit.edu/get_image/project/238040541_480x360.png,2018-08-02T07:03:44.000Z,2018-08-02T07:08:34.000Z,2018-08-02T07:04:24.000Z,4,2,0,0,0,,
238112547,Getting Unstuck: Day 20. Play color_REVISE of day 16,"As in the original project, if the cat touch in a point of separation between two colors, it doesn't recognize the color which it's touching. Can anyone have a possible solution?",Click on the green flag and play with colors.,18190669,https://cdn2.scratch.mit.edu/get_image/project/238112547_480x360.png,2018-08-03T01:38:06.000Z,2018-08-03T02:26:06.000Z,2018-08-03T02:21:09.000Z,6,1,0,0,0,,
238144274,getting Unstuck day 20,"I have learn to use variables to the password be random number.
I have make two levels
hi have chosen this proyect becose i like more scaperoom",,23020553,https://cdn2.scratch.mit.edu/get_image/project/238144274_480x360.png,2018-08-03T10:51:07.000Z,2018-08-03T17:51:56.000Z,2018-08-03T11:31:37.000Z,3,1,0,0,0,,
238295645,Color Mix copy getting Unstuck 19,"An interactive project to teach color mixing to children. Many of them don't know what happens when mixing colors. This can be followed by an art project using real paints!
Use of Cloning and sensing blocks- week 4 activity - CCOW
I finally finished this project that I ad begun one year before. I'd like to make different combinations of colors each time/each level but only now I  solved the problem. H","Click on the green flag to start, and each time you want to add color.
Wait until the last drop is fallen before clicking the next color.

Getting Unstuck - After practicing a lot of cloning, I decided to use what I've learned with this project I had made some time ago and had 
eliminated some bugs from it using cloning mow> Much easier!
",2176961,https://cdn2.scratch.mit.edu/get_image/project/238295645_480x360.png,2018-08-05T23:14:23.000Z,2018-08-06T01:51:52.000Z,2018-08-06T01:47:50.000Z,4,1,0,0,0,,
238341989,Getting Unstuck - dag 20,"#GettingUnstuck

Added a little sound","Use the arrowkeys to move the shark. He is hungry and wants to eat the fish, can you help him? He needs 10 fish in all.",25631396,https://cdn2.scratch.mit.edu/get_image/project/238341989_480x360.png,2018-08-06T11:15:32.000Z,2018-08-06T11:16:24.000Z,2018-08-06T11:16:05.000Z,3,1,0,0,0,,
238274422,day-20 Orologio analogico remix day-10 revise,,"muovi le lancette per l'orario in formato analogico e apparirà in formato digitale. (primi h per muovere la lancetta delle ore, m per quella dei minuti e s per i secondi)",16822769,https://cdn2.scratch.mit.edu/get_image/project/238274422_480x360.png,2018-08-05T14:09:59.000Z,2018-08-06T14:18:27.000Z,2018-08-06T14:11:16.000Z,3,1,0,0,0,178819466,178819466
238386089,Unstuck #20- Explosive Drawing!! REVISED,Remix of Unstuck #7,"Mouse position affects the drawing. 
Timer clears the screen every once in awhile.

Try moving the cursor slowly.",26618044,https://cdn2.scratch.mit.edu/get_image/project/238386089_480x360.png,2018-08-06T22:49:03.000Z,2018-08-06T23:18:08.000Z,2018-08-06T23:13:53.000Z,2,1,0,0,0,,
238449484,day20,"First, create a studio and add all of your Getting Unstuck projects to it. Second, choose one of your projects from a previous day of Getting Unstuck, make a copy of it, and revise it. What's something about the project that would benefit from more time or fresh eyes? ","use the  right up and down arrows to move the parrot
avoid the dragon",24618980,https://cdn2.scratch.mit.edu/get_image/project/238449484_480x360.png,2018-08-07T14:31:57.000Z,2018-08-07T15:55:28.000Z,2018-08-07T15:32:14.000Z,2,1,0,0,0,,
238557218,Crash and jump (Getting Unstuck #20),"Getting Unstuck challenge #20 - ""First, create a studio and add all of your Getting Unstuck projects to it. Second, choose one of your projects from a previous day of Getting Unstuck, make a copy of it, and revise it. What's something about the project that would benefit from more time or fresh eyes? "".

My original version of this (for activity#5) used glide for all the movement of both the rocket and the alien. I saw some great examples of how to ""jump"" in other people's work so updated the alien jump based on that. 

Other future enhancements:
- change rocket flight (it is still basic).
- fix the fact sprite is upside down after bouncing off edge
- fix odd higher jump when bouncing off side (might be due to costume area?)",Press SPACE to lift off and watch how things go.,15872912,https://cdn2.scratch.mit.edu/get_image/project/238557218_480x360.png,2018-08-08T16:42:57.000Z,2018-08-08T17:32:52.000Z,2018-08-08T17:32:25.000Z,1,0,0,0,0,,
238523570,Getting Unstuck - Day 20,"The Getting Unstuck Challenge for day 20 was to copy and revise a previous day's project.  I chose my project from day 9, which was to create a project that uses the ""touching color"" block.  It was originally just the first backdrop, so I extended it to two maze screens and added the variable to keep track of how many times Scratch hits the wall (touches black).

My new version now  also includes challenges from several of the previous days!

Day 19 - Use the ""create a clone"" block
Day 14 - Use the ""join"" block
Day 12 - Have 3 separate scenes
Day 8 - Create a variable to keep track of the number of times something happens
--------------------------------------------------------------------------------------------------
The Getting Unstuck Challenge for day 9 was: ""Create a project that involves the touching color blocks in the Sensing category (i.e., touching color? and color is touching?). For example, you could have a sprite moving around on a colorful background, with the sprite behaving differently depending on which color it is touching, like in a maze game.""

","Click the green arrow to start the maze.

Use the arrow keys to guide Scratch the Cat through the maze.  If you touch any of the walls Scratch will turn around and move back.

Click the green arrow to start over.",24696341,https://cdn2.scratch.mit.edu/get_image/project/238523570_480x360.png,2018-08-08T07:21:43.000Z,2018-08-08T19:24:00.000Z,2018-08-08T19:13:44.000Z,1,0,0,0,0,,