id,title,description,instructions,author/id,image,history/created,history/modified,history/shared,stats/views,stats/loves,stats/favorites,stats/comments,stats/remixes,remix/parent,remix/root
237025511,Challenge17MadLib,"When I first saw the challenge to do something with a user imputted list of words, my first thought was ""mad libs."" So this is the result of that inspiration. ",Click the green flag and play mad libs.,2190314,https://cdn2.scratch.mit.edu/get_image/project/237025511_480x360.png,2018-07-21T17:40:41.000Z,2018-07-21T17:41:59.000Z,2018-07-21T17:41:09.000Z,16,7,0,0,0,,
237025012,Ticket Kiosk,"Unstuck Challenge 17: Create a project that asks the user to type in multiple words or numbers, stores the items in a list, then does something interesting with the items from the list.",Click on the green flag to start.,25332755,https://cdn2.scratch.mit.edu/get_image/project/237025012_480x360.png,2018-07-21T17:30:53.000Z,2018-07-21T17:57:20.000Z,2018-07-21T17:56:26.000Z,15,5,0,0,0,,
237011148,And if ...,"Idea liberamente tratta da la Grammatica della fantasia che dedica alla scrittura creativa molte indicazioni e giochi da sviluppare a scuola.
Grazie a Gianni Rodari
Scegliere un capitolo che si potesse animare con Scratch è stata la mia sfida personale oggi.","Giochiamo con delle ipotesi per suggerire situazioni fantastiche e sviluppare storie. 
Clicca sulla bandiera verde. Premi il tasto ""a"" per la lingua inglese e il tasto ""b"" per la lingua italiana. Se vuoi, ""c"" per aggiungere una tua idea.

Let's play with hypotheses to suggest fantastic situations and develop stories. 
Click on the green flag. Press the ""a"" button for the English language and the ""b"" button for the Italian language.  Click on ""c"" to add ypur ideas.

",11312120,https://cdn2.scratch.mit.edu/get_image/project/237011148_480x360.png,2018-07-21T12:20:26.000Z,2018-07-22T17:06:05.000Z,2018-07-21T17:24:59.000Z,14,0,0,0,0,,
237023893,Tell me a capital,Getting Unstuck: Day 17,"Abby ask for name of capitals: If she doesn't know it, she ask for the name of the country, and save it in her memory. If she knows the capital she tells you the name of its country",2143382,https://cdn2.scratch.mit.edu/get_image/project/237023893_480x360.png,2018-07-21T17:06:08.000Z,2018-07-21T21:02:12.000Z,2018-07-21T18:13:35.000Z,14,5,0,0,0,,
237016473,Getting Unstuck #17: Greek Olympiad in Informatics: ,"Special thanks to Scratch wiki editors for providing useful tips here: http://wiki.scratch.mit.edu/wiki/List

Day #17 Challenge of ""Getting Unstuck"" project of the Creative Computing Lab at the Harvard Graduate School of Education: Create a project that asks the user to type in multiple words or numbers, stores the items in a list, then does something interesting with the items from the list.","Press the green flag and then, the spacebar to continue.

The program prompts you to enter numbers which represent pupils' heights and stores them in a list. Then, it finds the total number of students who can see the school cafeteria while they are standing in line. 
This Scratch project implements the same efficient algorithm which solves the programming exercise that is described here: http://www.pdp.gr/files/27A/PDP_27_A.pdf. Normally, these kind of exercises have a C++ implementation.",1202362,https://cdn2.scratch.mit.edu/get_image/project/237016473_480x360.png,2018-07-21T14:24:05.000Z,2018-07-21T18:43:30.000Z,2018-07-21T14:58:48.000Z,8,2,0,0,0,,
237018549,EuropeanCountries,,"Playing words - you need to name a country whose name begins with a certain letter.
The names are entered in lowercase Latin letters with no spaces.
When searching the letter ""y"" is equated to the letter ""i"".
If you lose, could not find the right word - enter ""lost""",139209,https://cdn2.scratch.mit.edu/get_image/project/237018549_480x360.png,2018-07-21T15:09:19.000Z,2018-07-21T18:39:37.000Z,2018-07-21T18:39:37.000Z,14,6,2,0,0,,
121233654,Getting Unstuck 17,"Trying to get caught up, so this is a little bit of a cheat... 

I started this project quite a while ago, with the original intent of the task of creating a shopping list as a lab for my computer science students. I never got around to finishing or assigning it so today seems like a good day to resurrect it!

Thanks to @Listwizard for posting a project to show how to delete items from a list!",Click the green flag to run the shopping list app.,18044195,https://cdn2.scratch.mit.edu/get_image/project/121233654_480x360.png,2016-09-14T19:48:31.000Z,2018-07-21T19:44:06.000Z,2018-07-11T21:43:52.000Z,16,8,1,0,0,,
237022047,Magnetic Poetry (Unstuck 17 ),"I started with one of my previous entries with the goal of creating an experience that would evolve and change over time as more people participated. 

There are some ""workarounds"" that emulate cloud lists in a way, but I don't think that's what I'll do.","This started as an experiment in making a community created list that would be incorporated into poems, but there's no cloud list feature. (Maybe one day...)

For now, it will have to stay a humble fridge poetry creator that accepts user input. Enjoy!",27690149,https://cdn2.scratch.mit.edu/get_image/project/237022047_480x360.png,2018-07-21T16:24:56.000Z,2018-07-21T21:52:10.000Z,2018-07-21T20:31:52.000Z,14,7,0,0,0,,
237028270,Day 17: (v2) Sum of Three Positive One-Digit Numbers,"What I was was trying to accomplish here . . . 
This second version has dialogue that considers many options; response when user doesn't press space bar to begin, when user types nonsense, when user types numbers other than whole numbers from 1-9, and when user types different variations of ""yes"" or ""no"" responses (e.g. yes/YES/Y/y)to continue. It was far more complicated than it needed to be, but I wanted to practise using many of the skills introduced in recent challenges, like broadcast, strings, lists, and answer boxes.  Some coding mistakes I have been making include incorrect use of blocks with ""and wait"" phrasing, and confusion over when to use answer boxes, variable boxes and how to effectively use lists.  My code made use of several lists with one number in them and a list to add the other lists.  I would much prefer to enter three numbers into one list and find the total of items in that list (but am happy to save that task for another day). Still not sure about the purple ""Make a block"" and ""Add an Extension"" blocks.  Not fancy, but I like it :)","Create a project that asks the user to type in multiple words or numbers, stores the items in a list, then does something interesting with the items from the list.

Press the green flag to begin.",18337230,https://cdn2.scratch.mit.edu/get_image/project/237028270_480x360.png,2018-07-21T18:41:44.000Z,2018-07-22T00:38:24.000Z,2018-07-21T20:46:46.000Z,9,3,0,0,0,,
237015611,Getting Unstuck: Day 17,"This is my project for Day 17 of the Getting Unstuck programming challenge. My biggest challenge was to replicate an algorithm I studied in the University using the minor number of blocks. If I had some more time I would have added some animations to the wizard and to the background.

Challenge archive:
https://us18.campaign-archive.com/home/?u=5dd4d8b32f719a30cbde507c6&id=cc0b423621","Create a project that asks the user to type in multiple words or numbers, stores the items in a list, then does something interesting with the items from the list.

Press the green flag and the wizard will generate 10 random numbers. Press the SPACE button and the wizard will do the magic: he will order them all!",34314391,https://cdn2.scratch.mit.edu/get_image/project/237015611_480x360.png,2018-07-21T14:06:08.000Z,2018-07-21T21:05:41.000Z,2018-07-21T21:00:22.000Z,16,7,3,0,0,,
237034597,Unstuck Day 17,I usually have my students create a similar program about finding the average of test scores. I thought I would improve on this idea by bringing in science and math (the fish's swim speed is roughly based on the water temperature!),"Click the green flag for directions.
This fish is helping with temperature data! Enter five temperatures (in degrees Faherenheit) and she will calculate the average and standard deviation (if I programmed it correctly!!)",11305008,https://cdn2.scratch.mit.edu/get_image/project/237034597_480x360.png,2018-07-21T21:17:35.000Z,2018-07-21T21:20:50.000Z,2018-07-21T21:20:50.000Z,4,3,0,0,0,,
237014165,Make it brighter!  Getting Unstuck Day 17,"Getting Unstuck: Day 17 - Create a project that asks the user to type in multiple words or numbers, stores the items in a list, then does something interesting with the details from the list. 

I got stuck today! Many hours with this project. I thought I would not unstuck of it :). 
I had a crazy idea of trying to use two lists to get what I first wanted. It did not work and it is not very beautiful, but I learned a lot more about lists and variables.","Click on the green flag and follow the prompts.

",2176961,https://cdn2.scratch.mit.edu/get_image/project/237014165_480x360.png,2018-07-21T13:32:33.000Z,2018-07-21T22:13:31.000Z,2018-07-21T22:03:10.000Z,7,2,0,0,0,,
237034181,Getting Unstuck Challenge 17- Cluedo!,"I have seen lists used to create inventories and my thoughts turned to  the game cluedo.
I used it as inspiration to create my project. Hence the strange looking costume trying to emulate a Cluedo token!
Assuming the player has gathered all the clues, they can give their answers to the ""detective"" Scratch.
I think there is an easier way to add the answers to the final link, perhaps through using data, but I think it works for now!
I would like to spend more time perhaps adding clipart to match responses. I would also like to add an alternative response if the guesses are wrong - perhaps matching a random created list? - Starting to get tricky here!
 I played with making the ""detective"" have animated talk, but again I will come back to this one day....!","Click the green flag.
Enter your answers.",13484475,https://cdn2.scratch.mit.edu/get_image/project/237034181_480x360.png,2018-07-21T21:07:04.000Z,2018-07-22T01:53:25.000Z,2018-07-21T22:14:43.000Z,8,1,0,0,0,,
237027976,Getting Unstuck Day 17,"Getting Unstuck Day 17
Grazie al progetto  @maths77680 ho pensato di riprodurre in scratch un semplice gioco matematico ( :",Clicca sulla bandierina e rispondi alle domande!,15572972,https://cdn2.scratch.mit.edu/get_image/project/237027976_480x360.png,2018-07-21T18:35:40.000Z,2018-07-22T07:40:57.000Z,2018-07-21T22:13:37.000Z,13,4,2,0,0,,
237036490,The Big 5-0_GU_Day17,"Next month I am going to celebrate ""the big five-0"" (not my age)! I have visited 49 states...only 1 to go. When we get to South Dakota, we need to choose our activities each day. Hopefully, we will do everything included in the project, plus more!

Credits:
http://www.blackhillsbadlands.com/parks-monuments","Click on the green flag to begin.
Click on the sprite to choose where to go.

Eeek! When I pressed share, my entire project disappeared except the instructions, notes and credits. All of my backgrounds (11 of them), my hand-drawn sprite (a first for me), my list and all of the coding is GONE! ",24741621,https://cdn2.scratch.mit.edu/get_image/project/237036490_480x360.png,2018-07-21T22:08:34.000Z,2018-07-21T23:02:18.000Z,2018-07-21T22:52:20.000Z,7,0,0,0,0,,
237040903,Unstuck 17 Lists - MadLib Story,"Ay-ay-ay. I fell down another deep deep hole with this project but managed to get to the beach today also :-) I had hoped to ake this dynamic enough to be able to plug in a new story easily, but didn't quite get that far. If I had to do this again I would make more custom blocks as I was getting very confused with all the list positioning counters. It took me a long time to find a bug in my SubString custom block.
Another improvement would be to somehow display the whole story all at once, like a printed paper with the missing words filled in. 
","Create a project that asks the user to type in multiple words or numbers, stores the items in a list, then does something interesting with the items from the list.

>>I only had time to do one story - only the green button works!
",19123745,https://cdn2.scratch.mit.edu/get_image/project/237040903_480x360.png,2018-07-22T00:08:57.000Z,2018-07-22T00:19:41.000Z,2018-07-22T00:14:14.000Z,16,4,2,0,0,,
237038788,Getting Unstuck Day 17,"This was tricky.  Not as pretty as I would like, but I am proud of myself for persevering and accomplishing this challenge.",Just click the green flag and answer cat's questions to discover your lucky number.,24826697,https://cdn2.scratch.mit.edu/get_image/project/237038788_480x360.png,2018-07-21T23:12:55.000Z,2018-07-22T00:17:44.000Z,2018-07-22T00:16:02.000Z,5,3,0,0,0,,
237035778,Superhero name generator,"Today's challenge took me less time than others. I've learned another way to use the list block.
I've created a simple name generator.

I'd like to add more words to have more nicknames, so any suggestions are welcomed.


","Press the green flag to start.
Write a color or adjective and then you'll get a super cool name.
Press Down arrow key to see your words.


                              ---Getting Unstuck Day 17---
""Create a project that asks the user to type in multiple words or numbers, stores the items in a list, then does something interesting with the items from the list.""",4413079,https://cdn2.scratch.mit.edu/get_image/project/237035778_480x360.png,2018-07-21T21:48:58.000Z,2018-07-22T19:30:12.000Z,2018-07-22T00:50:26.000Z,15,3,0,0,0,,
237040280,Day 17,"I had fun with this! I hadn't used lists like this before, it was good to have a reason to do so.",Click on the green flag and be prepared to answer some personal questions.,32833725,https://cdn2.scratch.mit.edu/get_image/project/237040280_480x360.png,2018-07-21T23:53:29.000Z,2018-07-22T01:06:02.000Z,2018-07-22T01:05:29.000Z,5,2,0,0,0,,
237043342,Unstuck Day 17: Party planning,"I used the DK book ""Help your Kids with Computer Coding"" to learn how to get the items added to the list from the user.  Then, I remixed a bit of WhaeaJR's code to give the responses at the end.",Click the green flag to give Cassy some ideas on what to get for her party.,34190490,https://cdn2.scratch.mit.edu/get_image/project/237043342_480x360.png,2018-07-22T01:07:48.000Z,2018-07-22T01:34:31.000Z,2018-07-22T01:29:51.000Z,5,2,0,0,0,,
237044140,Chord Variations,"Thanks to @jsh for uploading the vibe sounds in another Getting Unstuck project

Photo from amazon.com","Green flag, then follow Ludwig's instructions",27306974,https://cdn2.scratch.mit.edu/get_image/project/237044140_480x360.png,2018-07-22T01:26:11.000Z,2018-07-22T03:21:48.000Z,2018-07-22T03:21:48.000Z,14,6,2,0,0,,
237048554,UnStuck Day 17,I would like to debug it so that only the room that you add to the list shows and then you return to the first screen to add another word to the list. ,Click the Cat each time you want to add a room to design your home.,14232182,https://cdn2.scratch.mit.edu/get_image/project/237048554_480x360.png,2018-07-22T03:10:52.000Z,2018-07-22T03:41:24.000Z,2018-07-22T03:41:24.000Z,8,2,0,0,0,,
237049323,Wizard's Work,This was simple enough. The lists will get quite long so I'll probably have to add a replace item block or delete them.,"Start by clicking on the green flag, then follow directions.",30508500,https://cdn2.scratch.mit.edu/get_image/project/237049323_480x360.png,2018-07-22T03:31:34.000Z,2018-07-22T04:27:15.000Z,2018-07-22T04:27:15.000Z,2,1,0,0,0,,
237020822,Getting Unstuck Day 17 - ,,Click the green flag and follow the prompts ,18558561,https://cdn2.scratch.mit.edu/get_image/project/237020822_480x360.png,2018-07-21T15:59:23.000Z,2018-07-23T15:46:30.000Z,2018-07-22T06:09:02.000Z,5,1,0,0,0,,
237055575,Getting Unstuck Day 17,The inspiration came to me thinking about the BeeBot and some images I saw on pinterest. I designed the vector graphics with Adobe Illustrator.,"This works like a BeeBot: click on the orange botton (turn right, turn left, go straight on, turn back) and then press GO. Enter all the steps at once, to get to the flower.",14159575,https://cdn2.scratch.mit.edu/get_image/project/237055575_480x360.png,2018-07-22T06:33:30.000Z,2018-07-22T07:57:43.000Z,2018-07-22T06:34:02.000Z,19,11,4,0,0,,
237056721,Day 17 of Getting Unstuck,,Premere la bandierina verde e scrivi tutti e 8 i pianeti,10086796,https://cdn2.scratch.mit.edu/get_image/project/237056721_480x360.png,2018-07-22T07:06:58.000Z,2018-07-22T07:35:01.000Z,2018-07-22T07:35:00.000Z,12,1,0,0,0,126425010,126425010
237061440,Scratch 3 letter anagrammer fixed ,"I am having nightmares with my internet as on the move. 4 letters kept crashing.
There must be a neater way to make the anagrams?
Plus I wanted to make a list of the answers but have no more time and don't know how.
Fixed now but stuck to 3 letters as internet so bad!",,33472226,https://cdn2.scratch.mit.edu/get_image/project/237061440_480x360.png,2018-07-22T09:09:08.000Z,2018-07-24T18:43:09.000Z,2018-07-24T18:43:09.000Z,3,2,0,0,0,,
237059188,unstuck17,The hardest part was to get a different friend every time the spacebar is pressed. I made a second list to store the random numbers. But its not working very smoothly,"The Scratchcat meets random friends.
Press spacebar to meet one ",1072279,https://cdn2.scratch.mit.edu/get_image/project/237059188_480x360.png,2018-07-22T08:09:11.000Z,2018-07-22T09:43:11.000Z,2018-07-22T09:35:44.000Z,10,3,1,0,0,,
237070048,Getting Unstuck: Day 17 in english,"Getting Unstuck: Day 17
Challenge: Create a project that asks the user to type in multiple words or numbers, stores the items in a list, then does something interesting with the items from the list.
For me it was a very difficult task. Thanks to various projects seen in recent days and in particular to that of Juf-Pinky, I managed to make a project even if very simple.",Click on green flag and follow the instructions. ,17615581,https://cdn2.scratch.mit.edu/get_image/project/237070048_480x360.png,2018-07-22T13:08:45.000Z,2018-07-22T14:33:28.000Z,2018-07-22T13:18:06.000Z,8,1,1,0,0,,
237069924,Computer Lab Clean Up,"I struggled a bit with this. I was able to get it work if you answer all five answers, typed with the exact words (Steps include: quit, close windows, log off, shut down, push in chair). I tried making it so that you would get different feedback if you miss a step, but it's not working.  Can anyone please help?

Also - is there a way to have it respond if the answer the answer includes the word, but not typed exactly - for example 'close your windows' instead of 'close windows'? I would anticipate that students might not necessarily type the exact wording.

Image: https://zh.wikipedia.org/wiki/File:AIUB_Computer_Lab_2.jpg
",Click on the Green Flag and answer questions to review the computer lab clean up procedure. Hint below in the Notes and Credits section...,1196430,https://cdn2.scratch.mit.edu/get_image/project/237069924_480x360.png,2018-07-22T13:05:42.000Z,2018-07-25T13:35:13.000Z,2018-07-22T14:18:58.000Z,7,1,0,0,0,,
237048548,Scratch Cat Mad Lib Theater,Back ground image: Tonight Show Mad Lib Theater,Click the green flag to start.,17257831,https://cdn2.scratch.mit.edu/get_image/project/237048548_480x360.png,2018-07-22T03:10:48.000Z,2018-07-22T14:23:44.000Z,2018-07-22T14:22:48.000Z,6,3,0,0,0,,
237073724,Day 17: Alien Language translation Version 2,"UPDATE:  Finally got this project working with lots of help.  See the new project https://scratch.mit.edu/projects/237098282/   


This is my second attempt for day 17 challenge.  I did not like being stuck, so I searched on Scratch and found a project that was similar to what I wanted to do.   I remixed and it works except for how to translate in the written form.  Mostly because I still really do not understand the code.  I have to take more time to look at it and figure it out.  ","Click the green flag.  Enter your name or a phrase to hear it in an alien language. 
Still working on how to display the name or phrase in the alien written language.  This is a remix of another project.  My original attempt of this project can be found here https://scratch.mit.edu/projects/237019487/",1294980,https://cdn2.scratch.mit.edu/get_image/project/237073724_480x360.png,2018-07-22T14:39:26.000Z,2018-07-23T00:50:36.000Z,2018-07-22T15:29:03.000Z,10,2,0,0,0,766189,766189
237075276,Getting unstucked 17,"Thanks to @ClaGua for ispiration

Facevo questo gioco da bambina con gli amici usando carta e penna: a ogni risposta si piegava il foglio in modo da coprirla e si passava il foglietto al vicino. Uscivano frasi molto divertenti
this is a game of my chilhood (pen and paper): each time you give an answer you have to fold paper to cover it an pass the sheet to the nearest friend. very funny phrases  ","click on green flag and write (better if you press space at the end oof answer)
clicca sulla bandierina verde e scrivi. (meglio premere spazio alla fine della risposta",25103547,https://cdn2.scratch.mit.edu/get_image/project/237075276_480x360.png,2018-07-22T15:17:26.000Z,2018-07-22T16:15:48.000Z,2018-07-22T16:15:48.000Z,4,2,0,0,0,,
237071118,G.U. Day 17,,"Clicca sulla bandierina verde.
Scegli tra 
rosso
arancione
giallo
verde
fuxia
turchese
violetto",13746945,https://cdn2.scratch.mit.edu/get_image/project/237071118_480x360.png,2018-07-22T13:37:09.000Z,2018-07-22T16:31:57.000Z,2018-07-22T16:31:57.000Z,9,4,0,0,0,,
237040422,GCF and LCM: Getting Unstuck Day 17 Lists,"Getting Unstuck Day 17 Lists

In grade 7 math, we teach students to move away from making lists of multiples when finding the LCM, because it can get long with large numbers or 3 or more numbers, and students risk making mistakes with their multiples, leading to an error in their LCM. We teach them to use prime factorization instead. A computer can still use the list strategy because it won't make a mistake on the 1178th multiple, but even a computer takes a while to do it!

Getting Unstuck strategies that helped me with this project:
Sleeping on it
Going through the code step by step
Avoiding making clones broadcasters! (specific to Scratch)
Using descriptive names for my variables

TIL that if you want two clones to share information (clone-specific variables) then one strategy for this is to make a global variable and have one clone ""temporarily"" store its info there so that the other clone can act on it. Two clones cannot share information directly with one to another, as far as I can tell.

If I had more time (or if someone wanted to remix this project), I would either use the prime factorization method for both the LCM and the GCF, or for the LCM (which is the long part for large numbers), I would make the program make a list of (say) the 20 first multiples, check if there is an LCM in that list, list the next 20, check again, etc. This should greatly reduce the time necessary for MOST LCM calculations (except when all of the numbers are prime amongst themselves).","Find the greatest common factor and the lowest common multiple of two or more numbers.
Enter all the numbers and say ""No"" or ""no"" when you are done.
If you use large numbers or 4 or more numbers, the program works but can take over 10 minutes (!), so if Scratch Cat is saying ""Hmm..."" for a long time but the timer is still advancing... be patient!",3485356,https://cdn2.scratch.mit.edu/get_image/project/237040422_480x360.png,2018-07-21T23:57:20.000Z,2018-07-22T17:01:35.000Z,2018-07-22T17:01:35.000Z,3,1,0,0,0,,
237082906,Unstuck Day 17 project,"After exploring the ""length of"" green operator blocks I had this idea to use it to create a name game. It was SOOOOO much harder than I anticipated, but I used some Getting Unstuck strategies to persevere and am super proud of this project which uses lists and variables to remove the first letter of the user's name to add to the Name Game song.

""The Name Game"" audio from https://www.youtube.com/watch?v=F3fT97caIkw ",Click the flag to play The Name Game!,17786521,https://cdn2.scratch.mit.edu/get_image/project/237082906_480x360.png,2018-07-22T18:13:25.000Z,2018-07-24T03:24:07.000Z,2018-07-22T19:07:59.000Z,11,5,0,0,0,,
237033490,Story Idea Generator - Getting Unstuck Day 17,"Getting Unstuck Day 17: Create a project that asks the user to type in multiple words or numbers, stores the items in a list, then does something interesting with the items from the list.

This project was inspired by a student who explained a similar project he created at home. He uses his program at home to practice writing.","Press the green flag to begin. Then answer questions about Who, What, When, and Where? I recommend you capitalize only the first letter of your response to who the story is about and all other proper nouns. There is no need to add punctuation to the end of any responses. Once you ""Generate Prompt"" you can run with the story idea and add details to complete the story or click ""Generate Prompt"" again to get a new story idea.",22156688,https://cdn2.scratch.mit.edu/get_image/project/237033490_480x360.png,2018-07-21T20:50:07.000Z,2018-07-22T20:09:11.000Z,2018-07-22T20:02:45.000Z,8,0,0,0,0,,
237028506,Day 17 Mad libs,"Today, I did kind of give up and come back to finish it.  I wish I could get it all printed on the screen to read. I'll work on this again to try and amend.  I hope that you have fun playing it!",So today we had to make a respeonse game.  I thought that I would do mad libs.  It was tricky enough to program and Im annoyed that I couldnt get it all on one screen.  ,24864870,https://cdn2.scratch.mit.edu/get_image/project/237028506_480x360.png,2018-07-21T18:46:39.000Z,2018-07-22T20:22:34.000Z,2018-07-22T20:21:03.000Z,3,0,0,0,0,,
