id,title,description,instructions,author/id,image,history/created,history/modified,history/shared,stats/views,stats/loves,stats/favorites,stats/comments,stats/remixes,remix/parent,remix/root
237206301,Catch 'em all (v2 - remixed!)-3,"Have spent too many hours on this today and it definitely leaves me frustrated and thinking about the experiences of students and teachers in classrooms. Currently I'm teaching in a classroom with both desktops and laptops (different models, every kid has a slightly different one), and I've run into all kinds of bugs like these, which definitely make the process of learning to code harder! ","UGH. Press the green flag to get a sense of things. I remixed a previous project so that everything falling was part of the scrolling, but ran into a TON of bugs. It works great offline; breaks differently in Chrome (can't move left/right) than it does in Firefox (where the background turns pink and giant for some reason). Debugging encouraged! (It seems like all the sprites work fine, but there's something about the way the background is blown up that Scratch hates? But also, it worked fine in the previous iteration?",2745846,https://cdn2.scratch.mit.edu/get_image/project/237206301_480x360.png,2018-07-24T01:23:11.000Z,2018-07-24T09:30:08.000Z,2018-07-24T09:29:21.000Z,23,3,1,0,0,,
237208594,"The ""See You At MIT!"" Pass-It-On Project","For Day 20 of Getting Unstuck, I decide to revisit the ""3 Favorite Things"" pass-it-on project from Day 11! I loved learning about the Getting Unstuck community. I also loved that day because people remixed the project to make it better, making each element standalone (using ""when sprite clicked"") instead of sequential (using ""broadcast and wait""). I'm starting this new pass-it-on project in this way that scales better. I hope you'll join in! And I hope to see you in person this week! ❤️✨","Click on me to find out why I'm excited about the MIT Scratch Conference, which is taking place this week! Then add yourself to this pass-it-on project!",39526,https://cdn2.scratch.mit.edu/get_image/project/237208594_480x360.png,2018-07-24T01:51:58.000Z,2018-07-24T10:24:20.000Z,2018-07-24T10:24:20.000Z,91,14,2,0,0,,
236591011,Truffle's Idea Tumbler,"updates on this iteration for Day 20:
I made a few detail edits, such as adding in spaces between the responses that Truffle joins as an idea. Sometimes when trying something new, the details are missed, and I'm glad to come back to this! I also added a feature where you can add a question to Truffle's memory. What question might bring some playful ideas?

original notes:
AHHHHH - This was my first time exploring strings and lists!
^---- that's a very excited ahhhh!

At first I wasn't even sure what the string blocks might be used for. I started off by looking at the Scratch wiki (https://en.scratch-wiki.info/wiki/String) to see what they even did. (thanks @paulinah)! Then I thought that I would create something that generated randomized text. 

The most exciting part of creating this came as I was thinking of questions to ask. As I plugged in Ask "" "" and wait, and ""add answer to list"" at least 15 times, and saw my code grow longer and longer, I wondered how I could randomize the questions so that they might appear in another order (or be repeated, for re-considering other potential responses.) I thought, if I could put them somewhere and ask for a random one, that would be great. I had just created my first list of the answers to questions. It was a sparkly realization moment when I thought ""what if I stored the *questions* in a list, too??? This way, they could both be randomized when called upon and ALSO be more organized, not making my script forever long. I was honestly feeling kind of unsure about taking on lists -- and there I was, creating lists on lists to be joined in (lovingly) weird strings! I'm excited to see where this new discovery goes!

During the recent Getting Unstuck project on changing scenes, I decided to try a ""pause and come back"" strategy in stuck moments. When I paused, I'd go in the vector editor and work on this cat face, thinking I'd surely use it for something in the future. I felt comfortable enough to play around with creating the cat while also thinking through the challenges in the project I was programming. For this challenge, I didn't spend ANY time on drawing, as I'd already created the cat. I wonder how far I would've gotten in the lists + strings exploration if I were also focusing on creating my own graphics?","After pressing the green flag, press the space bar to start.

Once Truffle has started sharing potential ideas, click on her and she'll share more (:

(update: press up arrow to add a question to Truffle's memory!)",25705937,https://cdn2.scratch.mit.edu/get_image/project/236591011_480x360.png,2018-07-17T02:02:56.000Z,2018-08-07T14:59:33.000Z,2018-07-18T10:35:56.000Z,50,16,3,0,0,,
237208177,"Visual Editor, Improved","This project was originally created for Day 14 for Getting Unstuck, and then revised for Day 20 of Getting Unstuck. I had originally set out to make a multiline text editing box, maybe even with a scroll bar. Wow, that was harder than I thought it would be. So on Day 14, I settled for the ability to enter characters.  

For Day 20, I added support for the Delete and Enter keys. Again, this was much harder than I thought it would be; it actually makes use of an undocumented Scratch feature, described here: https://scratch.mit.edu/projects/19199766/.  After concluding that there would probably not be an IPO for ""Visual Editor, Improved"", I decided that the only thing left to do before abandoning ship was to add a cool Easter egg. Enjoy!","Press the green flag and enter a brief message in the text box. Only lowercase, unaccented characters and space key accepted for now.  The delete key can be used to fix mistakes; press enter when done. 

Easter egg: What happens when you type a few words but forget to press enter for a few seconds?",56239,https://cdn2.scratch.mit.edu/get_image/project/237208177_480x360.png,2018-07-24T01:46:45.000Z,2018-07-24T17:03:13.000Z,2018-07-24T10:55:19.000Z,20,7,3,0,0,,
236909884,20,"Unstuck day 20
This is derivative of a project I began on day 13 and revised on days 14-15.  I've experimented with: connecting it to makeymakey instruments, bending notes based on the cursor's y position, separating graphix from sound, creating feedback loops through the user's microphone, and with eliminating a need for a user.

In this edition I changed the primary graphic to a spinning ball of thread. Given further time, I'd like to gamify this by creating an additional sprite that one tries to ""catch"" or grab with the fingertip. I think it will be necessary to use the timer and reset blocks to establish whether one has caught the other sprite (to distinguish it from a coincidental on stage passing-by).

An exciting discovery from this project has been the ability to use phantom sprites (e.g., no costume) to shadow other sprites, often by looping a glide instruction e.g. to the x/y of the first sprite. At this phase of iteration I may not be using any phantom sprites in a significant way, but - as we near the conclusion of GU - that's the grist on my mill. Another breakthrough from days 13-15 for me was that I could make these graphix without requiring the user to click or press down on the mouse/trackpad. The gentle fingertip and trackpad activity feels like a new Scratch experience. I'm very grateful for these discoveries! Thanks for the provocations!

Followup: made a remix for PicoBoard so the instrument can be set by a force resistant sensor connected to port D https://scratch.mit.edu/projects/237255829/","Green flag. Move fingertip on touchscreen to change note.

",33815227,https://cdn2.scratch.mit.edu/get_image/project/236909884_480x360.png,2018-07-20T04:03:17.000Z,2018-07-24T14:57:36.000Z,2018-07-24T00:47:58.000Z,14,8,1,0,0,,
237246694,day20 copy,,"Click on the green flag to start.
You have 10 seconds to multiply the two numbers displayed.",34225248,https://cdn2.scratch.mit.edu/get_image/project/237246694_480x360.png,2018-07-24T11:54:56.000Z,2018-07-24T11:55:17.000Z,2018-07-24T11:55:09.000Z,12,3,0,0,0,,
237246080,flying flowers copy,"Simply I added some costumes and a music to enjoy a moment of relax.
Thanks to Grieg for Peer Gynt.","  
Click on the green flag and on stage.",11312120,https://cdn2.scratch.mit.edu/get_image/project/237246080_480x360.png,2018-07-24T11:43:53.000Z,2018-07-24T12:12:51.000Z,2018-07-24T12:12:30.000Z,14,9,3,0,0,,
237246470,getting unstucked day20,I remix may day18 project to improve my capacity with cloning. I learn something more. Thanks to @alirb for stimulating my cuoriosity about thhese blocks,click the green flag ,25103547,https://cdn2.scratch.mit.edu/get_image/project/237246470_480x360.png,2018-07-24T11:50:49.000Z,2018-07-24T12:21:01.000Z,2018-07-24T12:21:01.000Z,6,1,0,0,0,,
237246059,Getting unstuck day 20 ,this is a copy and revised to my 13 day project of Getting unstuck !,"press green flag then Move your mouse on the flower, and u can press space to see it in another way :) !",34188789,https://cdn2.scratch.mit.edu/get_image/project/237246059_480x360.png,2018-07-24T11:43:28.000Z,2018-07-24T12:29:27.000Z,2018-07-24T12:26:12.000Z,7,2,0,0,0,,
237242777,Unstuck Day 20: Remix of Making Music ,"For my Getting Unstuck challenge Day 20 I decided to add more features to my earlier music playing project. I got stuck big time on what seems to be a bug in Scratch. If a variable is displaying below a Y position of 0 you can't get the options you should get when you right click on it. I finally figured out you only get those options if you move it above 0. Big headache!
The trickiest part of adding all these features was design. It was hard to think of ways to give the user enough information. I still think some lines on the bars would make it better to show the increments you can differentiate by.","Pick notes to play in a rhythm on the BLUE bar, then click PLAY.
Play along with your rhythm loop on the LIVE bar.
You can change both instruments on the RHYTHM and SOLO bars.
",214174,https://cdn2.scratch.mit.edu/get_image/project/237242777_480x360.png,2018-07-24T10:39:51.000Z,2018-07-24T12:30:15.000Z,2018-07-24T12:23:59.000Z,6,1,0,0,0,,
237246004,Getting Unstuck Day 20 - Getting Random Improved,"I realized today I missed day 6 which was all about random, so I started to create, and iterated on the fly - I'm calling this day 6 and day 20 as I've spent far longer than usual on the challenge and have made big improvements on my original idea! 

I spent lots of time tweaking how you know as the user if for example two random costumes are the same (so used a changing backdrop to let you know the costume had changed) and also how you can be sure you've clicked one of the sprites below.

Enjoy! ","Here's a project to test your memory.  When you click the green flag, you'll see the sprite with the box around it change costumes.

Once it's finished, click the sprites at the bottom of the screen in the same order that the main sprite changed. Press space bar to see if you got it right, and to advance. ",4610900,https://cdn2.scratch.mit.edu/get_image/project/237246004_480x360.png,2018-07-24T11:42:22.000Z,2018-07-24T12:27:33.000Z,2018-07-24T12:27:33.000Z,8,3,0,0,0,,
237247119,Unstuck Day 20,"I was so excited with the challenge today because I really wanted some more time to figure out the bug in my code and just could not find any yesterday.  When I first made this program, my flowers only cloned 10 times and it was difficult to see all ten flowers because they cloned on top of one another.  I have fixed that and also added some extra ""fun"" things to jazz this project up a bit.",Just click the green flag.,24826697,https://cdn2.scratch.mit.edu/get_image/project/237247119_480x360.png,2018-07-24T12:03:08.000Z,2018-07-27T00:43:14.000Z,2018-07-24T12:36:14.000Z,7,3,0,0,0,,
237249191,_clone copy copy,,"solo per usare liste/array e cloni
",443100,https://cdn2.scratch.mit.edu/get_image/project/237249191_480x360.png,2018-07-24T12:39:27.000Z,2018-07-24T12:45:02.000Z,2018-07-24T12:45:02.000Z,11,2,0,0,0,,
237250331,#020 Getting Unstuck Studio - Copy and Add to a Project,,"Move mouse around for clones...

I changed the clone so it will follow the mouse and added voice.",20126730,https://cdn2.scratch.mit.edu/get_image/project/237250331_480x360.png,2018-07-24T12:57:09.000Z,2018-07-24T13:11:42.000Z,2018-07-24T13:10:09.000Z,10,2,0,0,0,,
236137266,Getting Unstuck: Day 20 (what I wanted to make on Day 7),"The idea was taken from here (http://www.boston-baden.com/hazel/Knotware3/explain-key.htm), but also from something I've been wanting to do for ages! I revisited because my original one was a fail... this too is a bit of a fail as I could rotate the image instead...
",,24912473,https://cdn2.scratch.mit.edu/get_image/project/236137266_480x360.png,2018-07-11T16:16:41.000Z,2018-07-24T13:33:28.000Z,2018-07-11T16:48:18.000Z,28,6,0,0,0,,
237247912,Getting Unstuck day 20,"For today I added to yesterday's project. I wanted to add a power up that would make it possible to eliminate some of the dealy tacos. I thought about have the cat shoot lightning bolts at the tacos, but that brought up all the complications of aiming and so on. Then I hit on just having a shield that destroyed the tacos if they touch it. At first I made the force field a costume the cat has. That did not work, i guess because the tacos had contradictory instructions. So I made the force field a sprite that always goes to the cat, but is hidden unless the shield is recharged and the user presses <space> before getting hit with a taco. ","green flag to start
arrow keys to move
space key for a 2 second force field that destroys tacos 

careful- the force field has to recharge before you can use it again",17767933,https://cdn2.scratch.mit.edu/get_image/project/237247912_480x360.png,2018-07-24T12:17:48.000Z,2018-07-24T21:24:25.000Z,2018-07-24T13:18:36.000Z,8,5,2,0,0,,
237246765,Day 20 - Day18 - Treasure Island redo,"
http://soundbible.com/1830-Sad-Trombone.html
http://freemusicarchive.org/music/Wellington_Sea_Shanty_Society/

I added sound effects, background music, an additional backdrop, a timer, and some more hazards! I also shrunk all the game elements to make it more challenging.","Click the Green Flag and follow the directions
Space bar to start game
S to move straight
R to move right
L to move left
Don't go in the water!",18341966,https://cdn2.scratch.mit.edu/get_image/project/237246765_480x360.png,2018-07-24T11:56:23.000Z,2018-07-24T13:27:16.000Z,2018-07-24T13:27:16.000Z,10,8,2,0,0,,
237254131,Unstuck 20 Clone Rabbits Jumping,"I wanted to complete the following behaviours I didn't have time to include before. Happy with the result. 
- clones run both left and right
- clones disappear as they near the left and right edge of screen (first time using the ghost effect).
I experimented with multiple ""When I start as a clone"" blocks. Love this.
If I had more time, I would like to make the hopping effect more realistic by making sure when rabbit lands, he changes costume immediately before traveling along the x-axis. I probably should have NOT using multiple ""When I start as a clone"" blocks in order to make it look better. Oh well, the short and simple was good enough for today.
","Choose one of your projects from a previous day of Getting Unstuck and revise it.

The Rabbit will give you instructions. 
",19123745,https://cdn2.scratch.mit.edu/get_image/project/237254131_480x360.png,2018-07-24T13:37:31.000Z,2018-07-24T16:47:01.000Z,2018-07-24T13:51:20.000Z,7,2,0,0,0,,
237253550,day 20 revision and revisiting,"I started learning about Kolam designs. I had never really thought about how graph paper traditionally has the dots in a 90 degree relationship and how if the dots were in a 60 degree relationship - everything would be so different!! This made me wonder about making 90 degree and 60 degree patterns in the same file online. I think I used the clones to track where I was, but I'm still really unsure about what clones are and how they work... and how I might have coded exactly this same result without using clones and most importantly the pros and cons to using clones here!!!! Please help me understand this!!??",Click the green flag to start and see if you can imagine how to make another shape flower,124064,https://cdn2.scratch.mit.edu/get_image/project/237253550_480x360.png,2018-07-24T13:31:49.000Z,2018-07-24T14:08:28.000Z,2018-07-24T14:08:28.000Z,16,8,0,0,0,,
237258501,Getting Unstuck Day 20 ,"I review my Day 18 project. 
Now you score the score and when the sprite arrives to touch the red says you won.","Click the green flag.

",13275782,https://cdn2.scratch.mit.edu/get_image/project/237258501_480x360.png,2018-07-24T14:21:56.000Z,2018-07-24T14:31:40.000Z,2018-07-24T14:31:21.000Z,3,2,0,0,0,,
237258995,Getting Unstuck: Day 20 — Reactive Rainbow,"Reflection

I decided to make a couple of changes to my Day 13 project. I really liked the effect of the colors chasing the mouse, but overall the project needed a few extra tweaks to give it a more finished feel.

The changes I made are: The dots are now smaller. I added the use of the mosaic effect. And the dots are now created in a grid formation rather than randomly.

Even though the changes are minimal, the overall look and feel of the project has improved significantly.",Move the mouse pointer of the red dots.,26264460,https://cdn2.scratch.mit.edu/get_image/project/237258995_480x360.png,2018-07-24T14:27:03.000Z,2018-07-24T16:51:57.000Z,2018-07-24T14:47:38.000Z,12,3,2,0,0,,
237253174,Cat on a desert island copy,"This is an improved version of the stranded cat. Now with CLOUD VARIABLES.

Cloud variables are very interesting. The most easy thing to do with CV are records tables and halls of fame, but they can be used to do a lot of things, like multiplayer (if you have a good connection).
I have the feeling that is one of the interesting features that I used the less (besides creating plug-ins for the offline version).

Sounds on freesound.org:
rainfall by sonitusetaudio
thunders by juskiddink, Yoyodaman234 and olliehahn12
","Show and modify variable ""hour"" to see the different states of this scene.

The starting position should reflect the time of the day. The cat goes to bed at 22 o'clock and gets up at 7 in the morning. Some days are rainy!

Every time someone visits the island (in a single day), a fruit will appear!",12148328,https://cdn2.scratch.mit.edu/get_image/project/237253174_480x360.png,2018-07-24T13:27:59.000Z,2018-08-04T14:46:03.000Z,2018-07-24T15:03:40.000Z,14,6,2,0,0,,
237264270,Challenge20 - Platformer copy,"Had a few minutes and had always wanted to create a game where the user gets to play it how they want. I didn't have time for the whole game so I thought I'd create an engine with all condtions ready to go.

This game allows people to play the way they want. Be creative, get your cat to the yellow. ","Forgot to create a copy. So copied and re added to the studio, removed the first one.

Redoing this from a few projects ago. Thought I'd see it through, add a few levels and few extra effects. Will add more levels when I have time. 

Draw bridges, platforms, whatever to get Scratch to the yellow. 

Arrow Keys left/right/up

You get 50 line points to draw platforms to get your cat to yellow

Space resets the level
Z to undo your last line",3158946,https://cdn2.scratch.mit.edu/get_image/project/237264270_480x360.png,2018-07-24T15:20:58.000Z,2018-07-25T02:39:31.000Z,2018-07-24T15:21:15.000Z,11,4,0,0,0,,
237249370,Challenge4SizeRevisit,"This is a redo of my challenge 4 project, which was not working when I posted it. Thanks to scratchteacheralpha032 for remixing it to show me how to fix my problem. Also thanks to mstone326 for help throughout these challenges. I used my list lessons in this one. 
I also added to this project a list that keeps track of how many answers the user got wrong and gives the user a helpful hint at the end if they didn't get them all right. ",Click on the green flag to test your knowledge of ion charges.,2190314,https://cdn2.scratch.mit.edu/get_image/project/237249370_480x360.png,2018-07-24T12:42:06.000Z,2018-07-24T15:24:08.000Z,2018-07-24T15:20:40.000Z,7,4,0,0,0,,
237267319,"The ""See You At MIT!"" Pass-It-On Project remix-2",,"Click on me to find out why I'm excited about the MIT Scratch Conference, which is taking place this week! Then add yourself to this pass-it-on project!",22286405,https://cdn2.scratch.mit.edu/get_image/project/237267319_480x360.png,2018-07-24T15:53:27.000Z,2018-07-24T15:53:33.000Z,2018-07-24T15:53:33.000Z,12,3,0,0,0,237208594,237208594
237257674,Jumping Pico improved,"A bit super Mario-ish?  
I don't understated the gravity stuff though - grateful for help here
.I have added the not pressed key condition so you can't just keep the key down to play.
",Press the  green flag to start and  L R U D arrows to play,33472226,https://cdn2.scratch.mit.edu/get_image/project/237257674_480x360.png,2018-07-24T14:14:11.000Z,2018-07-24T18:26:24.000Z,2018-07-24T16:02:08.000Z,6,2,0,0,0,,
237270556,"The ""See You At MIT!"" Pass-It-On Project remix",,"Click on me to find out why I'm excited about the MIT Scratch Conference, which is taking place this week! Then add yourself to this pass-it-on project!",19123745,https://cdn2.scratch.mit.edu/get_image/project/237270556_480x360.png,2018-07-24T16:28:55.000Z,2018-07-24T16:31:38.000Z,2018-07-24T16:31:38.000Z,17,3,1,0,0,237208594,237208594
237204806,Projectile Motion Example - Bowtie Launcher,"This is a demonstration of my approach to scripting realistic projectile motion in scratch. Check out the comments on the script blocks to learn more about how it works.

For Day 20 of Getting Unstuck, I chose to revisit my Bowtie Launcher project to make the scripts clearer and add comments for anyone curious about how they work.","Hold down the mouse to 'charge up' the starting velocity of your shot, then let go to launch.

Adjust Gravity with the slider.",27306974,https://cdn2.scratch.mit.edu/get_image/project/237204806_480x360.png,2018-07-24T01:04:00.000Z,2018-07-24T17:04:19.000Z,2018-07-24T16:30:26.000Z,26,12,5,0,0,,
237248339,Unstuck Day 20 - Mood Survey w/cloud variables,"This was my project from Unstuck Day 18. I cleaned it up a bit. Plus I added cloud variables. This allows the values to remain. As more users answer the questions, the values will continue to grow.

Thank you to mstone326 for telling me about cloud variables and being a Scratcher. 

The doctor image is from Google and has ""free to use"" usage rights.",Press the flag to begin. You will be asked two questions - your gender and your mood. ,10715270,https://cdn2.scratch.mit.edu/get_image/project/237248339_480x360.png,2018-07-24T12:25:09.000Z,2018-07-25T12:54:59.000Z,2018-07-24T16:41:57.000Z,7,2,0,0,0,,
237273714,Two Dice Game V2 ,"Unstuck Challenge 20: choose one of your projects from a previous day of Getting Unstuck, make a copy of it, and revise it. 

This is a remix from my day 18's challenge. I customized the game to used with my 7th grade probability unit: compound events & law of large numbers.","Click on the green flag to start. You can choose to roll the pair of dice once, or you can ask the computer to roll the dice 10 times or 100 times. The results will be recorded each time. ",25332755,https://cdn2.scratch.mit.edu/get_image/project/237273714_480x360.png,2018-07-24T17:04:47.000Z,2018-07-24T17:23:10.000Z,2018-07-24T17:23:10.000Z,6,5,1,0,0,10130014,10130014
237144847,musical toy - tiled vibes,"Getting Unstuck: Day 20
https://gettingunstuck.gse.harvard.edu/
First, create a studio and add all of your Getting Unstuck projects to it.
-> https://scratch.mit.edu/studios/5251088/

Second, choose one of your projects from a previous day of Getting Unstuck, make a copy of it, and revise it. What's something about the project that would benefit from more time or fresh eyes? 
-> This version with the colourful polygons is more what I had in mind initially. I'm glad I could spend a little more time on it.
Yet another improvement will have to wait for another day ^^


Getting Unstuck: Day 19
https://gettingunstuck.gse.harvard.edu/
Create a project that uses the cloning features of Scratch. For example, you could make a project that represents a natural or human-made phenomenon.
-> Instruments are human-made, right? ;)","Move your mouse over any shape to play some vibes :)
Click a shape for another, shorter note.
Press space to change to different instruments.
",34248043,https://cdn2.scratch.mit.edu/get_image/project/237144847_480x360.png,2018-07-23T13:18:34.000Z,2018-07-24T22:26:25.000Z,2018-07-23T13:38:12.000Z,18,9,2,0,0,236311759,236311759
237242702,Unstuck Day 20: Over the Moon (Day 12 Revised),"It works!
Fix-ups: Repeated motion across screen prevented the broadcast from switching to the next command because the previous instruction was not complete. (Thank you @paulinah for your feedback and advice!) There were too many types of event block command (green flag, space bar, when __ broadcast, when backdrop changes) – messy.  Stages weren't changing on cue.  .  Changed “broadcast and wait” (in Stage coding) to “broadcast” (and not wait) on sprite pages.  Hide/show sprites changed to ""broadcast . . . "" instead of ""when backdrop changes to . . . ""
","Today's goal: Revise a project from a previous day.
Press the green flag to join Scratch and friends on their adventure!",18337230,https://cdn2.scratch.mit.edu/get_image/project/237242702_480x360.png,2018-07-24T10:38:23.000Z,2018-07-24T17:45:29.000Z,2018-07-24T17:32:23.000Z,8,4,0,0,0,,
