id,title,description,instructions,author/id,image,history/created,history/modified,history/shared,stats/views,stats/loves,stats/favorites,stats/comments,stats/remixes,remix/parent,remix/root,,description,instructions
235621375,Unstuck - Day 1,"Thank you, Karen and Paulina for these Unstuck Challenges!  I cannot wait to do all of them.  After looking at the instructions, I have decided that I would like to do these with my daughter.  Watching her learn and talk through her thought process will help me understand how a student might think their way through the project.  So here's some of our dialogue from today's challenge: 
Me: Let's read the directions and figure out how we're going to do this.
Mik: Ok
Me: Now that you've read the directions, what do you want the project to look like?
Mik: Can I pick any sprite?
Me: Sure, but let's not spend too much time deciding.
Mik: Ok, lets use the Scratch Cat.
Me (while we are looking for sprites): Do you want both of the sprites to move or just one?
Mik: Both.  Let's pick one that's pointing away from the cat so he turns around when the cat runs into him.
Me: Ok - how about the Dog2?
--------------------
Me: Because our sprites will be changing directions and moving, I like to initialize the program by setting their starting positions and directions. (***later we realized that we would be changing size as well, so we set the starting size too)
--------------------
One of our first troubleshooting issues we ran into was when we tested the program and the dog did not move.
Me: Hmm, the dog quickly turned around and the Scratch Cat didn't move, but quickly said, ""Excuse me.""  Why?
Mik: I don't know.
Me: Well, let's look at the code.  When is the cat supposed to say ""Excuse me?""
Mik: When it touches the dog?
Me: Are the two touching each other when we press the green flag?
Mik (tries it): yes
Me: Maybe we need a wait command.
Mik: ok, where should we put it?
Me: Well, let's look at the code - the first few things happen quickly, but we need them to move to their locations before they move.
Mik: Let's put it right before they move.
We tested it and it worked.
---------------------------
At one point, Mik wanted to use the send a message command (she remembered this from a previous project we worked on where sprites were having a conversation).  So we discussed where in her code this would work well and I explained how she could call the message whatever she wanted. 
-----------------------------
Throughout the creation project, my daughter wanted to add more and more.  Even though we accomplished the challenge, I wanted to see where her creativity would lead her.  
Mik: I want the dog to get smaller so he looks like he's moved to the side so the cat can pass.
Me: Ok, lets shrink him - where do you think this would be?
Mik: Under looks (she looks through the blocks) what about set size to?
Me: Let's try it.  When do you want this to happen?
Mik: After he say's, ""Certainly.""
Me: Ok, now if we are going to be changing the size, what do we need to do at the beginning? 
Mik: Set his size to big.
Me: Let's do it.
----------------------------
Me: How are you going to get the cat to keep moving after the dog gets smaller?
Mik: Use a broadcast?
Me: Exactly - do it.
---------------------------------
After running the code, Mik wanted the animation to look even more realistic.
Mik: Can we make it so the dog gradually gets smaller, not suddenly skipping?
Me: Sure, lets try changing his size little by little - try a change size by block.  But you want it to keep getting smaller, so what does it need?
Mik: We could make it repeat.
At this point, I showed her how to gradually change size by 1 twenty five times to go from 75 to 50. 
Me: if we use a 1 it will get bigger, what should we do to make it get smaller?
Mik: Negative 1?
Me: Try it -- perfect.
------------------------------
We could have kept going, but I explained that we already kinda went above and beyond.  I really enjoyed watching my daughter express herself through this activity.  She was really excited and enjoyed the challenge.  If only we had time to sit with all of our students one on one to see their thought process in action.  This is where pair programming and reflections could accomplish similar goals. Getting the kiddos to think about their thinking is important. 
 
",Click Green Flag to Start,2456527,https://cdn2.scratch.mit.edu/get_image/project/235621375_480x360.png,2018-07-05T21:20:56.000Z,2018-07-05T22:33:00.000Z,2018-07-05T22:33:00.000Z,3,1,1,0,0,,,,,
235624239,Unstuck Day One,,,2356410,https://cdn2.scratch.mit.edu/get_image/project/235624239_480x360.png,2018-07-05T22:08:57.000Z,2018-07-05T22:38:21.000Z,2018-07-05T22:34:07.000Z,6,2,1,0,0,,,,,
235577612,Getting Unstuck Day-1 project: Raining ,"Having inspired by the weather conditions in Urbana (IL), I created two cloud sprites to cause a rain. This project prompt (show how rain occurs) to children (for elementary school students and maybe even for middle graders) can be helpful to learn the coding through Scratch. I learned the use of ""broadcast"" block.  ",Click the Green Flag to see how rain occurs :) ,18032106,https://cdn2.scratch.mit.edu/get_image/project/235577612_480x360.png,2018-07-05T13:24:43.000Z,2018-07-05T23:31:00.000Z,2018-07-05T22:51:29.000Z,19,3,1,0,0,,,,,
235621927,Getting Unstuck: Day 1 Collision,,Click the green flag!,18190669,https://cdn2.scratch.mit.edu/get_image/project/235621927_480x360.png,2018-07-05T21:29:58.000Z,2018-07-07T07:30:51.000Z,2018-07-05T22:55:37.000Z,9,2,1,0,0,,,,,
235626421,Getting Unstuck: Day 1,,,9505598,https://cdn2.scratch.mit.edu/get_image/project/235626421_480x360.png,2018-07-05T22:47:18.000Z,2018-07-05T23:11:44.000Z,2018-07-05T23:11:44.000Z,12,2,1,0,0,,,,,
235625990,Day 1-Excuse Me Challenge - Rude Wizard,"Day 1 - Create a project that whenever two sprites collide, one of them says, ""Excuse me!"" and the other sprite says, ""Certainly."" ",,16509596,https://cdn2.scratch.mit.edu/get_image/project/235625990_480x360.png,2018-07-05T22:39:31.000Z,2018-07-18T01:21:10.000Z,2018-07-05T23:12:19.000Z,7,1,1,0,0,,,,,
235626816,Getting unstuck 1,,,10121312,https://cdn2.scratch.mit.edu/get_image/project/235626816_480x360.png,2018-07-05T22:55:19.000Z,2018-07-05T23:13:20.000Z,2018-07-05T23:08:05.000Z,8,1,1,0,0,,,,,
235625826,Unstuck 01 - Polite divers,"I wanted the divers to swim back and forth, and when they bumped each other, to say ""Excuse Me"" and ""Certainly."" At first I used the glide command but  I realized the sensing wouldn't work quite right.
I learned that a simple idea can grow complicated quickly. Also the timing of the display messages could be improved I think.
",Press the green flag and watch :-),19123745,https://cdn2.scratch.mit.edu/get_image/project/235625826_480x360.png,2018-07-05T22:36:30.000Z,2018-07-06T21:22:36.000Z,2018-07-05T23:11:54.000Z,8,1,1,0,0,,,,,
235622069,Excuse Me!,"Today's prompt: 
Create a project that whenever two sprites collide, one of them says, ""Excuse me!"" and the other sprite says, ""Certainly.""

I've found the prompt very funny and generative. A few days ago I made a Scratch project with my avatar floating into space, so I started from there. I experimented with different ways to move the sprites while keeping the code simple. Just before adding my project to the studio, I checked out other projects. It was awesome to see the variety of projects generated by that simple prompt, and to recognize so many friends who are participating to this online adventure. I loved to see my friend @lilyland reference to getting ""unstuck"" on her sailboat, so I decided to work more on my project, playing with the idea of getting stuck and unstuck. It was really fun!

The music is ""The Blue Danube Waltz"" by Johann Strauss
https://www.imagevienna.com/en/services/downloadarea/downloads.html","Green flag to start floating.
Space bar to get unstuck!

This is for Day 1 of Getting Unstuck!
https://gettingunstuck.gse.harvard.edu/

",2286560,https://cdn2.scratch.mit.edu/get_image/project/235622069_480x360.png,2018-07-05T21:32:21.000Z,2018-07-19T01:49:28.000Z,2018-07-05T23:28:45.000Z,11,3,1,0,0,,,,,
235623935, The Hasty Knight Unstuck Day 1,"Getting Unstuck Day 1: Exploring interactions between sprites.
Create a project that whenever two sprites collide, one of them says, ""Excuse me!"" and the other sprite says, ""Certainly."" ",Click on the green flag,8789156,https://cdn2.scratch.mit.edu/get_image/project/235623935_480x360.png,2018-07-05T22:03:49.000Z,2018-07-05T23:34:45.000Z,2018-07-05T23:01:31.000Z,14,2,1,0,0,,,,,
235625991,Hip Hop Champ (Getting Unstuck Day 1),,Click the green flag to get started.,34198395,https://cdn2.scratch.mit.edu/get_image/project/235625991_480x360.png,2018-07-05T22:39:32.000Z,2018-07-15T04:01:37.000Z,2018-07-06T23:48:08.000Z,1,0,0,0,0,,,,,
235627193,Getting Unstuck: Day 1,Getting Unstuck: Day 1,Click the green flag at the top to get started.,14143361,https://cdn2.scratch.mit.edu/get_image/project/235627193_480x360.png,2018-07-05T23:01:41.000Z,2018-07-05T23:42:18.000Z,2018-07-05T23:41:33.000Z,6,1,1,0,0,,,,,
235625354,Getting Unstuck Day 1,"#gettingunstuck
Music by The Roots ""Don't Feel Right""
I got the idea for a variable from one of the projects in the studio. I had to set the counter higher because the robot randomly moves, so if I only did 3, the project would play for like 5 seconds.

Still working on what will happen after 5 bumps. I have the robot dissolve but I want it to dissolve at the same time as the space sound. ",,17824064,https://cdn2.scratch.mit.edu/get_image/project/235625354_480x360.png,2018-07-05T22:28:04.000Z,2018-07-06T01:58:09.000Z,2018-07-05T23:07:50.000Z,8,1,1,0,0,,,,,
235623712,5-July: Unstuck: Manners-2,"Through trial and error, I knew that I needed to write a script for each sprite and have them interact.- I looked at the different script categories and found 'color A is touching B.' I added those to both sprites, but found that they didn't react to each other. I searched 'touching' and came across TheLogFather's ""Why touching tests 'fail.'"" That introduced me to the Broadcast block. I then searched on 'Broadcast' and used DockStreetCodes' 'Broadcast and Receive.' After additional experimentation, I got a working project.","Day 1 of gettingunstuck@gse.harvard.edu. Create a project that whenever two sprites collide, one of them says, ""Excuse me!"" and the other sprite says, ""Certainly."" Repeats 10 times.",34179488,https://cdn2.scratch.mit.edu/get_image/project/235623712_480x360.png,2018-07-05T22:00:28.000Z,2018-07-05T23:30:29.000Z,2018-07-05T22:03:00.000Z,13,2,1,0,0,,,,,
235625730,Can I Come In?,"After creating the sprites, I was initially unsure how to have the U.S. respond. I thought initially that I would have the U.S. sprite respond when any character sprite moved (to a set coordinate location within the U.S.), though this wasn't *really* meeting the challenge, just a simulation of what that kind of response might look like. A quick trip to the sensing blocks and I found the 'touching (dropdown)' block, which seemed it would come in handy. A trip back to the control blocks and I found the 'wait until' block. By combining these blocks,  If I signaled to start by pressing the green button, the response became no longer simulated -- if someone moves the character sprites arbitrarily, the U.S. sprite will respond to touching a character sprite. Perhaps I should have the character sprites speak if they're touching the U.S. sprite. I think I'd also like to add some more scenarios and potential conversations.","Press the green flag to start, then click on character sprites (:",25705937,https://cdn2.scratch.mit.edu/get_image/project/235625730_480x360.png,2018-07-05T22:34:47.000Z,2018-07-09T09:59:28.000Z,2018-07-05T23:50:08.000Z,33,8,2,0,0,,,,,
235613177,Collide 1 #GettingUnstuck,"I'm a newbie to this, so this was not an easy task. I had a difficult time programming Crabby to say ""Certainly"" after it touched diver. I used the If, Then code, but something still was not quite right. The other projects are great, they seem to be pros at this!",,18062705,https://cdn2.scratch.mit.edu/get_image/project/235613177_480x360.png,2018-07-05T19:07:42.000Z,2018-07-06T00:00:50.000Z,2018-07-05T23:57:52.000Z,6,1,1,0,0,,,,,
235629437,Unstuck Puzzle One,"At first I made an error and sometimes the girl would say ""Excuse Me"" and sometimes she would say ""Certainly"", while the cat only said ""Certainly"".  I think I found my mistake.  Also, next time I want to not have the Sprites moving in circles:-)",Click on  the green flag to make the polite Sprites twirl across the screen.,24826697,https://cdn2.scratch.mit.edu/get_image/project/235629437_480x360.png,2018-07-05T23:39:11.000Z,2018-07-06T11:53:47.000Z,2018-07-06T00:01:31.000Z,10,1,1,0,0,,,,,
235621162,Well Excuse Me!,"At first I was just going to make this as easy as possible, with some simple code, but I thought I would make it a little more fun by using broadcast, and making sure the dinosaurs didn't get stuck by having them move back to a start spot after they stuck. Sort of wish I had a little more time, I would have added some sounds too!",Click the green button to get the two dinosaurs moving!,22706156,https://cdn2.scratch.mit.edu/get_image/project/235621162_480x360.png,2018-07-05T21:16:50.000Z,2018-07-06T00:09:25.000Z,2018-07-06T00:08:00.000Z,10,1,1,0,0,,,,,
235629570,Getting Unstuck Day 1,"By exploring other project from the Getting Unstuck series I learned how to use the broadcast feature on Scratch. This proved to be extremely helpful in the design of even this ""simple"" project.",Press the green flag to start/ reset the program.,22156688,https://cdn2.scratch.mit.edu/get_image/project/235629570_480x360.png,2018-07-05T23:41:29.000Z,2018-07-06T00:24:22.000Z,2018-07-06T00:21:35.000Z,22,1,1,0,0,,,,,
235620078,Day 1 Getting Unstuck,"As I reflect on this I really like the change direction minus 180!  I would like the characters to randomly change angles when they hit the wall.  I also would like them to speak when the sprites collide not when the witch touches the color or the flying hippo.

I also had to hard code some waits in for the dialog so it would jump by fast or just keep repeating because they were still touching.","Press green flag to get started

Prompt: Create a project that whenever two sprites collide, one of them says, ""Excuse me!"" and the other sprite says, ""Certainly."" ",20446522,https://cdn2.scratch.mit.edu/get_image/project/235620078_480x360.png,2018-07-05T21:00:22.000Z,2018-07-06T00:48:43.000Z,2018-07-06T00:34:37.000Z,8,2,1,0,0,,,,,
235610164,Talking Fish (Getting Unstuck #1),"I used sensing and broadcast to execute the ""talking fish"" and divers. I probably could have finished much more quickly but I kept going back to set the timing. It was fun and a good refresher since I haven't used Scratch for a while.",Click the green flag to begin.,124311,https://cdn2.scratch.mit.edu/get_image/project/235610164_480x360.png,2018-07-05T18:27:21.000Z,2018-07-06T00:39:04.000Z,2018-07-06T00:39:04.000Z,28,2,2,0,0,,,,,
235634322,Day One Colliding Conversations ,"Prompt: Create a project that whenever two sprites collide, one of them says, ""Excuse me!"" and the other sprite says, ""Certainly."" 

#creativecomputing ","Click the flag to make the sprites move to random coordinates.

I thought I'd use a loop of moving to random coordinates. I first had a bus sprite and the bus and sailboat would bump into each other, but if they didn't go through the middle exactly, it wouldn't always set off the talking. Once I changed to the bat, that fixed that, but sometimes the sailboat says, ""Certainly"" first. Not sure why.",10309968,https://cdn2.scratch.mit.edu/get_image/project/235634322_480x360.png,2018-07-06T00:51:08.000Z,2018-07-25T01:14:56.000Z,2018-07-06T00:51:40.000Z,8,1,1,0,0,,,,,
235634875,Hoxie Getting Unstuck - Day 1,I like the glide feature I saw other GettingUnstuck users add onto their challenge.,Press the green flag to begin,18558561,https://cdn2.scratch.mit.edu/get_image/project/235634875_480x360.png,2018-07-06T00:58:10.000Z,2018-07-06T01:27:58.000Z,2018-07-06T01:05:53.000Z,8,2,1,0,0,,,,,
235635062,Getting Unstuck Day 1,"With all the insects out, I knew this was what I wanted to create. I struggled with how to set the timing to make sure the butterfly spoke after the beetle.","Press the flag to view!
Press space bar to return insects to original position",34208406,https://cdn2.scratch.mit.edu/get_image/project/235635062_480x360.png,2018-07-06T01:01:06.000Z,2018-07-06T01:32:37.000Z,2018-07-06T01:32:37.000Z,7,1,1,0,0,,,,,
235636378,Unstuck Day 1 Rushing,"In this project for the Scratch ""Getting Unstuck"" series, I created a vignette where Scratch enter the scene on the left and bumps into Abby.  He says ""Excuse me"" -- and she turn to face him and replies ""Certainly"" 

I used broadcast blocks to cue Abby to turn and reply, as well as for scratch to continue moving across the stage.

The repeat until blocks were very helpful when creating this scene.",Click the Green Flag to start.,7525698,https://cdn2.scratch.mit.edu/get_image/project/235636378_480x360.png,2018-07-06T01:24:46.000Z,2018-07-06T17:41:11.000Z,2018-07-06T01:33:03.000Z,7,1,1,0,0,,,,,
235621979,Fly Away Home,"I created a flying block for the butterfly to flap its wings. When the butterfly collides with the ladybug, a message is broadcast to which the ladybug responds.

I chose the butterfly so I could switch costumes - none of the bugs had costumes so I created a ""wing flap"" one for the ladybug to use when she turns to fly away home.",Click on the Flag to start the summer fun!,2634064,https://cdn2.scratch.mit.edu/get_image/project/235621979_480x360.png,2018-07-05T21:30:47.000Z,2018-07-06T01:56:06.000Z,2018-07-06T01:41:26.000Z,11,3,1,0,0,,,,,
235636098,Polite Wizards,"I spent a while tinkering with this because I don't like it when the two bump into each other too many times in a row.  I'd prefer one bump, then bump off the walls once before bumping into each other again.","Getting Unstuck day 1
Goal: Create a project that whenever two sprites collide, one of them says, ""Excuse me!"" and the other sprite says, ""Certainly.""",399245,https://cdn2.scratch.mit.edu/get_image/project/235636098_480x360.png,2018-07-06T01:19:50.000Z,2018-07-06T02:07:56.000Z,2018-07-06T01:45:28.000Z,5,1,1,0,0,,,,,
235635828,Kitty Walk #GettingUnstuck!, ,press play to start,34192422,https://cdn2.scratch.mit.edu/get_image/project/235635828_480x360.png,2018-07-06T01:14:53.000Z,2018-07-06T01:53:23.000Z,2018-07-06T01:46:30.000Z,5,1,1,0,0,,,,,
235636332,"Excuse Me, Unstuck Day 1","It has been a very long time since I have completed a Scratch Project.  This is by no means a great example, but I am having fun exploring with Scratch again.",Click on the Green Flag to begin,34190490,https://cdn2.scratch.mit.edu/get_image/project/235636332_480x360.png,2018-07-06T01:23:58.000Z,2018-07-25T15:45:37.000Z,2018-07-06T01:54:38.000Z,13,1,1,0,0,,,,,
235638917,GettingUnstuck#1-Excuseme,"Thanks to the Scratch Team for organizing the ""Getting Unstuck"" series. This reminds me of projects done early on with Pong, when sometimes sprites do not bounce off properly, and seem to get stuck.

The issue is with sprites which are irregularly shaped as well as not being centered properly. When the ""if touching"" condition is true, the sprite turns around. But after turning around, it is still touching the other sprite, and hence it turns around again, which results in some weird glitchy behaviours.

We found the best way was just to force the sprites to move away from each other once the condition is true, by adding an extra move block inside. Works the best :)","Just click the green flag :)

Day 1 exercise of getting unstuck!

Create a project that whenever two sprites collide, one of them says, ""Excuse me!"" and the other sprite says, ""Certainly.""",31281136,https://cdn2.scratch.mit.edu/get_image/project/235638917_480x360.png,2018-07-06T02:03:55.000Z,2018-07-08T02:43:16.000Z,2018-07-06T02:12:47.000Z,5,1,1,0,0,,,,,
235603895,Unstuck Day 1,"I wanted to play a little bit with clones - a powerful feature that I sometimes forget about until after I've implemented a messier, more complex way to do whatever I'm trying to do!
",,7902,https://cdn2.scratch.mit.edu/get_image/project/235603895_480x360.png,2018-07-05T17:12:42.000Z,2018-07-06T02:28:22.000Z,2018-07-06T02:16:24.000Z,7,1,1,0,0,,,,,
235636159,Polite Sprites - Day 1,"This project really forced me to explore the menus and features in Scratch.  I was a little confused when I tried to change my Sprite's costume and my taco flipped upside down and I couldn't fix it - LOL!  

I like how Scratch encourages you to try, try and try again until you figure it out.  This process of learning how to make two Sprites interact was fun, a bit challenging but I was so excited when it finally worked!  I'm excited to learn more and make my projects more fancy :) ",Please click the green flag to begin.  ,27128942,https://cdn2.scratch.mit.edu/get_image/project/235636159_480x360.png,2018-07-06T01:21:01.000Z,2018-07-15T01:31:59.000Z,2018-07-06T02:18:07.000Z,8,1,1,0,0,,,,,
235636757,Day One,This was way harder than I thought it would be.  Close to an hour and I never did get the sound recordings to play in the correct order. I finally had to call it quits and will have to figure out the problems another time.,Start by pressing green flag.,34205973,https://cdn2.scratch.mit.edu/get_image/project/235636757_480x360.png,2018-07-06T01:30:50.000Z,2018-07-06T02:40:34.000Z,2018-07-06T02:37:56.000Z,11,2,1,0,0,,,,,
235620768,Getting Unstuck: Day 1,"Paris The Place De L'europe On A Rainy Day 
Painting by Gustave Caillebotte


I loved exploring Scratch features to make this project. I could stay for hours more creating and playing: mixing sounds, music, effects, recording the voices imagining how it was at that time! there are endless possibilities of this go on in this project/paint/story project! :)




","Click on the green flag to bring the painting to life!

Challenge #1: Create a project that whenever two sprites collide, one of them says, ""Excuse me!"" and the other sprite says, ""Certainly.""",2176961,https://cdn2.scratch.mit.edu/get_image/project/235620768_480x360.png,2018-07-05T21:10:40.000Z,2018-07-06T02:49:05.000Z,2018-07-05T23:56:23.000Z,21,8,1,0,0,,,,,
235639105,Sprites ... In ... Spaaace! (#Unstuck Day 1),"Getting Unstuck: Day 1

The Challenge: ""Create a project that whenever two sprites collide, one of them says, 'Excuse me!' and the other sprite says, 'Certainly.'""

I started with the idea of having the sensing blocks ""detect"" the other sprite, which went fairly smoothly, but I struggled with the movement of the sprites to mimic zero g interactions.

As an educator, one of the most power ideas for students to experience is the ""wide walls"" or multiple ways to approach and solve the same problem.",Press the green flag to begin.,27690149,https://cdn2.scratch.mit.edu/get_image/project/235639105_480x360.png,2018-07-06T02:06:30.000Z,2018-07-06T03:05:40.000Z,2018-07-06T02:49:52.000Z,8,1,1,0,0,,,,,
235630911,Avoiding an Asteroid Collision,"This project is in response to the Getting Unstuck Challenge (Day 1): ""Create a project that whenever two sprites collide, one of them says, ""Excuse me!"" and the other sprite says, ""Certainly."" Lots of bad situations can be avoided through civility, so why not the potential extinction of all life on earth? If only we could reason with an asteroid...wait, then the dinosaurs would still be around. Never mind.",Click the green flag to begin.,17801875,https://cdn2.scratch.mit.edu/get_image/project/235630911_480x360.png,2018-07-06T00:01:52.000Z,2018-07-06T18:46:57.000Z,2018-07-06T02:44:43.000Z,11,2,2,0,0,,,,,
235620981,Getting Unstuck: Day1,I had a lot of fun creating this project.  The crab spins around when it gets hit by the cat.  ,Just press the Green Flag to start.,17257831,https://cdn2.scratch.mit.edu/get_image/project/235620981_480x360.png,2018-07-05T21:14:05.000Z,2018-07-07T05:25:59.000Z,2018-07-06T02:55:36.000Z,5,1,1,0,0,,,,,
235642193,Crabby Bumpy,Day 1 GU (Getting Unstuck) Fun,,25385235,https://cdn2.scratch.mit.edu/get_image/project/235642193_480x360.png,2018-07-06T02:50:16.000Z,2018-07-07T23:07:30.000Z,2018-07-06T03:13:48.000Z,8,2,1,0,0,,,,,
235637251,Getting Unstuck Day #1,"Unstuck Day #1
Create a project that whenever two sprites collide, one of them says, ""Excuse me!"" and the other sprite says, ""Certainly."" ","Click the green flag to play the animation.
",24464388,https://cdn2.scratch.mit.edu/get_image/project/235637251_480x360.png,2018-07-06T01:38:48.000Z,2018-07-06T03:16:44.000Z,2018-07-06T03:15:35.000Z,11,1,1,0,0,,,,,
235591264,Getting Unstuck Day 1: Collisions on the Street,I tried to play with clones on this since I haven't done much with clones in the past. I discovered that I had to have at least 2 sprites since a sprite can't check if it's touching one of it's clones - at least not easily. I also appreciate the help I got from @mstone326 to have the clones check if they're touching the main sprite rather than having the main sprite check for the collision. ,Only the black sprite says excuse me.,5271542,https://cdn2.scratch.mit.edu/get_image/project/235591264_480x360.png,2018-07-05T15:26:55.000Z,2018-07-16T17:04:50.000Z,2018-07-06T02:38:45.000Z,20,5,1,0,0,,,,,
