id,title,description,instructions,author/id,image,history/created,history/modified,history/shared,stats/views,stats/loves,stats/favorites,stats/comments,stats/remixes,remix/parent,remix/root
226772249,jumpingdog,Didn’t have as much time to spend on this challenge as I wanted! Currently working on another response to the challenge. But feel free to remix this one if you're feeling stuck!,Press space to make the dog jump!,2745846,https://cdn2.scratch.mit.edu/get_image/project/226772249_480x360.png,2018-05-31T18:45:19.000Z,2018-07-09T10:45:06.000Z,2018-05-31T18:58:08.000Z,23,2,1,0,0,,
235850156,"Blue Cat Group! (Getting Unstuck, Day 5)","I recently experienced food poisoning and missed seeing the ""Blue Man Group"". My friends had a hard time explaining what it was, so I've created this project of what I thought it was based on their various reports.

Rather than engage in a high-fidelity representation of jumping, I opted for a pretty simple approximation, which I achieved by stringing together several ""glide"" blocks.

Project strength? I think I have a pretty strong narrative concept! (Donuts + cats are beyond reproach.) Future work? I think I could have done better on my flaming hoop. I'm going to use Scratch's search feature to see if I can find slightly higher-fidelity flames.",Press the green flag!,39526,https://cdn2.scratch.mit.edu/get_image/project/235850156_480x360.png,2018-07-09T00:24:35.000Z,2018-07-09T11:32:17.000Z,2018-07-09T10:09:54.000Z,30,7,0,0,0,,
235838979,Getting Unstuck Day 5: Help Mr. Octopus!,"This is the first scrolling game i've made!

I spent *too* much time trying to learn about scrolling games... but I'm very proud of my project! I ended up getting very frustrated so I took a break to cook a meal. When I came back to my project, I had a lot more clarity and was able to accomplish what I'd hoped for!

The only issue I'm still having is how to ensure the user doesn't go too far left and off the screen. I would love some help thinking of how to stop this from happening!",Press the green flag and wait for the octopus to give you instructions!,19163721,https://cdn2.scratch.mit.edu/get_image/project/235838979_480x360.png,2018-07-08T19:50:37.000Z,2018-07-09T15:12:11.000Z,2018-07-08T23:35:41.000Z,23,5,2,0,0,,
235846699,Jump!,"This project was created for Day 5 of Getting Unstuck. I borrowed the jumping math from a project that I worked on with a friend at a ScratchEd meetup. I haven't used Scratch's Backpack feature much before, but this was a great way to move a snippet of code from one project to another.

Music: Starbox, ""Digital Dream (Azureflux Remix)""","Press the space bar to jump and use the left/right arrow keys to move around. 

Press the big button in the upper left hand corner to toggle modes.",56239,https://cdn2.scratch.mit.edu/get_image/project/235846699_480x360.png,2018-07-08T23:10:49.000Z,2018-07-11T00:17:43.000Z,2018-07-09T10:14:11.000Z,36,9,2,0,0,,
235823529,Falling + Feeling,"Sound remixed from: 
Steven Universe Episode S04E04 ""Mindful Education""
""Here Comes A Thought"" (from the episode): 
https://www.youtube.com/watch?v=dHg50mdODFM

My first foray into aligning sound and (admittedly bare) animation was an exciting challenge. I needed to use a BUNCH of Getting Unstuck strategies to get to this point (and I could continue tweaking this for much longer...) Some that I used throughout the day were:

- Fail A LOT
(glitches and other weird, unexpected responses can be very fun to discover, and sometimes bring something even more exciting!)

- Take A Break

- A Stack at a Time 
(you'll see that I abandoned many dancing stacks in this process -- part because it was getting hypnotizing, part isolating bugs)

- Break It Down 
(this was especially helpful when I wrote out the cues for who was singing and dancing when, which would ultimately lead to the broadcasts)

- Answer Someone's Question 
(very helpful as a fairly new scratcher to have reminders that there are plenty of things I do know, and that I can ask questions to figure out that which I don't)

- Be Inspired By Others  
(all of the Getting Unstuck projects are inspiring me so much!!)

- Help a Friend

- Talk it Through

- and JUST KEEP GOING

I'll be cleaning up inside soon (and will try to keep at least some of the event-less mind mess with notes to the side)","Press the green flag to start (:

This project continues from my Day 1 Getting Unstuck project,  'Can I Come In?'

Coming to a new place can be scary, especially alongside other challenges. Our friends have thoughts and feelings flying in a bit of a frenzy. After entering the U.S. seeking help, they're feeling a bit overwhelmed. Thankfully, they have each other for support! After some time talking about their experiences, they reach out to a caring adult and they all engage in mindful practices.

At the end, use your mouse to keep butterfly thoughts flying -- the friends will be grateful for something to watch!",25705937,https://cdn2.scratch.mit.edu/get_image/project/235823529_480x360.png,2018-07-08T13:56:41.000Z,2018-07-10T22:57:07.000Z,2018-07-09T10:51:54.000Z,23,8,2,0,0,,
235887012,Wandering Link,"If I had two more days, I would change so many things! @unseatingBread tells me it's glitchy in a special way, which is to say that there are so many things to fix, I'm not sure where to start! I had gotten basic movement working, and then thought I'd get fancy by adding gravity, and then obstacles, and then, and then...I'm reminded of my students who, in their first week, see one of the Super Mario remakes and insist that they're going to make something like that. The strategies that I should definitely have employed MORE of would be ""compromising"" and ""being a minimalist."" But hey - just because it's a public project doesn't mean it's finished! I will probably continue to tinker with it for a long time...

References:
+ https://scratch.mit.edu/projects/67727504/ by @griffpatch_tutor
+ https://en.scratch-wiki.info/wiki/Advanced_Platformer_Physics 

Link sprite sheet: https://www.deviantart.com/tiozacdasgalaxias/art/Link-Sprite-Sheet-662562870

What I wanted to implement but didn't have time for: http://error454.com/2013/10/23/platformer-physics-101-and-the-3-fundamental-equations-of-platformers/

Sounds:
+ Zelda: KHInsider
+ Mario: OrangeSounds","Definitely a work in progress, since I ran out of time to work on this yesterday. 

Arrow keys left and right to move, and up to jump. Down to face the player. Don't hit the obstacles!

Also for some reason it works better in the offline editor than online, hmmMm...",2745846,https://cdn2.scratch.mit.edu/get_image/project/235887012_480x360.png,2018-07-09T11:29:43.000Z,2018-07-11T19:13:00.000Z,2018-07-09T11:31:32.000Z,22,4,1,0,0,,
235887128,Getting Unstuck Day 5,,,32626504,https://cdn2.scratch.mit.edu/get_image/project/235887128_480x360.png,2018-07-09T11:31:14.000Z,2018-07-09T11:42:37.000Z,2018-07-09T11:42:37.000Z,9,4,0,0,0,,
235886588,Day5,,,34225248,https://cdn2.scratch.mit.edu/get_image/project/235886588_480x360.png,2018-07-09T11:23:34.000Z,2018-07-09T11:42:05.000Z,2018-07-09T11:41:09.000Z,16,3,0,0,0,,
235885455,day 5,,"press the green flag.
click right arrow for walk, up arrow to jump.
if you touched gray line 3 times game over.
so be careful.",34188789,https://cdn2.scratch.mit.edu/get_image/project/235885455_480x360.png,2018-07-09T11:06:41.000Z,2018-07-10T06:43:01.000Z,2018-07-09T11:52:47.000Z,11,3,0,0,0,,
235887069,Getting Unstuck - Day 5 ,Create a project that involves one or more sprites jumping or flying.,"Help the penguin avoid the icebergs for 30 seconds. Use the up arrow to jump. You have 3 lives.

Good luck!",86693,https://cdn2.scratch.mit.edu/get_image/project/235887069_480x360.png,2018-07-09T11:30:21.000Z,2018-07-10T11:07:59.000Z,2018-07-09T11:57:01.000Z,10,3,1,0,0,,
235888016,#GettingUnstuck5 - This cat flyies (and plays!),All sprites and costumes taken from the Scratch repository,"Press green flag and follow the instructions.

This project is part of #GettingUnstuck initiative #CreativeComputing, Day 5, ""Flying Leap""

""Create a project that involves one or more sprites jumping or flying. For example, you could animate a bird flying through the clouds or a video-game character jumping across lava.""

keys:
- left & right arrow keys to move Scratchy
- up arrow to jump
- up arrow twice to fly and enter the mini-game.
- while flying, hit the color line to walk again.",1112440,https://cdn2.scratch.mit.edu/get_image/project/235888016_480x360.png,2018-07-09T11:44:29.000Z,2018-07-18T16:15:01.000Z,2018-07-09T11:58:54.000Z,19,7,1,0,0,,
235888263,How Does a Crab Jump?,"This jumping script could be polished into a platform game. I left some variables visible and adjustable so users can tweak the behavior to something they like, and maybe learn something about the script in the process.

Using variables (in place of constant values) makes it much easier to tweak the behavior of your game, too. By adjusting them, you might use the same script for different size characters, underwater, outer space, etc.","I don't know the answer to this question, but maybe we can figure something out that looks appropriate...

Press the LEFT/RIGHT ARROW to scuttle around
Press SPACE to jump

Adjust the 'Jump Strength' slider to make the crab try to jump higher
Adjust the 'Gravity Strength' slider to change the force of gravity",27306974,https://cdn2.scratch.mit.edu/get_image/project/235888263_480x360.png,2018-07-09T11:48:12.000Z,2018-07-09T17:36:44.000Z,2018-07-09T12:31:22.000Z,31,10,9,0,0,,
235886935,day-5,"Getting Unstuck - Day 5
Scratch On!","Key Left/Right - move
Key Up - fly",139209,https://cdn2.scratch.mit.edu/get_image/project/235886935_480x360.png,2018-07-09T11:28:28.000Z,2018-07-09T12:51:01.000Z,2018-07-09T12:46:56.000Z,18,4,0,0,0,,
235885509,Getting Unstuck: Day 5,,"Help Anna catch a parrot. Use arrow keys.
Press green flag to start.",12775966,https://cdn2.scratch.mit.edu/get_image/project/235885509_480x360.png,2018-07-09T11:07:42.000Z,2018-07-09T12:57:58.000Z,2018-07-09T12:57:58.000Z,9,3,0,0,0,,
148842823,dodgeball day 5,This is a project completed  as part of codeclub.,"Use the space key and arrows to reach the top. 
Dodge the balls as they come down.",11349852,https://cdn2.scratch.mit.edu/get_image/project/148842823_480x360.png,2017-03-07T15:28:51.000Z,2018-07-09T12:58:41.000Z,2018-07-09T12:51:35.000Z,16,7,0,0,0,,
235892375, Day 5 of Getting Unstuck,Day 5 of Getting Unstuck: ci voleva un po' di movimento! Piccolo progetto da perfezionare (aggiungendo ad esempio variabile punteggio o la frase: Preso!come nel progetto del Day 1 of Getting Unstuck ) ;-),Clicca la bandierina verde e poi usa il sensore del microfono per far saltare il cane.,10086796,https://cdn2.scratch.mit.edu/get_image/project/235892375_480x360.png,2018-07-09T12:42:26.000Z,2018-07-09T13:08:43.000Z,2018-07-09T13:02:26.000Z,6,1,0,0,0,,
235894360,Bambi jumping,"Getting Unstuck: Day 5

using animated gif to have a sprite with all the costumes needed for moving","Help Bambi to avoid the rocks
press space to jump",2143382,https://cdn2.scratch.mit.edu/get_image/project/235894360_480x360.png,2018-07-09T13:05:00.000Z,2018-07-09T13:11:14.000Z,2018-07-09T13:09:10.000Z,11,2,0,0,0,,
235894327,Unstuck Day 5,"This is an unfinished game that I've been stuck on for weeks. For GettingUnstuck, I removed an extra variable, ""lives"", and simplified the game further by removing multiple levels of difficulty. I also changed the setting - previously I had a blank backdrop which changed colors at each level of the game. Hoping to create something that is fun to play and then add complexity later.","In which a ship tries to get unstuck.

Use the space bar to jump, arrow keys to move left or right.

Avoid the octopus, try to reach the deep sea diver.

10 points wins the game, -10 points loses the game.",33815227,https://cdn2.scratch.mit.edu/get_image/project/235894327_480x360.png,2018-07-09T13:04:39.000Z,2018-07-09T15:39:30.000Z,2018-07-09T13:23:21.000Z,14,5,1,0,0,,
235895017,Getting Unstuck Challenge #5,,"For this challenge, I created a game demo where the object is to touch/catch ball. I need to add some more details but the motion mechanics seemed to work ok. ",10296314,https://cdn2.scratch.mit.edu/get_image/project/235895017_480x360.png,2018-07-09T13:11:23.000Z,2018-07-09T13:33:19.000Z,2018-07-09T13:31:55.000Z,8,2,0,0,0,,
235893850,Unstuck Day 05 Scratchy Bounce,"This is based on the Hasee Bounce game from the neopets web site: http://www.neopets.com/games/game.phtml?game_id=368

UPDATE: Timer is the orange bar at the top. Black line counts down time remaining. I have added apples to float from left and right. They increase speed throughout the game. Different colored apples are worth different points. Every additional apple caught beyond the first during one jump down and up multiplies points scored.

Previous notes: I plan to add objects floating horizontally across the screen for the cats to catch for points. I have only programmed the bouncing so far.

","Press the space bar to bounce one cat down and the other cat up. Time the jumping to catch and eat the apples!
You can move each cat to the right and left with the right and left arrow keys.
Time is up when the orange line is gone.
The apples speed up throughout the game!
",14632339,https://cdn2.scratch.mit.edu/get_image/project/235893850_480x360.png,2018-07-09T12:59:07.000Z,2018-07-10T02:22:03.000Z,2018-07-09T13:28:06.000Z,23,6,5,0,0,,
235895896,Day 5 of Getting Unstuck,"This is a project I usually do with my students so I created a new one for this and changed my sprite to a bird that flaps his wings instead of my usual helicopter. 

I immediately thought of this project when I saw today's challenge. My students always have fun when we create this game and they always think of ways to change it up. I wanted to do something a little different just to add some creativity to it. This was fun to think about. I am not a good player of this game however.

If I had more time I might add in a piece that would make the bird go faster or the bars speed up once a person reaches a certain score. I might try to come back and do that later on. I am teaching a Scratch camp this week so my time is limited right now.","Day 5 Challenge of Getting Unstuck

Press green flag to start, but use the Space bar to make the bird move up and fly ahead through the bars.",588430,https://cdn2.scratch.mit.edu/get_image/project/235895896_480x360.png,2018-07-09T13:19:47.000Z,2018-07-10T14:01:44.000Z,2018-07-09T13:41:52.000Z,7,2,1,0,0,,
235897459,Getting Unstuck #5,"I never thought that this would be easy, and I was right. I'm quite happy with the way that the ground moves up and down. I can't get the clouds to move correctly. I can't even quite figure out what's wrong with them, but they don't move the way I expect them to. One of the clouds appears on the ground once you get too low, but I'm happy to call that mist. If I had more time on this I'd fix the mist and try to figure out why the clouds don't move up and down as I change the angle of the plane. I'd also add some hills to make the illusion of movement stronger.","This is my project for Getting Unstuck Day 5. Just use the Up and Down arrows to have a fly, but don't get too low.",141519,https://cdn2.scratch.mit.edu/get_image/project/235897459_480x360.png,2018-07-09T13:33:28.000Z,2018-07-10T12:43:49.000Z,2018-07-09T13:37:04.000Z,13,3,2,0,0,,
235896520,Day 5 - Flying,I copied the basic idea from a project developed by a 10 year old student I worked with,,24154277,https://cdn2.scratch.mit.edu/get_image/project/235896520_480x360.png,2018-07-09T13:25:38.000Z,2018-07-09T13:43:49.000Z,2018-07-09T13:43:37.000Z,11,5,1,0,0,,
235892227,Getting Unstuck: Day 5 — Jumping Scratchy,"Reflection

I set out to create a jumping effect that used velocity, acceleration, gravity, and friction to make the animated sprite look and feel more fluid. To accomplish this, many variables were needed to track the changes in movement.

There is a bug in the project in which Scratchy will start moving beyond the edges and gets semi-stuck. This is what I would fix given more time.","Move with LEFT and RIGHT arrows.
Jump with SPACEBAR.",26264460,https://cdn2.scratch.mit.edu/get_image/project/235892227_480x360.png,2018-07-09T12:40:34.000Z,2018-07-09T13:43:15.000Z,2018-07-09T13:36:58.000Z,13,3,2,0,0,,
235898349,Getting Unstuck Day 5,"I made the Cat perform a relatively realistic jump with ""proper"" gravity. The balls then felt natural as a challenge. It's a sort of minimalist flappy bird but without the hassle of flight! You can easily adjust the jump by changing the value of gravity or the initial jumpSpeed value given when the space bar is pressed. Might be fun to make them into sliders. Also needs some decoration and sound effects!

Confession - I did have some bits of this game lying around already, but I'd never managed to make a pleasing game with them before. If I had more time I'd maybe mix up the objects a bit so you had some variety, or make jump power depend on how long you hold the space bar down.","Getting Unstuck Day 5

Create a project that involves one or more sprites jumping or flying.

Click the green flag and then use the space bar to jump over the rolling basketballs.",2314547,https://cdn2.scratch.mit.edu/get_image/project/235898349_480x360.png,2018-07-09T13:41:00.000Z,2018-07-09T14:15:21.000Z,2018-07-09T13:50:49.000Z,10,6,4,0,0,,
235892860,Bat Cave,This game turned out a bit more challenging than I planned.  Good luck. :),"Click the Green Flag to begin.

Use the arrow keys to help the light brown bat navigate through the bat cave to the other side.  Keep away from the cave structures and other bats.",1196430,https://cdn2.scratch.mit.edu/get_image/project/235892860_480x360.png,2018-07-09T12:48:00.000Z,2018-07-09T14:00:17.000Z,2018-07-09T13:55:58.000Z,6,2,2,0,0,,
235893918,TurtleArt: Gravity Graffiti (Unstuck 5),"I got unstuck! After having a tough time figuring out how to create parabolic movement with jumping, I took a look at the studio for ideas. Thankfully, I found ""dodgeball day 5"" by misspsmith and saw how they cleverly created a ""gravity"" variable for the effect I was looking for -thanks!","After pressing the green flag to start, move the turtle around by pressing the up, down, and left arrow keys. As the turtle jumps around, it will leave colorful graffiti are on the wall. ",27690149,https://cdn2.scratch.mit.edu/get_image/project/235893918_480x360.png,2018-07-09T13:00:07.000Z,2018-07-10T11:50:02.000Z,2018-07-09T14:06:09.000Z,17,11,3,0,0,,
235892864,Getting Unstuck Challenge 5 - Mower Guy,"Didn't have too much time today so I threw this together quickly. 

Has a cloud high score system, how many feet can you mow?

Just added hidden cheat code!  Hint, it is on the keyboard. 

","Mower Guy gets an appearance. Mow the lawn and see how many feet you can get.

Up and down arrow keys move mower guy behind and in front of the bushes. 

This will keep a high score and post your name if you get it at the end, it will also save you as the high score until someone beats you",3158946,https://cdn2.scratch.mit.edu/get_image/project/235892864_480x360.png,2018-07-09T12:48:03.000Z,2018-07-12T21:36:29.000Z,2018-07-09T14:07:03.000Z,46,7,4,0,0,,
235893318,Getting Unstuck: Day 5,I used backgrounds to simulate animation. I got the inspiration for the backgrounds from the underwater scene in the Scratch background library. I recall seeing a similar activity in a Scratch tutorial using buildings in the background. ,"Click the green flag.
Just watch.",17807175,https://cdn2.scratch.mit.edu/get_image/project/235893318_480x360.png,2018-07-09T12:52:44.000Z,2018-07-09T14:17:09.000Z,2018-07-09T14:14:22.000Z,9,2,1,0,0,,
235902092,Fallo volare!,"Remix di un mio progetto (basato su un tutorial Scratch) 
per  #Getting unstuck Day 5","Muovi il gattino con i tasti freccia per prendere le stelline, ma stai attento  a non toccare l'uccellino azzurro!
Il gioco dura 30 secondi",17698999,https://cdn2.scratch.mit.edu/get_image/project/235902092_480x360.png,2018-07-09T14:10:52.000Z,2018-07-09T14:19:27.000Z,2018-07-09T14:14:49.000Z,13,7,2,0,0,,
235904487,GettingUnstuck_#5,"Getting Unstuck Day 5 is relevant to""jumping"" projects. In this game, the Triangle can jump high and attack the invaders if he is dropped the same color oil. I'm still thinking on how to ""accurately control"" the dropping oil since the oil is followed by the invaders who were created by clones.   ","▲How to Play｜Instructions
- Click the Green Flag
- Press LEFT⬅︎ or RIGHT➜ button to move
- Press SPACE button to jump
- If the Triangle is colored by the dropping oil, you can let he jump and attack the invaders having the same color
- Please avoid from the BLACK oil dropped from the invaders or the Triangle will get poisoned (⊙_⊙)
 ",31325002,https://cdn2.scratch.mit.edu/get_image/project/235904487_480x360.png,2018-07-09T14:30:27.000Z,2018-07-09T14:45:25.000Z,2018-07-09T14:31:04.000Z,14,7,3,0,0,,
235900740,Jumping Pico,A bit super Mario-ish?  Needs sounds and counter,"Press  space to do your first jump.
Press right arrow to jump to the blue platform.",33472226,https://cdn2.scratch.mit.edu/get_image/project/235900740_480x360.png,2018-07-09T13:59:11.000Z,2018-07-09T14:48:10.000Z,2018-07-09T14:46:33.000Z,10,2,0,0,0,,
235893585,Brazil Tour remix Getting Unstuck Day5," I remixed this project to adapt it to Getting Unstuck Day #5: Create a project that involves one or more sprites jumping or flying.
If I had more time I would make an interactive project, for example, people could choose the part of Brazil to visit.


Sound from Freesound.org
 ",Click on the green flag to learn more about Brazil.,2176961,https://cdn2.scratch.mit.edu/get_image/project/235893585_480x360.png,2018-07-09T12:55:52.000Z,2018-07-09T19:17:01.000Z,2018-07-09T14:51:44.000Z,8,3,2,0,0,,
235886057,Unstuck Day 5: Quacking Up,"This was fun!!!
Still draft version . . . 
The duck is not yet quacking.  Going to take a break and enjoy the day. Would like to revisit later to add sounds for touching butterfly and bug as well, and maybe a point counter.  Have not yet figured out how to do that.  So much to learn :)
Played around with costumes to change direction of character and motion when jumping.
TY @smjrobotics for tip to layer Scratch in front of other characters.
Stored scripts in ""backpack"" suggested by @alirb
","Today's goal: Create a project that involves one or more sprites jumping or flying. 
Try to get the duck!
To move Scratch, use arrow left, arrow right, or the up keys.",18337230,https://cdn2.scratch.mit.edu/get_image/project/235886057_480x360.png,2018-07-09T11:15:45.000Z,2018-07-09T20:20:16.000Z,2018-07-09T14:55:04.000Z,11,4,1,0,0,,
235822596,Unstuck day 5,This specific jump can be used in a running game and every time Scratch touches the blue pole he will lose points,Click the green flag and then space bar for a salto,33890948,https://cdn2.scratch.mit.edu/get_image/project/235822596_480x360.png,2018-07-08T13:32:43.000Z,2018-07-09T14:59:27.000Z,2018-07-09T14:58:07.000Z,8,1,0,0,0,,
235905106,Flying Cat Finished,"****Updated
Ok, I figured it out. Removed the unneeded 4 way movement with arrows, added in a point system, and included a way to win. It makes much more sense now. 

****Orginial
I  really wanted to make my cat move, but I had a lot of trouble figuring out how. I tried to  implement a similar block of code that I used when testing out the Moonhack activity for Scratch, the one that governs the lunar landar, but I couldn't get it work the way I wanted. I then realized that what I wanted Scratch to do was more akin to Flappy Bird, so I looked for an example of that in Scratch. The first result was almost a pixel for pixel reproduction and I couldn't understand the code, so I searched for something simpler and found a block of easier to understand code from a @gotrhythm and that seems to be working for me now. I expect to have the flying ball as something Scratch avoids, or maybe catches. Haven't figured that out yet. It still needs to be fixed so I don't get a ball explosion when Scratch causes the cloning to start. ","Use the space bar to ""fly""

Avoid landing in the grass, and try to collect points by touching the yellow ball. 1000 points will let you win!",22706156,https://cdn2.scratch.mit.edu/get_image/project/235905106_480x360.png,2018-07-09T14:35:53.000Z,2018-07-10T11:41:50.000Z,2018-07-09T15:11:40.000Z,4,1,0,0,0,,
235903750,#005 GettingUnstuck - Jumping or Flying,,Had to refer to some previous tutorials to figure out how to make the clouds move and the frog jump.,20126730,https://cdn2.scratch.mit.edu/get_image/project/235903750_480x360.png,2018-07-09T14:24:44.000Z,2018-07-09T15:19:35.000Z,2018-07-09T15:19:05.000Z,6,1,0,0,0,,
235880659,Getting Unstuck: Day 5. Let's see the world!,,"Press the green flag to start 
Click space to let the frog jump
Click Arrow up and Arrow down to let cat fly up and down in the sky    ",18190669,https://cdn2.scratch.mit.edu/get_image/project/235880659_480x360.png,2018-07-09T09:46:01.000Z,2018-07-09T15:50:45.000Z,2018-07-09T15:29:21.000Z,9,2,0,0,0,,
