id,title,description,instructions,author/id,image,history/created,history/modified,history/shared,stats/views,stats/loves,stats/favorites,stats/comments,stats/remixes,remix/parent,remix/root
236048072,Getting Unstuck Day 5  MoonHack Remix,I recently completed the Moonhack 2017 project and it included a jump script.  I added Gobi as my second character for that.,"Instructions for completing this project are found at https://codeclubprojects.org/en-GB/scratch/moonhack-scratch/

For Scratch the Cat:
Space Bar = jump
Right Arrow = walk right
Left Arrow = walk left

For Gobi:
Up Arrow = jump
L = walk left
R = walk right",34190765,https://cdn2.scratch.mit.edu/get_image/project/236048072_480x360.png,2018-07-10T19:31:03.000Z,2018-07-10T21:01:20.000Z,2018-07-10T19:32:22.000Z,4,1,0,0,0,160239226,160239226
235940771, ball bomb,Its difficult to make the controls run smoothly,"Use arrows to control the ball
Jump over the bombs
When you have touched a bomb 3 times its game over.",11482292,https://cdn2.scratch.mit.edu/get_image/project/235940771_480x360.png,2018-07-09T20:21:30.000Z,2018-07-10T20:30:22.000Z,2018-07-10T20:10:16.000Z,2,0,0,0,0,,
236024169,Getting Unstuck Day 5 - Flying Unicorns,"This was challenging.  I tried to make one unicorn look like it was flying off towards the sun, but when I would hit stop and then hit the flag again the white unicorn would no longer be there.  Any advice is welcomed! Thank you!",Click the green flag. ,34221568,https://cdn2.scratch.mit.edu/get_image/project/236024169_480x360.png,2018-07-10T15:44:45.000Z,2018-07-10T20:37:52.000Z,2018-07-10T20:34:51.000Z,13,1,0,0,0,,
236051936,Tumbleweeds in the wind,"Having a hard time stopping the scratch at the right time. I wanted the weeds to hit go off the edge as if they were continuing off the page but couldn't figure that out. I tried ""repeat until hits edge"" but they just kind of hit the end and still move oddly. ",Press the green flag and watch the weeds blow.,34227265,https://cdn2.scratch.mit.edu/get_image/project/236051936_480x360.png,2018-07-10T20:21:28.000Z,2018-07-10T20:58:54.000Z,2018-07-10T20:57:10.000Z,9,0,0,0,0,,
236039863,Unstuck Day 5 - Beach Games,"1. I couldnt work out how to only allow one point for each 'touch' as the script continually sees Hannah touching the ball.
2.  I coudlnt work out how to get the crab to reduce the points as much as I tried. :(

NOTE: My son helped me fix the glitch by adding a (wait) block!
Genius! @epic_dab123
","Getting Unstuck Day 5
#CreativeComputing
#GettingUnstuckThis took me HOURS to do.  Every time I thought I was getting somewhere, I made a small change and messed up the scoring.
Move Hannah using the arrow keys to catch the ball and claim 1 point.
Watch out for the crab as he will steal 1 point!
game over when you reach 10 points....  thats if I ever get it working!
Hope you have fun playing.  Its tricky.
Comments welcome!",24864870,https://cdn2.scratch.mit.edu/get_image/project/236039863_480x360.png,2018-07-10T18:12:24.000Z,2018-07-15T09:58:35.000Z,2018-07-10T21:06:54.000Z,24,3,0,0,0,,
236051715,day 05,,,771142,https://cdn2.scratch.mit.edu/get_image/project/236051715_480x360.png,2018-07-10T20:18:20.000Z,2018-07-10T21:09:45.000Z,2018-07-10T21:09:00.000Z,3,0,0,0,0,,
236051160,Flying Hippo (Getting Unstuck Day 5),Use the how to tutorial.,"Click the flag to begin.

Use the up and down arrow to move the hippo in desired direction.",34198395,https://cdn2.scratch.mit.edu/get_image/project/236051160_480x360.png,2018-07-10T20:10:28.000Z,2018-07-15T04:08:27.000Z,2018-07-10T21:08:49.000Z,4,2,0,0,0,,
236053903,Getting Unstuck Day 5,"Thanks to Getting Unstuck for the idea for this project.
I was inspired to use sound sensing by the project @mres demonstrated during his TED talk where a bat is controlled by the sound made by the audience.
I'd like to make this project into a game where obstacles appear and move towards Scratch and the user has to try and control Scratch to avoid them or collect them.
Feel free to remix and have a go yourself.","Click the green flag to go.
Use the microphone on your computer to detect noise. The more noise you make, the higher Scratch will fly!",287832,https://cdn2.scratch.mit.edu/get_image/project/236053903_480x360.png,2018-07-10T20:49:08.000Z,2018-07-10T21:14:30.000Z,2018-07-10T21:09:18.000Z,11,3,0,0,0,,
236000374,Getting Unstuck: Day 5,,"Click the octopuses! (they are not exactly ""flying"" but ""flying"" in the water :))",599612,https://cdn2.scratch.mit.edu/get_image/project/236000374_480x360.png,2018-07-10T12:26:00.000Z,2018-07-10T21:21:52.000Z,2018-07-10T21:20:54.000Z,3,0,0,0,0,,
236039555,#GettingUnstuck Day 5-2,,Use the arrows to get Bat to its home. Bump into Ghost or Dragon for a special effect.,18062705,https://cdn2.scratch.mit.edu/get_image/project/236039555_480x360.png,2018-07-10T18:09:52.000Z,2018-07-10T22:02:56.000Z,2018-07-10T21:57:12.000Z,3,0,0,0,0,,
236053434,Day 5 - Flying in Space,"I made a spaceship fly through space and various things pass it by. It was hard getting all the timing right, and it's still not great!",Click the green flag.,31044612,https://cdn2.scratch.mit.edu/get_image/project/236053434_480x360.png,2018-07-10T20:42:34.000Z,2018-07-10T22:01:28.000Z,2018-07-10T22:00:38.000Z,9,0,0,0,0,,
236041597,Getting Unstuck - Day 5,"The most difficult part of this project was the skipping of the rock and changing the size as it got farther away.  When I did that with the cat AND the rock at the same time it became difficult to keep the rock in the cat's hand.  So, it hides during the cats run and then shows at the time of the toss.  I added the geese and the canoers just for interest.  

If I had time, I'd add add code for IF the rock hits the canoers as they go by.","Getting Unstuck Day 5: Create a project that involves one or more sprites jumping or flying.

I was inspired by my lake house and a news report I saw about a rock skipping contest.  

Click on the green flag to start everything. Then Click on the Scratch Cat to skip a rock a random number of times between 1 and 10.  Click on the Scratch Cat to replay.",14400846,https://cdn2.scratch.mit.edu/get_image/project/236041597_480x360.png,2018-07-10T18:26:08.000Z,2018-07-10T22:20:04.000Z,2018-07-10T22:14:11.000Z,4,2,0,0,0,,
236065190,Getting Unstuck Day 5,"I had fun creating this backdrop. I was inspired by my trip to California in June - wishing I could be back at the beach.

My buildings keep going on top of each other but otherwise the project went how I wanted it to. ",click the green flag to watch the airplane fly,24781756,https://cdn2.scratch.mit.edu/get_image/project/236065190_480x360.png,2018-07-11T00:10:34.000Z,2018-07-11T13:36:35.000Z,2018-07-11T00:33:34.000Z,6,0,0,0,0,,
236069543,Going Batty,"Again, I found I had to add ""wait .5 second"" block between the flaps of the wings in order for the bat wing movement to work.",Start the flying movement with the green flag,34205973,https://cdn2.scratch.mit.edu/get_image/project/236069543_480x360.png,2018-07-11T01:10:49.000Z,2018-07-11T01:31:14.000Z,2018-07-11T01:29:00.000Z,6,0,0,0,0,,
236075491,Flying Sprites- Day 5,Create a project that involves one or more sprites jumping or flying. ,Press the green flag.,25165723,https://cdn2.scratch.mit.edu/get_image/project/236075491_480x360.png,2018-07-11T02:46:08.000Z,2018-07-11T03:04:07.000Z,2018-07-11T03:04:07.000Z,4,0,0,0,0,,
236076329,Unstuck Day 5 Rushing,"This lesson uses a moving background.  The bat's position is only moving up and down.  The illusion of forward movement is gained by the background moving to the left.

To make this more engaging to students -- we would add a way to score points.  Maybe insects would randomly appear and if the bat caught them points would be earned.  Or -- perhaps the game would be over if the bat hit the tree.  Lots of options.  ",Click the Green Flag to start.  Then use the space key to help the Bat fly through they sky.  ,7525698,https://cdn2.scratch.mit.edu/get_image/project/236076329_480x360.png,2018-07-11T03:02:28.000Z,2018-07-11T03:18:01.000Z,2018-07-11T03:18:01.000Z,8,1,0,0,0,,
235984303,unstuck 5,When you clck on the plane I had to move it to the background otherwise the heart didn't show.,Why did a plane sometimes wink above our house? This is a story about the last two weeks before I was born.,1072279,https://cdn2.scratch.mit.edu/get_image/project/235984303_480x360.png,2018-07-10T08:36:03.000Z,2018-07-10T19:35:38.000Z,2018-07-10T19:32:44.000Z,15,3,0,0,0,,
236088677,Getting Unstuck - Day 5,I played with having a sprite scroll forever back and forth. The bounce function was also implemented whenever the avocado touches the human. I also needed to clone the avocado once it reached a certain height and put it back in a random position on the top.,Press the green flag and watch a hungry Jess try to eat avocados. What happens if she succeeds?,25334812,https://cdn2.scratch.mit.edu/get_image/project/236088677_480x360.png,2018-07-11T07:11:33.000Z,2018-07-11T08:21:26.000Z,2018-07-11T08:18:23.000Z,4,0,0,0,0,,
236103553,Hit the Apple!,"Getting Unstuck day-5
by Massimo Marletta
","Hit the Apple and avoid the Shark!
Move fast the Red-Arrow to hit the Apple but stay away from the vicious Shark!
Use the Left Arrow key to increase speed, the Right Arrow key to decrease speed, the Up/Down Arrows to change direction.
Every time you hit the Apple you will earn as many points as your speed; if you touch the Shark you will lose points.",4804940,https://cdn2.scratch.mit.edu/get_image/project/236103553_480x360.png,2018-07-11T10:42:37.000Z,2018-07-11T11:33:06.000Z,2018-07-11T11:27:27.000Z,7,0,0,0,0,,
236106138,Flying - Getting Unstuck Day 5,"Royalty free music
Composer: Benjamin TISSOT (alias Bensound)
Summer","Click on the green flag.
Small animation with the seagull.
<-><-><-><-><-><-><-><-><-><-><-><-><-><-><-><-><-><->
Getting Unstuck: Day 5 - #CreativeComputing

Create a project that involves one or more sprites jumping or flying. For example, you could animate a bird flying through the clouds or a video-game character jumping across lava. 
<-><-><-><-><-><-><-><-><-><-><-><-><-><-><-><-><-><->",24583107,https://cdn2.scratch.mit.edu/get_image/project/236106138_480x360.png,2018-07-11T11:16:58.000Z,2018-07-11T11:37:04.000Z,2018-07-11T11:37:04.000Z,6,0,0,0,0,,
236113376,unstuck5 WingSuit in Space,"Still need to add some more flying objects
Thought it might be a bit data hungry but is running ok on my bowser.","How fast can you reach the ground?
Dont hit any flying objects

left right keys
Up down keys hover and dive
",17651534,https://cdn2.scratch.mit.edu/get_image/project/236113376_480x360.png,2018-07-11T12:50:40.000Z,2018-07-11T13:00:52.000Z,2018-07-11T12:57:45.000Z,4,1,1,0,0,,
235984489,Getting Unstuck: Day 5,"Idea from Teaching Tech, https://www.youtube.com/watch?v=g_DsSs042sM","The little girl is blowing the dandelion and seeds are flying. 
In the end use up and down arrow.

",5819312,https://cdn2.scratch.mit.edu/get_image/project/235984489_480x360.png,2018-07-10T08:38:03.000Z,2018-07-12T13:18:58.000Z,2018-07-11T14:28:27.000Z,16,0,0,0,0,,
236133093,Getting Unstuck: Day 5,Lots more work required but fun to do,,24912473,https://cdn2.scratch.mit.edu/get_image/project/236133093_480x360.png,2018-07-11T15:36:41.000Z,2018-07-16T16:37:38.000Z,2018-07-11T15:47:32.000Z,3,0,0,0,0,,
175007086,Flying Hippo,,Use the Up and down arrow keys to move the hippo up and down,25706025,https://cdn2.scratch.mit.edu/get_image/project/175007086_480x360.png,2017-09-17T13:14:06.000Z,2018-07-11T16:14:48.000Z,2018-07-11T16:14:48.000Z,11,1,0,0,0,,
235928242,Unstuck_5,,Press the green flag to see Kitty fly from one scene to another.  Enjoy,9694576,https://cdn2.scratch.mit.edu/get_image/project/235928242_480x360.png,2018-07-09T18:10:35.000Z,2018-07-11T16:56:30.000Z,2018-07-11T16:56:07.000Z,2,0,0,0,0,,
235870660,Unstuck_4,,"After clicking the green flag, to make Kitty bigger press key b, to make Kitty smaller press key s.  To change Kittyʻs color, press m",9694576,https://cdn2.scratch.mit.edu/get_image/project/235870660_480x360.png,2018-07-09T07:23:14.000Z,2018-07-09T07:32:38.000Z,2018-07-09T07:31:34.000Z,5,0,0,0,0,,
236153263,Getting Unstuck 5,,"The task was to create something with a Sprite flying, so I used the glide block",16010675,https://cdn2.scratch.mit.edu/get_image/project/236153263_480x360.png,2018-07-11T18:49:13.000Z,2018-07-11T18:52:36.000Z,2018-07-11T18:52:13.000Z,3,0,0,0,0,,
236153468,"Day 5, Hop, Skip, Jump",,"Press s to skip.
Press h to hop.
Press j to hop.",17846897,https://cdn2.scratch.mit.edu/get_image/project/236153468_480x360.png,2018-07-11T18:51:09.000Z,2018-07-11T19:09:06.000Z,2018-07-11T19:06:51.000Z,9,1,0,0,0,,
236074384,Unstuck - Day 5,"This one was fun to make!  My daughter and I were incremental and iterative as we went move by move to make the animation.  I showed her how to make a sprite scroll up to give the impression that another stationary sprite was falling.  She made the suggestion that the Scratch Cat look like he is shrinking when he flies to catch the ballerina.  Every time we ran the program, Mik would read the speech bubbles and act out the voices of the character.  I should have just recorded her voice and played the sound for each of the exclamations. :-)
We are going to look at other people's projects and leave a comment or two.
Hope you enjoyed watching this as much as we enjoyed making it!",Click the green flag to start the show!,2456527,https://cdn2.scratch.mit.edu/get_image/project/236074384_480x360.png,2018-07-11T02:27:06.000Z,2018-07-11T21:32:52.000Z,2018-07-11T21:28:14.000Z,3,1,0,0,0,,
236167468,Getting Unstuck [Day 5],This is getting unstuck day 5!,Use the arrow keys to fly around,13594403,https://cdn2.scratch.mit.edu/get_image/project/236167468_480x360.png,2018-07-11T22:11:06.000Z,2018-07-11T22:20:52.000Z,2018-07-11T22:20:52.000Z,13,0,0,0,0,,
235989645,generative art - storm clouds flying by,"Getting Unstuck: Day 5
Create a project that involves one or more sprites jumping or flying. 

Getting Unstuck: Day 19
Create a project that uses the cloning features of Scratch. For example, you could make a project that represents a natural or human-made phenomenon.

I got really stuck on a few unexplained glitches but got unstuck after simplifying of the maths magic. 

As a bonus, I discovered an interesting graphical technique while debugging, when I turned on the pen to study the clones' path. See inside the code to try it for yourself!",Press the green flag and enjoy the fog :),34248043,https://cdn2.scratch.mit.edu/get_image/project/235989645_480x360.png,2018-07-10T09:47:57.000Z,2018-07-24T09:05:13.000Z,2018-07-12T00:53:57.000Z,25,13,5,0,0,,
236191085,5 : Watch the pipes,"Tak til LaneTechnology, som har lavet denne tutorial: https://youtu.be/637JCXOu3H8

Thank you LaneTechnology who made this tutorial:
https://youtu.be/637JCXOu3H8","Brug mellemrumstasten til at styre sommerfuglen.
Hver gang du rammer et rør, mister sommerfuglen et liv. Hvor mange point kan du få?

Use the space bar to control the butterfly. 
Every time you hit a pipe - the butterfly loses 1 life.
How high a score can you get?",1252137,https://cdn2.scratch.mit.edu/get_image/project/236191085_480x360.png,2018-07-12T06:05:25.000Z,2018-07-29T06:23:24.000Z,2018-07-12T06:22:20.000Z,5,0,0,0,0,,
236201051,Getting Unstuck Day5,"What did you like most about your project? Working out which directions/steps looked the best for flying. 

What would you do with it next, if you had more time? Do the timing properly so that it uses coordinates to determine size. Add some more characters and change the layers so they fly in front and behind the clouds. 
",,17809789,https://cdn2.scratch.mit.edu/get_image/project/236201051_480x360.png,2018-07-12T08:41:14.000Z,2018-07-12T09:15:12.000Z,2018-07-12T09:12:38.000Z,7,0,0,0,0,,
235993333,QBFJOLD - Getting Unstuck! -  Day 5,,"The Quick Brown Fox jumped over the Lazy Dog!!

Press the space bar to get the Fox to jump over the dog. 

Don't touch the dog - or game over!",19641362,https://cdn2.scratch.mit.edu/get_image/project/235993333_480x360.png,2018-07-10T10:42:01.000Z,2018-07-12T10:20:25.000Z,2018-07-11T21:32:32.000Z,6,1,0,0,0,,
236133461,Getting Unstuck #5 Camminata in spiaggia,#GettingUnstuck,"Clicca sulla bandierina verde
Usa i tasti freccia per far muovere la ragazza
Usa i tasti w s a d per far muovere il ragazzo",17320587,https://cdn2.scratch.mit.edu/get_image/project/236133461_480x360.png,2018-07-11T15:39:59.000Z,2018-07-12T10:46:34.000Z,2018-07-12T10:44:31.000Z,6,0,0,0,0,,
236203182,getting unstuck day 5,I have learned to go back and go front sprites.Ramdom bouce and glide.,espace to jump.,23020553,https://cdn2.scratch.mit.edu/get_image/project/236203182_480x360.png,2018-07-12T09:11:49.000Z,2018-07-12T17:47:08.000Z,2018-07-12T10:17:52.000Z,9,0,0,0,0,,
236203156,Getting Unstuck day 5,"I've learned to move softly the character, use random numbers for directions. 
I have enjoy doing this project and playing it.","Catch the ball. 
Move with arrows.
Space for jump.
",2680901,https://cdn2.scratch.mit.edu/get_image/project/236203156_480x360.png,2018-07-12T09:11:21.000Z,2018-07-12T10:59:27.000Z,2018-07-12T10:55:40.000Z,6,0,0,0,0,,
236152395,Jumping Music,"I shared a slightly different version on my test account! I was thinking about it and thought it would be interesting if the jumping things were music notes that hit the notes at their peak. 

I find this really mesmerizing to play with with big number of notes. 

Update: Just added chord changes after being inspired by @jsh's project Drops.

===Notes from the original===
I wanted to make something for the Getting Unstuck prompt about jumping (but ultimately also incorporated music and randomness). I didn't know exactly what I wanted it to be like, but I thought it would be fun to have lots of interactive things jumping. So I started with some clones and went from there. 

While making this, I experimented with different ways to make a smooth jumping effect. At first, I was doing it the ""math"" way, with a parabolic equation. But I found that confusing in terms of getting the effect that I wanted, and I knew that the code would be big and hard to look at! So I switched to the ""physics"" way, by having a y velocity that I constantly changed with gravity, and repeatedly changing the y position.

Of course, either would work (and they're very related) but the ""physics"" version felt more like I was using the affordances of Scratch and was easier for me to think about, so I stuck with that.

I also added ""play note"" sounds. I experimented with different scales, using lists, and ultimately landed on Bb blues.
 

","Wave your mouse to make them jump.

Change the number of jumping notes with the slider.

See what happens when you press 'r'.

Feel free to remix! What else could be jumping?",246290,https://cdn2.scratch.mit.edu/get_image/project/236152395_480x360.png,2018-07-11T18:40:26.000Z,2018-07-16T17:51:57.000Z,2018-07-11T19:23:35.000Z,352,48,33,0,0,236120296,236120296
236220704,Unstuck #5 Flying/Gliding,VERY basic but still learning,Click the right arrow for the horse to move,24269220,https://cdn2.scratch.mit.edu/get_image/project/236220704_480x360.png,2018-07-12T13:17:36.000Z,2018-07-12T13:41:12.000Z,2018-07-12T13:40:29.000Z,4,0,0,0,0,,
236224037,Getting Unstuck Day 5,Book: I also program Dschola,Run away from the dragon! Use the arrow keys! How long do you stand?,13275782,https://cdn2.scratch.mit.edu/get_image/project/236224037_480x360.png,2018-07-12T13:46:50.000Z,2018-07-12T14:07:22.000Z,2018-07-12T14:07:22.000Z,3,0,0,0,0,,
236232805,Getting unstuck day5,,space to move the bat,17636749,https://cdn2.scratch.mit.edu/get_image/project/236232805_480x360.png,2018-07-12T15:03:26.000Z,2018-07-12T15:33:55.000Z,2018-07-12T15:33:36.000Z,4,0,0,0,0,,
236241407,Getting Unstuck5: peace,,Press the green flag,16573108,https://cdn2.scratch.mit.edu/get_image/project/236241407_480x360.png,2018-07-12T16:28:41.000Z,2018-07-13T08:45:44.000Z,2018-07-12T17:00:01.000Z,2,0,0,0,0,,
236242805,unstuck 5 flying,This was very simplified compared to what I seen but I have something to work towards.,push green flag,16426717,https://cdn2.scratch.mit.edu/get_image/project/236242805_480x360.png,2018-07-12T16:41:59.000Z,2018-07-12T17:13:01.000Z,2018-07-12T17:12:04.000Z,6,0,0,0,0,,
236263796,Unstuck Day 5,"Fun project.  Great way to teach my students how changing costumes makes something look like it's moving.  Also love using broadcast/receive blocks, do powerful!",Unstuck Day 5 - all starts on Green Flag.,11885888,https://cdn2.scratch.mit.edu/get_image/project/236263796_480x360.png,2018-07-12T20:45:09.000Z,2018-07-12T20:47:21.000Z,2018-07-12T20:47:21.000Z,6,0,0,0,0,,
236262287,Unstuck Day 5 project,"Thanks to user @okpeery for inspiring me to attempt a scrolling background in my project! I struggled to get it just right, and had trouble ""stopping"" it when the cat got wet (so I took that code out), but I learned a lot in the process! #unstuck #creativecomputing",Don't get Scratch cat wet! Use the space bar to jump over the water!,17786521,https://cdn2.scratch.mit.edu/get_image/project/236262287_480x360.png,2018-07-12T20:21:57.000Z,2018-07-12T21:08:34.000Z,2018-07-12T21:07:23.000Z,8,1,0,0,0,,
236271612,Getting Unstuck Day 5 LK,There are bunnies taking over Grandma Phyllis's garden.,Click the green flag to begin,27094795,https://cdn2.scratch.mit.edu/get_image/project/236271612_480x360.png,2018-07-12T23:11:28.000Z,2018-07-13T01:41:07.000Z,2018-07-13T01:30:48.000Z,3,0,0,0,0,,
236278638,Getting Unstuck 5: From grey skies to blue,"Painting from the MET Public Domain Image
Woodpecker
Gao Qifeng

This took some time to think about how to animate the bird to appear as if it is moving off of the painting and onto the blue sky. The ability to edit images came in quite handy!  Also had to remember a little math in changing the x/y values to make the bird fly the right direction.",Click on the green flag to animate the bird from the painting,1353497,https://cdn2.scratch.mit.edu/get_image/project/236278638_480x360.png,2018-07-13T01:21:50.000Z,2018-07-13T01:57:07.000Z,2018-07-13T01:54:53.000Z,9,3,1,0,0,,
236287279,05 Getting Unstuck - Jumping,"Pikachu sprite from @Spriteman22
Thanks for @rbotero and @PrescottRoadrunner for help with the jump function - this was a new way for me and I like it!
Thank you to @jrushing72 for help with the moving background.","Use the space bar to jump over holes!
Click the green flag to begin.",5401184,https://cdn2.scratch.mit.edu/get_image/project/236287279_480x360.png,2018-07-13T04:22:33.000Z,2018-07-13T05:43:46.000Z,2018-07-13T05:42:56.000Z,5,2,0,0,0,,
149579224,Getting Unstuck Day 5,"Progetto creato da Valeria Muccio e modificato per
Getting Unstuck Day 5",Continua o modifica a tuo piacimento,15572972,https://cdn2.scratch.mit.edu/get_image/project/149579224_480x360.png,2017-03-10T16:11:08.000Z,2018-07-19T07:40:27.000Z,2017-03-10T17:25:41.000Z,4,0,0,0,0,,
236339814,day 5 of unstuck,I am just trying to get caught up after falling behind the past few days so I relied on the tutorials for help on this one!  Key learning was how to use the code to develop an animation.,,25095252,https://cdn2.scratch.mit.edu/get_image/project/236339814_480x360.png,2018-07-13T17:23:33.000Z,2018-07-13T17:40:54.000Z,2018-07-13T17:36:21.000Z,6,0,0,0,0,,
236326333,ultimate hot potato,I am having trouble making the snowflakes fall more randomly and have had to stop for now. I think I will play with some variables later to make it more realistic.,click green flag to watch the snowmen play catch with the sun.,34099462,https://cdn2.scratch.mit.edu/get_image/project/236326333_480x360.png,2018-07-13T14:39:46.000Z,2018-07-26T17:57:15.000Z,2018-07-13T22:48:14.000Z,7,1,0,0,0,,
236247078,Getting Unstuck – Day 5,"Made for Day 5 of Getting Unstuck:

Create a project that involves one or more sprites jumping or flying.",Press space to jump! Don't hit the rocks!,588648,https://cdn2.scratch.mit.edu/get_image/project/236247078_480x360.png,2018-07-12T17:24:43.000Z,2018-07-13T23:46:00.000Z,2018-07-13T23:45:31.000Z,6,0,0,0,0,,
236299270,Getting Unstuck: Day 5,Andrés Gil Ruiz.,"Space bar: swim
Right arrow: ahead
Left arrow: back

Try to catch all the fishes, but be careful with the octopus.

*There are any failures with clones. Please, if you find that, tell me in comments. Thanks.

I've learned how make the sprites repeat movements. ",27636310,https://cdn2.scratch.mit.edu/get_image/project/236299270_480x360.png,2018-07-13T08:14:54.000Z,2018-07-14T05:57:36.000Z,2018-07-14T05:53:46.000Z,3,0,0,0,0,,
73234574,I like apple !,"Semplice gioco per l'uso della tastiera.

Learning to use the keyboard.","Clicca sulla bandiera verde: al pappagallo piacciono le mele, perciò  usa le frecce per farlo muovere.

Click on the green flag: parrot likes apples, then use arrows to move it.
",11312120,https://cdn2.scratch.mit.edu/get_image/project/73234574_480x360.png,2015-08-16T14:52:47.000Z,2018-08-06T11:21:41.000Z,2018-07-14T08:15:35.000Z,5,1,0,0,0,,
236337061,Unstuck 5,,,18827386,https://cdn2.scratch.mit.edu/get_image/project/236337061_480x360.png,2018-07-13T16:49:36.000Z,2018-07-13T16:50:01.000Z,2018-07-13T16:50:01.000Z,2,0,0,0,0,,
236391758,Getting Unstuck: Day 5,"This is my project for Day 5 of the Getting Unstuck programming challenge.

This animation praises freedom. There are two parrots that fly free in the sky and change direction every time they meet. I also added background music to make the animation more interesting.

Challenge archive:
https://us18.campaign-archive.com/home/?u=5dd4d8b32f719a30cbde507c6&id=cc0b423621",Create a project that involves one or more sprites jumping or flying.,34314391,https://cdn2.scratch.mit.edu/get_image/project/236391758_480x360.png,2018-07-14T11:07:30.000Z,2018-07-14T11:40:11.000Z,2018-07-14T11:36:57.000Z,7,0,0,0,0,,
