id,title,description,instructions,author/id,image,history/created,history/modified,history/shared,stats/views,stats/loves,stats/favorites,stats/comments,stats/remixes,remix/parent,remix/root
235940874,Unstuck Day 5: v2 Quacking Up - Sounds Work,"Got the sounds working . . . needed a hint from the Scratch Wiki.
Played around with costumes to change direction of character and motion when jumping.
TY @smjrobotics for tip to layer Scratch in front of other characters.
Stored scripts in ""backpack"" suggested by @alirb
","Today's goal: Create a project that involves one or more sprites jumping or flying. 
Try to get the duck!
To move Scratch, use arrow left, arrow right, or the up keys.",18337230,https://cdn2.scratch.mit.edu/get_image/project/235940874_480x360.png,2018-07-09T20:23:06.000Z,2018-07-09T21:02:21.000Z,2018-07-09T20:50:15.000Z,7,3,1,0,0,,
235903911,Tennis lesson with the bird - Hand eye coordination,"Following images are copied from the follwoing sites and modified to be used for this project.
tennis court image: https://jp.123rf.com/photo_10876536_%E3%83%86%E3%83%8B%E3%82%B9%E3%82%B3%E3%83%BC%E3%83%88.html
Tennis racket image:
https://www.dreamstime.com/stock-photography-vintage-tennis-racket-old-wooden-isolated-white-background-image36551132",Improve your hand eye coordination!   Click the green flag to start the game.  Move your mouse to go up and down along the baseline.,17257831,https://cdn2.scratch.mit.edu/get_image/project/235903911_480x360.png,2018-07-09T14:25:42.000Z,2018-07-10T02:12:08.000Z,2018-07-10T01:28:24.000Z,13,4,1,0,0,,
235940293,Frog and Butterfly,"Credit for the frog croak goes to SoundBible.com 

Reflection: The Flappy Parrot project from Code Club World is one of my club's favorite projects.  This is a 2-player take on that project.  This needs a bunch of testing to gauge the fun/difficulty or imbalance between the players.

I thought about using a clone for the levels, but duplicating the frog Sprite was a quick way to get a few levels.","Getting Unstuck #5: Create a project that involves one or more sprites jumping or flying.

This is a two player game.   Frog: use spacebar to make the frog jump and try to eat the butterflies.

Butterfly: use up-arrow to fly up and right-arrow to go forward.  Try to get past the frog.

There are three levels.

 ",399245,https://cdn2.scratch.mit.edu/get_image/project/235940293_480x360.png,2018-07-09T20:15:23.000Z,2018-07-09T21:12:54.000Z,2018-07-09T21:12:54.000Z,7,2,0,0,0,,
235946012,jump or fly,"I had soo much fun creating this project!! Thanks :)
Using messages to determine backgrounds and different actions is very easy but, when you have a lot of different algorithms that starts with the same messagge...you have to be carefull! :)
","Click the green flag!!
If you choose to fly use the mouse pointer to catch flies!
If you choose to jump use the space bar to eat its special meal ;)",6030800,https://cdn2.scratch.mit.edu/get_image/project/235946012_480x360.png,2018-07-09T21:36:22.000Z,2018-07-10T05:00:41.000Z,2018-07-09T21:36:40.000Z,10,6,0,0,0,,
235946715,#creativecomputing Day 5,,,23419026,https://cdn2.scratch.mit.edu/get_image/project/235946715_480x360.png,2018-07-09T21:48:04.000Z,2018-07-10T18:37:04.000Z,2018-07-09T21:50:27.000Z,6,3,0,0,0,175349446,175349446
235938519,"Unstuck Day 5, Scratch Cat Catches Mouse",,Scratch cat is hungry.  Move Scratch cat by dragging the mouse to catch mice as the fly across the yard!,18198558,https://cdn2.scratch.mit.edu/get_image/project/235938519_480x360.png,2018-07-09T19:52:18.000Z,2018-07-13T21:27:49.000Z,2018-07-09T21:40:25.000Z,8,3,0,0,0,,
235918163,Trampoline,,Aim the trampoline with your mouse. Don't let the cat fall!,4909710,https://cdn2.scratch.mit.edu/get_image/project/235918163_480x360.png,2018-07-09T16:37:07.000Z,2018-07-30T20:26:03.000Z,2018-07-09T21:55:16.000Z,11,3,1,0,0,,
235943200,Getting Unstuck Day 5 - Flying Penguin,,,11634746,https://cdn2.scratch.mit.edu/get_image/project/235943200_480x360.png,2018-07-09T20:55:04.000Z,2018-07-09T22:01:12.000Z,2018-07-09T21:57:28.000Z,11,2,0,0,0,,
235948227,hippo star hunter,,,22093255,https://cdn2.scratch.mit.edu/get_image/project/235948227_480x360.png,2018-07-09T22:16:37.000Z,2018-07-09T22:19:44.000Z,2018-07-09T22:19:42.000Z,9,4,1,0,0,,
235947619,Day 5 Let's Go Fly a Kite,,"Click the flag to make the kite fly in nice weather. When you click the space bar, a storm comes. 

If you click on the kite, the storm and the kite stop.",10309968,https://cdn2.scratch.mit.edu/get_image/project/235947619_480x360.png,2018-07-09T22:04:37.000Z,2018-07-25T01:20:23.000Z,2018-07-09T22:50:44.000Z,13,2,0,0,0,,
206929608,"1,2,3 salta insieme a me! Day 5 Getting Unstuck ","Getting Unstuck Day 5: Flying Leap: Create a project that involves sprites jumping or flying.
In this project I employed scripts that I already used in some of my projects.
Work in progress.",Press space to jump and right or left arrows to move Felix,8789156,https://cdn2.scratch.mit.edu/get_image/project/206929608_480x360.png,2018-02-28T23:44:33.000Z,2018-08-01T19:55:17.000Z,2018-07-09T23:07:01.000Z,12,3,0,0,0,,
235948564,Unstuck Day 5 - Baskeball Playing Wizard,"Challenge: sprites jumping or flying

If I had more time, I'd like to make the shots from random places.  In order to keep score, I had to add the Scratch logo to the backboard. I tried some other strategies, but this seemed to work best. 

Update: The basketball is now being shot from random spots. Plus I have it disappear for a very short time to give the appearance it's going through the hoop. Also, I created another costume for the wizard, so that his wand arm disappeared.
",Press the flag first. Then press the spacebar as many times as you wish. The wizard will cast his magic spell and make a basket each time. You can see the score.,10715270,https://cdn2.scratch.mit.edu/get_image/project/235948564_480x360.png,2018-07-09T22:23:04.000Z,2018-07-29T14:18:46.000Z,2018-07-09T23:33:17.000Z,10,3,0,0,0,,
235945286,"""Penguin Jump"" for Getting Unstuck (Day 5)","I'm excited to share my first project for Getting Unstuck (https://gettingunstuck.gse.harvard.edu/)! 

I created a simple jump cycle using a penguin sprite created by  Charky27. (Thanks, Charky!) I added the little wobble of the iceberg to give the animation a bit more life. Perhaps I'll come back later to work more on the background and add other features. Feel free to remix! ",,3484484,https://cdn2.scratch.mit.edu/get_image/project/235945286_480x360.png,2018-07-09T21:25:04.000Z,2018-07-09T23:50:55.000Z,2018-07-09T21:41:36.000Z,258,38,14,0,0,,
235951380,Day 5 - Flying Sprites - Space Adventures,"Day 5-Create a project that involves one or more sprites jumping or flying.

Did this one with my niece and we were trying to get the variable of visited planets to end the game. Not enough time together to finish.",Type in the name of the place you want to visit. Make sure to capitalize to get the correct destination.,16509596,https://cdn2.scratch.mit.edu/get_image/project/235951380_480x360.png,2018-07-09T23:19:39.000Z,2018-07-18T01:18:50.000Z,2018-07-10T00:22:53.000Z,16,8,2,0,0,,
235956263,Getting Unstuck Day 5 - Superpowers,,"Click the green button to start/reset the project, then click on the ""Fly"" button in the lower right-hand corner to make Amon fly across the screen.",22156688,https://cdn2.scratch.mit.edu/get_image/project/235956263_480x360.png,2018-07-10T00:44:57.000Z,2018-07-10T01:01:59.000Z,2018-07-10T01:00:27.000Z,5,2,0,0,0,,
235953588,Day 5-Flying bonus power in a platform,"I was stuck on this and then got some help from @HESteachers  THANK YOU!  So this project was just about figuring out how to give sprite bonus power of flying within a platform game. I have made simple platform games before but never with a bonus power.  All my effort went into the code and not the sprite or background, so that is all very minimal.  I am happy with the solution but still wondering if there is a better way to do this.","Create a project that involves one or more sprites jumping or flying.
For this instead of idea or theme, I am starting with the code. I want to make the sprite be able to jump and then suspend gravity and fly for 5 seconds when the cat touches orange. 

",1294980,https://cdn2.scratch.mit.edu/get_image/project/235953588_480x360.png,2018-07-10T00:02:01.000Z,2018-07-24T16:31:17.000Z,2018-07-10T00:53:50.000Z,27,4,1,0,0,,
235927777,Getting Unstuck Day 5 Challenge,,"Redid most of this project. Use the right and left arrow keys to move the dog forward or backward. Press the space bar to make the dog jump and bark. Unfortunately, I couldn't figure out how to keep the background scrolling. I'll have to revisit this concept again soon. I need to move on to Day 6.",17824064,https://cdn2.scratch.mit.edu/get_image/project/235927777_480x360.png,2018-07-09T18:06:32.000Z,2018-07-10T23:22:53.000Z,2018-07-09T18:12:42.000Z,7,3,0,0,0,,
235957975,Challenge5jump,,"when I saw jump, I thought of electrons jumping orbitals. So this simple program explains the solar system model of the atom, and shows the electron jumping to a higher energy level upon the absorption of light, and then emitting that light as it falls back down to ground. ",2190314,https://cdn2.scratch.mit.edu/get_image/project/235957975_480x360.png,2018-07-10T01:11:42.000Z,2018-07-10T10:04:52.000Z,2018-07-10T01:13:43.000Z,11,2,0,0,0,,
235956471,Getting Unstuck - Day 5,"If I had more time I would have x and y coordinates along the way for warnings and such OR have the diver swim in, pickup one of the boys to save and swim back. It would be complicated but doable.",Made this one timely. I've been watching the news coverage quite a bit. Click the Green Arrow to start. Use the arrow keys to navigate the diver through the cave! Your goal is to exit at the entrance.,2360384,https://cdn2.scratch.mit.edu/get_image/project/235956471_480x360.png,2018-07-10T00:48:44.000Z,2018-07-10T01:17:20.000Z,2018-07-10T01:11:35.000Z,20,11,1,0,0,,
235950997,Getting Unstuck Day 5 - Fly Away from Robot,"Loved playing with different ways to ""fly"".","Use the arrow keys to fly your rocker away from robot. If robot catches you, it time to start again.",18558561,https://cdn2.scratch.mit.edu/get_image/project/235950997_480x360.png,2018-07-09T23:12:13.000Z,2018-07-10T03:34:33.000Z,2018-07-10T01:18:34.000Z,7,2,0,0,0,,
235957104,Day 5 Unstuck,"Credit sprites to The-Critic

This is the first time I searched for sprites and utilized the backpack function.  I feel like there is a better way then hard coding with glide to create a jump, hopefully one where I can assign a key on the keyboard to cause the character to jump.","Create a project that involves one or more sprites jumping or flying. For example, you could animate a bird flying through the clouds or a video-game character jumping across lava.",20446522,https://cdn2.scratch.mit.edu/get_image/project/235957104_480x360.png,2018-07-10T00:58:45.000Z,2018-07-10T01:26:11.000Z,2018-07-10T01:24:35.000Z,5,2,0,0,0,,
235920812,Nano Jump,"Created for Getting Unstuck Day 5: ""Flying Leap: Create a project that involves sprites jumping or flying."" I was so engrossed in this project that I forgot to feed my kids lunch at a decent hour! I wanted Nano to jump boulders that enter the screen at random speeds and sizes, and I wanted the game to get progressively more difficult. I was stuck on how to score points by jumping the boulders, but I figured out I could create an invisible sprite that the boulders touch. I created the music loop using Apple loops in Logic Pro.",Click the green flag to start and the up arrow to jump the space boulders. Bonus points if you touch the rocket ships!,17801875,https://cdn2.scratch.mit.edu/get_image/project/235920812_480x360.png,2018-07-09T17:03:33.000Z,2018-07-10T01:29:50.000Z,2018-07-10T01:29:50.000Z,10,5,1,0,0,,
235958312,Getting Unstuck Day 5: Flying Forever,,,728649,https://cdn2.scratch.mit.edu/get_image/project/235958312_480x360.png,2018-07-10T01:16:32.000Z,2018-07-10T01:29:57.000Z,2018-07-10T01:29:56.000Z,5,1,0,0,0,,
235953762,day 5 Getting Unstuck - puppy play,"I like the way I was really careful taking the pictures and while they are jumpy, they work a little together. 
If I had more time, I'd like to give the dog more context and have a smoother transition between the rug and the background. Today was frustrating because I didn't have much time for this and I want to see all of the projects and learn everything! How do you balance just doing something to keep up and learning something new each day? Although.. today was the first day I actually asked for help so I definitely did learn something today!",,124064,https://cdn2.scratch.mit.edu/get_image/project/235953762_480x360.png,2018-07-10T00:04:32.000Z,2018-07-10T01:46:52.000Z,2018-07-10T01:13:29.000Z,16,3,0,0,0,,
235960321,"""Penguin Jump"" for Getting Unstuck (Day 5) remix",Thank you for liking it. If you have any studios you would like me to check out just write them in the comments......,"Press the space button to see the penguin move;
Press the up arrow to see the balloons change coluor!",25188784,https://cdn2.scratch.mit.edu/get_image/project/235960321_480x360.png,2018-07-10T01:43:55.000Z,2018-07-11T00:46:09.000Z,2018-07-10T01:43:59.000Z,48,10,5,0,0,235945286,235945286
235955457,Day FIve Getting Unstuck,,,2356410,https://cdn2.scratch.mit.edu/get_image/project/235955457_480x360.png,2018-07-10T00:31:15.000Z,2018-07-10T02:02:18.000Z,2018-07-10T02:02:18.000Z,4,1,0,0,0,,
235957866,Getting Unstuck Day 5,"So many wonderful flying themed activities today.
I have created a simple flying game using lots of different blocks.
My kids love creating this style of game. Once they get their heads around that movement is created by the buildings moving and not the background, they are happy!
Would like to spend more time creating more appropriate background for this game.
Like the flying costumes of certain sprites and need to develop more skills in creating own costumes to extend this.","Help the witch gather apples while avoiding the bats.
Move up and down, left and right using arrow keys.",13484475,https://cdn2.scratch.mit.edu/get_image/project/235957866_480x360.png,2018-07-10T01:09:45.000Z,2018-07-10T02:14:16.000Z,2018-07-10T02:08:31.000Z,8,2,1,0,0,,
235961002,Getting Unstuck: Day 5,,"1. Click the green flag.
2. Watch the cat run.",14143361,https://cdn2.scratch.mit.edu/get_image/project/235961002_480x360.png,2018-07-10T01:55:13.000Z,2018-07-10T02:27:03.000Z,2018-07-10T02:24:55.000Z,10,0,0,0,0,,
235913734,Getting Unstuck: Day 5,,,9505598,https://cdn2.scratch.mit.edu/get_image/project/235913734_480x360.png,2018-07-09T15:53:02.000Z,2018-07-10T03:04:22.000Z,2018-07-10T03:04:22.000Z,6,2,0,0,0,,
235959401,Getting Unstuck Day 5,"Getting Unstuck Day 5: Create a project that involves one or more sprites jumping or flying. 

In honor of Shark Week 2018, I decided to show how great whites tend to feed. I explored costume and background changes with this one. I still need to learn how to make my code look a little more efficient. ",Click the green flag. ,10722024,https://cdn2.scratch.mit.edu/get_image/project/235959401_480x360.png,2018-07-10T01:29:48.000Z,2018-07-10T03:13:48.000Z,2018-07-10T03:00:26.000Z,5,2,0,0,0,,
235959487,Up Up and Away,"I was trying to find a way to make the airplane switch directions and go the opposite way when it hit the edge. I was unsuccessful, so if anyone has any suggestions please do not hesitate to comment. 

*Parachute person from Pixabay",Click the green flag. ,8909132,https://cdn2.scratch.mit.edu/get_image/project/235959487_480x360.png,2018-07-10T01:31:02.000Z,2018-07-11T04:21:49.000Z,2018-07-10T03:23:11.000Z,11,1,0,0,0,,
235958399,Ring My Bell Unstuck #5,"If I had more time I'd keep tweaking it. The snowman seems to hit the red (or be hit by the red) more frequently than the blue. 

Thanks to @speakvisually for the idea to make the snowman jump and rotate","Click the green flag to begin. Use the arrow keys to move up, down, left, and right. You can also use S to shrink the snowman to avoid the red bell and G to grow.

Score 2 points by hitting the blue bell. Try to avoid the red bell or you'll lose a point.",124311,https://cdn2.scratch.mit.edu/get_image/project/235958399_480x360.png,2018-07-10T01:17:45.000Z,2018-07-10T03:36:49.000Z,2018-07-10T03:31:42.000Z,5,1,1,0,0,,
235962785,Bashful Butterfly,I had made a similar game before but this time reversed the objective as it was too easy to score.,Use the mouse to make the butterfly avoid the balloons. If tapped the butterfly will freeze. Added difficulty is one balloon creates copies which can also freeze you. Lowest score wins!,30508500,https://cdn2.scratch.mit.edu/get_image/project/235962785_480x360.png,2018-07-10T02:22:59.000Z,2018-07-10T03:48:56.000Z,2018-07-10T03:48:56.000Z,11,1,0,0,0,,
235931345,Getting Unstuck: Day 5,"When I saw flying and jumping in the challenge only one story came to my mind: The Aztec's hummingbird legend. A really beautiful story. This is just a piece of it. I hope you like it. 

I experimented with creating ""jump"" instructions as well as having sequenced broadcast to tell a story. I wanted to make it interactive but I din't have that much time. I'll save it for the next time :D","Getting Unstuck Day 5.

Click the green flag.",32493591,https://cdn2.scratch.mit.edu/get_image/project/235931345_480x360.png,2018-07-09T18:35:33.000Z,2018-07-10T04:29:17.000Z,2018-07-10T04:26:41.000Z,23,6,2,0,0,,
235938087,day 5,,#NAME?,23593293,https://cdn2.scratch.mit.edu/get_image/project/235938087_480x360.png,2018-07-09T19:45:35.000Z,2018-07-11T14:10:56.000Z,2018-07-10T05:06:44.000Z,7,1,0,0,0,,
235969022,Summer Fly Unstuck Day 5 by Dawn,many many iterations.!!!,"Press the Flag to determine when the cat will catch and eat the fly.   Press the flag a couple of times. My computer is going crazy...must be my browser.  I am starting the question of randomness and fairness. Naturally, we often have flies that will fly slow and low to the ground making it easier for them to catch.  I am questioning if I should remove the low flying possibility to ensure the fly will never start in the cats mouth or be caught in less than two jumps.  ",31144646,https://cdn2.scratch.mit.edu/get_image/project/235969022_480x360.png,2018-07-10T04:32:09.000Z,2018-07-19T16:26:49.000Z,2018-07-10T05:56:29.000Z,5,2,0,0,0,,
235943582,Number Hop and Spell,"This project responds to the prompt for Getting Unstuck:  Day 5:  ""Create a project that involves one or more sprites jumping or flying. For example, you could animate a bird flying through the clouds or a video-game character jumping across lava."" 

Today's strategy was ""Find a tutorial.""  I used the Pong Game cards from the Scratch Coding Cards set!

I could also add points for right answers.  One question that I have is how to make the hopping seem a little more realistic.","Click the green flag, then get ready to practice spelling numbers 0 - 10!",527557,https://cdn2.scratch.mit.edu/get_image/project/235943582_480x360.png,2018-07-09T21:00:50.000Z,2018-07-10T06:06:33.000Z,2018-07-10T06:06:33.000Z,15,5,1,0,0,,
235942343,Flying and Jumping,,Click on the green flag and see what happens.,32833725,https://cdn2.scratch.mit.edu/get_image/project/235942343_480x360.png,2018-07-09T20:44:01.000Z,2018-07-10T06:42:40.000Z,2018-07-10T06:42:40.000Z,5,1,0,0,0,,
235975853,Untitled-40,,,15802566,https://cdn2.scratch.mit.edu/get_image/project/235975853_480x360.png,2018-07-10T06:44:42.000Z,2018-07-10T07:14:06.000Z,2018-07-10T07:14:06.000Z,4,0,0,0,0,,
235971218,day 5 - jump,"Seymour Papert and Andrea di Sessa have inspired my computational thinking about jumps.

* Papert ""Kinetic microworlds"" in http://www.papert.org/articles/AnExplorationintheSpaceofMathematicsEducations.html

* di Sessa ""Mathematics of Motion"" in https://cloudfront.escholarship.org/dist/prd/content/qt4bv8b9d2/qt4bv8b9d2.pdf
","Press the right arrow to change the horizontal velocity, up arrow for the vertical velocity.",214,https://cdn2.scratch.mit.edu/get_image/project/235971218_480x360.png,2018-07-10T05:20:47.000Z,2018-07-10T07:18:52.000Z,2018-07-10T07:18:52.000Z,8,1,0,0,0,,
235975489,Unstuck 5,If I had more time I would like to make the spider creating the web at the beginning of the game,"Press Green Flag to start.
Press Arrow keys to move up, down, right, left. 
Catch Beatles and Avoid Arrows!

Premi Bandierina Verde per iniziare.
Premi le frecce per muoverti su, giù, a destra e a sinistra.
Cattura gli scarafaggi e evita le frecce",13846307,https://cdn2.scratch.mit.edu/get_image/project/235975489_480x360.png,2018-07-10T06:39:33.000Z,2018-07-10T07:39:31.000Z,2018-07-10T07:36:33.000Z,7,0,0,0,0,,
235980133,Going on Vacation,"I had an idea for an awesome project where the Scratch Cat would jump higher and higher, and fly into space, and then land to the moon, and jump from there back to the earth... but today it was a crazy day and I couldn't find the time do make it, yet! 

So for now I decided to post this old project that I made for April's Fool 2016, when the Scratch Cat went on vacation and Scratchers were wondering where the cat was and how they were getting around! https://scratch.mit.edu/discuss/topic/191220/

I imagined the Scratch Cat happily flying on a magic carpet, wearing sunglasses and casually slaloming through the trees. I guess I'm dreaming of a getaway too! :)

Music is royalty free, from incompetech.com

Thanks @ceebee for the original project and the getting unstuck community for being so encouraging!","Click the green flag and enjoy the ride.
Press the space bar for extra fun!",2286560,https://cdn2.scratch.mit.edu/get_image/project/235980133_480x360.png,2018-07-10T07:44:08.000Z,2018-07-19T01:48:55.000Z,2018-07-10T08:16:28.000Z,16,6,2,0,0,103415695,103415695
235982847,The dove from the Ark,Should have done an animated flight but constrained by time.,"Getting Unstuck #Day 5

Click green flag to start.
",158902,https://cdn2.scratch.mit.edu/get_image/project/235982847_480x360.png,2018-07-10T08:18:16.000Z,2018-07-10T22:06:31.000Z,2018-07-10T09:33:41.000Z,6,1,0,0,0,,
235988584,ZackBoston Jumping Game,This is a game we created to use to teach Makey Makey.  Youth remix this game and connect it to a slap switch ,The space bar is connected to jump. . . .! ,27658530,https://cdn2.scratch.mit.edu/get_image/project/235988584_480x360.png,2018-07-10T09:32:47.000Z,2018-07-20T17:22:05.000Z,2018-07-10T09:33:24.000Z,18,2,0,0,0,,
235992760,Getting Unstuck Day 5,,,14159575,https://cdn2.scratch.mit.edu/get_image/project/235992760_480x360.png,2018-07-10T10:34:03.000Z,2018-07-10T10:34:37.000Z,2018-07-10T10:34:36.000Z,10,2,0,0,0,,
235992331,#GettingUnstuck_5,"Í´d like add interactions between sprites using looks, say""..."" etc.","Click ""Green Flag"" and all the animals will be moving around the background.",16962202,https://cdn2.scratch.mit.edu/get_image/project/235992331_480x360.png,2018-07-10T10:26:57.000Z,2018-07-10T11:21:43.000Z,2018-07-10T11:14:55.000Z,3,0,0,0,0,,
235995630,Day 5,,Use the arrow keys to move the bird to collect the apples.,24884035,https://cdn2.scratch.mit.edu/get_image/project/235995630_480x360.png,2018-07-10T11:20:18.000Z,2018-07-10T11:33:20.000Z,2018-07-10T11:32:56.000Z,9,0,0,0,0,,
235998267,Getting Unsucked day 5,,click on the green flag,25103547,https://cdn2.scratch.mit.edu/get_image/project/235998267_480x360.png,2018-07-10T11:57:57.000Z,2018-07-10T12:25:12.000Z,2018-07-10T12:24:40.000Z,12,2,0,0,0,,
236005832,Getting Unstuck #5,,,18174236,https://cdn2.scratch.mit.edu/get_image/project/236005832_480x360.png,2018-07-10T13:18:50.000Z,2018-07-10T13:21:40.000Z,2018-07-10T13:21:40.000Z,7,0,0,0,0,,
235933716,Flying,,Just Click on the Green flag,3602053,https://cdn2.scratch.mit.edu/get_image/project/235933716_480x360.png,2018-07-09T18:56:43.000Z,2018-07-10T15:09:20.000Z,2018-07-10T15:09:01.000Z,10,3,0,0,0,,
236020350,Candle Jumper Day #5 Getting Unstuck,"What did you like most about your project? I like that the jumping corresponds to the candles jumping. I think that I could actually make candles do this in real life. 
What would you do with it next, if you had more time? I would smooth out the transitions and figure out have to have the jumping coded differently than using the broadcast blocks.",Press the green arrow and them the space bar to start the jumping.,28676433,https://cdn2.scratch.mit.edu/get_image/project/236020350_480x360.png,2018-07-10T15:11:51.000Z,2018-07-10T15:58:10.000Z,2018-07-10T15:55:21.000Z,8,1,0,0,0,,
236027726,Getting Unstuck Day 5,If I had a little more time I'd like to figure out how to get the parrot to flap its wings as it goes across the screen!,"Challenge: Create a project that involves one or more sprites jumping or flying.

Click the green flag",34245752,https://cdn2.scratch.mit.edu/get_image/project/236027726_480x360.png,2018-07-10T16:18:23.000Z,2018-07-10T23:02:03.000Z,2018-07-10T16:32:04.000Z,4,1,0,0,0,,
236029931,Motion Study -- Unstuck Challenge 5,"I was able to use some of what I learned in the previous challenges to make my cat walk, glide and fly.  It gets easier the more familiar you are with the coding tools.  It only requires a little bit of tweaking to create new animations.","Press the green flag to start
Click the cat to begin the animation!",11608238,https://cdn2.scratch.mit.edu/get_image/project/236029931_480x360.png,2018-07-10T16:40:13.000Z,2018-07-10T16:57:56.000Z,2018-07-10T16:56:26.000Z,6,1,0,0,0,,
