id,title,description,instructions,author/id,image,history/created,history/modified,history/shared,stats/views,stats/loves,stats/favorites,stats/comments,stats/remixes,remix/parent,remix/root
236950729,Backwards language,"This took me a long time! Ultimately it came down to me not realizing that I needed to set my variable to equal the length of the answer.  After that it worked! Now I don't have as much time to make it fancy, but I'm proud of myself for learning!",I wanted to try to do a backward word generator using strings. This is what I created!,24267830,https://cdn2.scratch.mit.edu/get_image/project/236950729_480x360.png,2018-07-20T15:55:49.000Z,2018-07-20T19:57:03.000Z,2018-07-20T19:56:08.000Z,29,10,2,0,0,,
236958198,The A-to-Z Game,"I don't know if I had a ""biggest challenge"" today. I played it pretty safe, picking a project I had a good idea how I'd build. I had a few problems with initializing data (e.g., adding to lists without emptying them out), but I squashed those bugs relatively quickly. I have no idea what inspired the glass in glasses. :)

Music from the Atlantic Dance Orchestra, Tell Me With Smiles: https://archive.org/details/ReallyOldRecordingsSetA/AtlanticDanceOrchestra-TellMeWithSmiles1923edisonCylinder.mp3",This is one of my favorite games to play—press green flag to start!,39526,https://cdn2.scratch.mit.edu/get_image/project/236958198_480x360.png,2018-07-20T17:35:20.000Z,2018-07-21T09:08:07.000Z,2018-07-21T09:08:07.000Z,41,17,3,0,0,,
236883847,Colorful sound,"I had seen a previous project (Maybe the hexapath remix I did?) where a user typed in some binary (1s and 0s) in order to affect the project. What if a user could type in numbers and make some sounds happen? I had a grand vision of being able to generate strings, and perhaps ""pluck"" them somewhat...Anyway, I figured out how to store a username + sequence of sounds but didn't have time to sort out the playback. Oh well!","Press the green flag and follow along! Hover over the strings to play some notes back (this only works sometimes, and for some reason really softly).",2745846,https://cdn2.scratch.mit.edu/get_image/project/236883847_480x360.png,2018-07-19T20:31:28.000Z,2018-07-21T10:30:25.000Z,2018-07-21T10:29:45.000Z,36,13,3,0,0,,
236959179,Chromophobia Weaving,"When @karenb shared Chromophobia on Day 15, inspired by Josef Albers, I wondered how I might create a project inspired by both Josef and Anni Albers, combining chromophobia and weaving! Today seemed the perfect day, using list data to create potentially-hideous (and potentially pleasing) color combinations in weave structures, depending on your input!

The life once-considered and yet-to-be-lived in which I was a math major and the life I instead lived at art school as a textiles major are both very excited about this project. This might be the Getting Unstuck project I'm most proud of so far (:

Some stuck moments (of which there were certainly a handful) along the way included initially programming with pen drawing and struggling to get the layering to successfully simulate the weave structure I had in mind (a classic plain weave). At that point I thought maybe I'd set for transparency and realized pen drawings are only opaque. After a brief moment of AHHHH, I realized I could create a long 'thread' sprite which could be transparent, take color data, and be stamped (: 
(any tips on starting to explore layers in scratch would be much appreciated)

This was definitely part of continuing to explore my ""where could I get with programming if I don't focus on drawing...?"" question.
This also felt like something of a redemption from pattern-drawing-day disasters.

weaving sound:
https://freesound.org/people/xserra/sounds/320510/","Press the green flag, enter some data, and see the weave structure you've made!

Wanna make another? Press the space bar (:

Update: I switched the color of the origin sprite -- I learned that this will determine the range of colors for the ""color effect""
Is it more or less likely to be hideous now? 
(definitely looking to maximize hideous - beautiful range)",25705937,https://cdn2.scratch.mit.edu/get_image/project/236959179_480x360.png,2018-07-20T17:49:04.000Z,2018-07-22T12:34:14.000Z,2018-07-21T10:53:32.000Z,42,19,5,0,0,,
237004736,Memory Game,"This project was created for Day 17 of Getting Unstuck. Today's challenge was to make a project that asks the user for a list and does something interesting with it. There are multiple lists in this project, and I had a really big bug in one of them that took me 20 minutes to figure out (sheesh!). But I got to reuse a bunch of graphics and scripts from previous Getting Unstuck projects, and I had a lot of fun making it!

Music: 4bstr4ck3r, ""Soundboy""",Press the green flag to play!,56239,https://cdn2.scratch.mit.edu/get_image/project/237004736_480x360.png,2018-07-21T09:28:21.000Z,2018-07-27T01:11:47.000Z,2018-07-21T11:11:17.000Z,39,17,6,0,0,,
237008599,Be a judge on the voice! getting unstuck day 17,"Using lists is one of my favourite ways to personalize projects so I enjoyed this task! I'm actually working on creating a lesson plan for students to make a project like this, so please let me know what you think and how it can be improved.
",,4610900,https://cdn2.scratch.mit.edu/get_image/project/237008599_480x360.png,2018-07-21T11:10:03.000Z,2018-07-21T11:46:56.000Z,2018-07-21T11:41:34.000Z,23,6,1,0,0,,
237010392,Getting Unstuck: Day 17,"Shame about having to subtract 1 from the i variable, will look into that some more...",,24912473,https://cdn2.scratch.mit.edu/get_image/project/237010392_480x360.png,2018-07-21T11:59:32.000Z,2018-07-21T12:25:10.000Z,2018-07-21T12:19:51.000Z,17,7,0,0,0,,
236930779,Unstuck Day 16/17- Text Input,"This was for the Getting Unstuck challenge Day 16 but turned into a big project that I didn't have time to finish in one day. Luckily the next day challenge pretty much fits the bill as well, so it covers Day 17, too!
I have made and taught a hangman game in Python so I thought this would be doable but ran into many many problems. One was not planning carefully enough in the beginning. I was taking out random letters instead of all occurrences of specific letters.
Then Scratch does not have indexed loops (for loops) so I had to make various counters to do things based on the the current loop number. 
I have not used Snap much but this would be a good project for Snap as it would have been useful to have custom blocks that can report something. In Scratch I had to create many variables to keep track of little tasks that would have been easier with reporting blocks.
","Play Guess the Word! This is for two players, one to type the secret word and the other to guess. Have fun!
If you want to see something cool click ""under the hood"" while you play and you can see the program processing the tasks as you give it input.
Note: The reason your word can't be a phrase is the program knows when you have guessed the word by checking if it has no more spaces in it, so the spaces would keep you from every being finished.",214174,https://cdn2.scratch.mit.edu/get_image/project/236930779_480x360.png,2018-07-20T10:44:08.000Z,2018-07-21T14:01:55.000Z,2018-07-21T12:23:21.000Z,13,5,3,0,0,,
237009552,Getting Unstuck: Day 17,"I wanted to take numbers and convert them to colors, then make a design. I found several tutorials online to help me with lists and variables. Here is one of the videos that helped me get started:
https://www.youtube.com/watch?v=Xlc4DMrrEJ4
",Press the green flag and follow the prompts to create a design.,17807175,https://cdn2.scratch.mit.edu/get_image/project/237009552_480x360.png,2018-07-21T11:36:52.000Z,2018-07-21T13:35:46.000Z,2018-07-21T13:31:28.000Z,9,6,0,0,0,,
237010908,Getting Unstuck #17,"This was going to be the Swedish chef, but my digital citizenship got the better of me. 
The last bit of the list, where all the rest of the ingredients are added I couldn't figure out how to get an ""and"" in there to make it grammatically correct. I'm sure there's a way by carefully counting the ingredients and making sure that the last of them is added by itself, but I couldn't figure it out. If I devote some more time to it in the morning I might get there.

Kitchen Background: By Pbroks13 - Own work, CC BY-SA 3.0, https://commons.wikimedia.org/w/index.php?curid=4297278",Do some cooking. Press the green flag and tell us what you have in your cupboards. We'll do the rest.,141519,https://cdn2.scratch.mit.edu/get_image/project/237010908_480x360.png,2018-07-21T12:14:04.000Z,2018-07-21T13:37:41.000Z,2018-07-21T13:34:44.000Z,17,6,0,0,0,,
237013086,Donut Poetry Generator,"Credits: This is a Code Club project resource I used with 4th graders to make poetry in ELA class (projects can be found here https://scratch.mit.edu/studios/4586131/) The students, working in pairs, had to generate and code their list of words. Here I've changed it so the user adds their own parts of speech words to the list but it is still random if their word gets used.","Getting Unstuck #17 Create a project that asks the user to type in multiple words or numbers, stores the items in a list, then does something interesting with the items from the list.

Add your words to this Mad-lib style poem.",399245,https://cdn2.scratch.mit.edu/get_image/project/237013086_480x360.png,2018-07-21T13:07:18.000Z,2018-07-21T13:53:38.000Z,2018-07-21T13:53:38.000Z,27,9,0,0,0,78692754,78692754
206822234,Unstuck 17 Binary Bitmap Art,"Sample digits to enter: 7 e 8 1 a 5 a 5 8 1 b d 8 1 7 e
Another sample: 9 9 2 4 4 2 9 9 9 9 4 2 2 4 9 9

The activity that inspired this program is a Binary Bitmaps activity (http://cse4k12.org/binary/bitmaps.html) posted by Gary Kacmarcik on cse4k12.org and licensed under the Creative Commons Attribution-Share Alike 3.0 Unported License (https://creativecommons.org/licenses/by-sa/3.0/). 

For binary/hexadecimal conversion practice, check out this project from gerogero: https://scratch.mit.edu/projects/19900885/","This is a program that can check the hexadecimal numbers that are generated as part of a binary bitmap activity. 
Students create a picture on an 8x8 grid then convert the picture into binary numbers; an empty square on the grid is assigned the value 0 and a filled square is assigned the value 1. Each row has eight digits. If you split each row into two four-digit binary numbers you can then convert each row into a two-digit hexadecimal number. 
This program asks the user to enter the 16 hexadecimal digits, one at a time, and then will print the bitmap picture on an 8x8 grid on the stage.
I could modify the code so the user inputs all 16 hexadecimals at once. Does that make more sense that one digit at a time?",14632339,https://cdn2.scratch.mit.edu/get_image/project/206822234_480x360.png,2018-02-28T16:18:52.000Z,2018-07-21T22:16:43.000Z,2018-07-21T13:54:04.000Z,14,5,2,0,0,,
237011090,Day 17 - See and Say,"IMAGES:
https://upload.wikimedia.org/wikipedia/commons/a/aa/Dawn_on_the_S_rim_of_the_Grand_Canyon_%288645178272%29.jpg
https://commons.wikimedia.org/wiki/File:A_waterfall_at_Coorg.jpg
https://files.tripstodiscover.com/files/2014/11/Boracay-Philippines.jpg
https://commons.wikimedia.org/wiki/File:Pins_palustris_forest.jpg
https://commons.wikimedia.org/wiki/File:Night-sky-milky-way-galaxy-astrophotography_-_West_Virginia_-_ForestWander.jpg
MUSIC:
https://www.yourclassical.org/story/2016/03/14/daily-download-bedrich-smetana--the-moldau

I have assigned this poetry generator to classes pretty regularly, but have never made one of my own!","Click the green flag and follow the prompts
click the space bar to reset",18341966,https://cdn2.scratch.mit.edu/get_image/project/237011090_480x360.png,2018-07-21T12:18:46.000Z,2018-07-21T14:00:04.000Z,2018-07-21T14:00:03.000Z,11,5,1,0,0,,
236969108,Getting Unstuck: Day 17 — Word Randomizer,"Reflection

Playing with variables, lists, and data can be a lot of fun. I liked the challenge of creating a define block for splitting a string into individual words and placing them into a list. I also like creating the second define block that makes a new string by randomizing the order in which the words are removed from the list.
","Tell Scratch Cat a sentence, and they will randomize the order of the words.",26264460,https://cdn2.scratch.mit.edu/get_image/project/236969108_480x360.png,2018-07-20T20:14:34.000Z,2018-07-21T18:50:17.000Z,2018-07-21T14:27:27.000Z,4,2,0,0,0,,
237014047,Getting Unstuck day 17,"I wanted to try to work with some of the list blocks that I have not used before. I hit on the idea of using the length of the words given by the user to play particular notes. This ended up using more block than I expected. I needed a variable to itereate over the list and another to add the notes to the second list. 

With more time I would try to make the output a bit more consistently melodious. Possibly by using addition rather than multiplication to se the notes. Also, I think it might help if the note length is not random, or at least less random.","Click the green flag
follow the cat's instructions
change the instrument with the slider.",17767933,https://cdn2.scratch.mit.edu/get_image/project/237014047_480x360.png,2018-07-21T13:30:04.000Z,2018-07-21T14:43:23.000Z,2018-07-21T14:43:23.000Z,13,4,1,0,0,,
237009654,Bug Party planner (Getting Unstuck Day 17),"This is my fifth Unstuck project (three of them are shared on my other account @juf-Pinky). If you encounter a real bug, please let me know.

This was super fun to make. At first I had no idea what to make for this challenge. I wanted to do something with a dance, but I couldn't figure out in which way I could ask the user how the sprite should dance. Then I came up with the idea of a party planner. Using a list turned out to be really useful in this project. I only faced some minor bugs :) Testing all the options was time consuming though. Maybe I missed a bug... This project took me about three hours to make.

Thanks to @Mittensbrother and the Getting Unstuck team for the bug and the Unstuck logo, thanks to @ceebee for the dancing code, thanks to @chrisg for the dancing flower, thanks to @TheDiamonGamer  for the idea of the dancing pizza, thanks to @Bubblebomb for the idea of the dancing stickman. Thanks to @scratchcat for the cool Scratch cat sprites, and thanks to @TheLibrary for the code blocks I used for the confett.","Plan your own Bug Party. Please answer the questions of the bug.


I made this for Day 17 of Getting Unstuck! The challenge of today:

Create a project that asks the user to type in multiple words or numbers, stores the items in a list, then does something interesting with the items from the list.",2676515,https://cdn2.scratch.mit.edu/get_image/project/237009654_480x360.png,2018-07-21T11:39:49.000Z,2018-07-21T21:09:18.000Z,2018-07-21T14:46:49.000Z,98,35,21,0,0,,
237010640,Scratch 3 letter anagrammer fixed,"I am having nightmares with my internet as on the move. 4 letters kept crashing.
There must be a neater way to make the anagrams?
Plus I wanted to make a list of the answers but have no more time and don't know how.

18 hours later - internet still rubbish so sticking to 3 letters but fixed!",,33472226,https://cdn2.scratch.mit.edu/get_image/project/237010640_480x360.png,2018-07-21T12:06:10.000Z,2018-07-22T09:30:17.000Z,2018-07-21T14:52:23.000Z,5,1,0,0,0,,
237017004,GettingUnstuck Day 17,"In mathematics, the modal value of a set of numerical values is the number that appears most often in the whole.
This program calculates the modal value.

Book: Imparare a programmare di Boscaini","Click the green flag. 
Write the numbers in a series one at a time by clicking each time you send",13275782,https://cdn2.scratch.mit.edu/get_image/project/237017004_480x360.png,2018-07-21T14:36:07.000Z,2018-07-21T14:54:44.000Z,2018-07-21T14:50:03.000Z,7,2,0,0,0,,
237016630,day 17,"After choose anumber,you need to answer(yes or no) so to moveanother choose:)
Sorry i missed  explan that..
",press green flag.,34188789,https://cdn2.scratch.mit.edu/get_image/project/237016630_480x360.png,2018-07-21T14:27:55.000Z,2018-07-22T04:57:44.000Z,2018-07-21T14:57:32.000Z,8,2,0,0,0,,
237016867,Drawing clones,"Did you know that EVERY rectangular slot in Scratch could be filled with a variable or a list element? Messages or go to something, for example. In this demo I have inserted a list element inside the clone function.

I wonder if these ""hidden"" features were left on purpose to exercise our ""lateral thinking"".","Choose what to clone by answering the question. You can answer multiple times. When you're ready, just press enter and the clones will be created!
Use only lower case letters!

Once the clones are created, press space for drawing!",12148328,https://cdn2.scratch.mit.edu/get_image/project/237016867_480x360.png,2018-07-21T14:32:47.000Z,2018-07-21T15:48:50.000Z,2018-07-21T15:24:20.000Z,23,4,2,0,0,,
237013980,Challenge 17 - list sorting,"Wasn't sure what to do with this one today as I created 3 6000 line lists yesterday which I used Python to extract the data I needed from the raw data to import, a bit exhausting. 

Then I saw today's challenge...haha, LISTS! I was a day early. So I thought I'd work with some sorting. I had to use the Scratch wiki on the insertion sort as I haven't done those sorting methods in a few years. Good to freshen up on them and now I will create some more practice sorting for myself. ","The program will ask you how many numbers you want. I used a custom block without screen refresh for some parts, others I left there so the lists could be seen what they are performing.

Second you'll ask what you want to count by. If you put 3, the separated list will count by 3s, any other number will be sorted to an odd or even list. 

Then the list will shuffle randomly. Give you a heads up about sorting it and it will using insertion sort method to put it back in order. I used without screen refresh as the sorting took a while, this way it is just done. ",3158946,https://cdn2.scratch.mit.edu/get_image/project/237013980_480x360.png,2018-07-21T13:28:41.000Z,2018-07-21T15:31:01.000Z,2018-07-21T15:22:57.000Z,13,5,2,0,0,,
237018603,Lecca-lecca colorati,,"Scegli tre numeri per colorare i lecca-lecca bianchi: 
1-arancione
2-azzurro
3-verde
4-fucsia
5-giallo
6-rosso",34169307,https://cdn2.scratch.mit.edu/get_image/project/237018603_480x360.png,2018-07-21T15:10:15.000Z,2018-07-21T16:16:28.000Z,2018-07-21T15:55:18.000Z,9,4,1,0,0,,
237017448,Day 17 - Getting Unstuck,"Thanks to @ogonen:
Two arrays control the sequence of the drum sounds.","Chose another instrument to play with our crab.
Click crab to play sequence.
Click the buttons to toggle drum triggers and pass the mouse over the singer to let her sing.

Enjoy the concert!",26079479,https://cdn2.scratch.mit.edu/get_image/project/237017448_480x360.png,2018-07-21T14:45:53.000Z,2018-07-24T22:17:38.000Z,2018-07-21T15:35:43.000Z,8,5,0,0,0,16292660,16292660
237009637,Duck Math! - Getting Unstuck Day 17,"I feel like this is one of the more complex projects I completed. I figure out how to do the lists, and I even figured out how to check if the math answers were correct! 
I think the last thing i would change about this would be randomizing the statements the duck gives when you are right or wrong, and I think now that I understand lists this wouldn't be a big problem at all.

Thanks to a student of mine, @Jackromance for the duck inspiration!","The duck will ask you some basic math problems, and you can answer them as best you can!
Some sweet background music, so you should have your volume on.",22706156,https://cdn2.scratch.mit.edu/get_image/project/237009637_480x360.png,2018-07-21T11:39:22.000Z,2018-07-25T17:22:34.000Z,2018-07-21T16:19:15.000Z,7,1,0,0,0,157548822,157548822
237019865,Day 17:  Sum of Three Positive One Digit Numbers (Basic Project),"This is the basic version . . . I have plans to fancy it up by the end of the day, and will add more detailed notes to that version.
My main goal was to include parameters to make sure the user actually followed the instructions.  Wanted to get the three numbers in one list, and find the sum that way, but it was tricky and I knew I would be short on planning time this morning.  Went with three lists with one item each (not sure of the point of having a list with only one item . . . ) and then making a new list to find the sum of those three lists.  Would love suggestions for alternate / more efficient coding ideas.","Create a project that asks the user to type in multiple words or numbers, stores the items in a list, then does something interesting with the items from the list.

Press the green flag to begin.",18337230,https://cdn2.scratch.mit.edu/get_image/project/237019865_480x360.png,2018-07-21T15:38:28.000Z,2018-07-21T16:35:02.000Z,2018-07-21T16:35:02.000Z,5,1,0,0,0,,
236598521,Barnsley Fern remix,"Ho usato il progetto di @heldlaw, modificandolo in modo da inserire in una lista di tre elementi i numeri forniti in input dall'utente
Remix creato per Getting Unstuck Day 17","Input three numbers:
color scheme: from 1 to 4
fill density: from 1 to 20
fill size: from 1 to 3
Click the green flag, sit back and relax
Press up/down keys to change audio volume
Just a simple, relaxing animation, based on the 'Barnsley fern', a popular fractal",17698999,https://cdn2.scratch.mit.edu/get_image/project/236598521_480x360.png,2018-07-17T04:20:31.000Z,2018-07-21T18:01:07.000Z,2018-07-21T17:02:28.000Z,23,9,0,0,0,235828460,235828460
237021196,#017 Getting Unstuck Lists,"Thanks to zacjambell, https://scratch.mit.edu/projects/69079482/#editor for helping me with the script for the chores",Press the green flag.,20126730,https://cdn2.scratch.mit.edu/get_image/project/237021196_480x360.png,2018-07-21T16:07:09.000Z,2018-07-21T17:07:44.000Z,2018-07-21T17:06:37.000Z,13,3,1,0,0,,
237023709,Day17,,Click on the green flag to start,34225248,https://cdn2.scratch.mit.edu/get_image/project/237023709_480x360.png,2018-07-21T17:01:31.000Z,2018-07-21T17:15:34.000Z,2018-07-21T17:15:16.000Z,4,1,0,0,0,,
237020184,interest rate arbitrage,"For Day 17 of GettingUnstuck, in which we work with Lists.

Spreadsheets are an evocative object for me, so I was excited to use Scratch as a similar medium. I also wanted a visual to support a financial argument (an elective cash out mortgage can be sensible) that is anathema to common sense. 

A more refined model would ask for tax rates on dividends/income and would adjust for tax deductibility of interest payments on the mortgage. Mortgages are structured so that interest repayment is weighted toward the start of the loan and principal repayment is weighted toward the tail, which is advantageous to arbitrage but feels unfair if your goal is to get out of debt. A more refined model would also fluctuate the investment returns.

When I have more time I'd like to develop this so one could track payments in real time of an actual (theoretical) loan against a (paper) investment as well as against speculation, as well as spending opportunity costs, e.g. lattes vs. additional principal repayment.

I tried a formula for calculating mortgage payments, based on https://www.mtgprofessor.com/formulas.htm, and it indicated a monthly payment that was 100 more per month than the PMT function indicated by Excel. This eliminated the arbitrage opportunity, so for this simulation I input the Excel PMT result to Scratch. I left a draft block showing how the inflated payment was calculated. If anyone can find an error there, I would love to understand what it is!","Green flag, and watch. This is a crude calculator that simulates mortgage payments balanced against a dividend yielding investment (or interest rate arbitrage). Exponential growth is visually understated (I divided results by 3) so that I could keep visuals on the stage.

Assumptions: 100,000 borrowed for 360 months at an interest rate of 4.7%. Invested in a vehicle that pays annualized 7.1% before taxes via monthly payments. (I used DNP's price and monthly dividends for this model.) Monthly dividends minus pmts are reinvested in the vehicle (no transaction costs assumed).",33815227,https://cdn2.scratch.mit.edu/get_image/project/237020184_480x360.png,2018-07-21T15:44:50.000Z,2018-07-21T22:31:34.000Z,2018-07-21T17:19:35.000Z,8,3,0,0,0,,
237021718,Getting Unstuck Day 17,"At the start of the main script, try changing:
N - the number of numbers you have to enter.
SPEED - the speed the waves travel

Just wanted some weirdness from numbers. I think I've achieved this!

Music by EliteFerrex http://www.newgrounds.com/audio/listen/603536","Getting Unstuck Day 17
Create a project that asks the user to type in multiple words or numbers, stores the items in a list, then does something interesting with the items from the list.

Click the green flag to run the project.
Each time you are prompted, enter a number.
In total you will enter five numbers. 
Sit back and watch the show.
(Press the space bar to have another go)

Try something like 100, 5, 12, 44, 32",2314547,https://cdn2.scratch.mit.edu/get_image/project/237021718_480x360.png,2018-07-21T16:18:07.000Z,2018-07-21T19:46:01.000Z,2018-07-21T17:28:44.000Z,13,6,2,0,0,,
237017353,Unstuck Day 17 - Make a Limerick,I was all over the place with this one. It turned out to be a very simple animation. I'd like to do something more advanced. I just struggled on how to use the words from the list.,Click the flag to write a limerick.,10715270,https://cdn2.scratch.mit.edu/get_image/project/237017353_480x360.png,2018-07-21T14:44:01.000Z,2018-07-25T12:48:17.000Z,2018-07-21T17:27:15.000Z,7,3,1,0,0,,
