id,title,description,instructions,author/id,image,history/created,history/modified,history/shared,stats/views,stats/loves,stats/favorites,stats/comments,stats/remixes,remix/parent,remix/root
235601849,Day 2: Flower stamps!,"Originally I drew my own flower (purple circle w/ green petals) and made that move around the screen as a clone, but then I wondered how hard it would be to draw using the pen tool (I am always astounded by @scmb1's use of the pen!). The answer? Very hard! I wanted to recreate my purple circle and green oval petals, but couldn't figure out how to fill them in. Also couldn't figure out how to draw beautiful parabolas.

Anyway, eventually I sought some inspiration from others' pen drawings, poking around the Scratch ""Help with Scripts"" forum as well as just searching the community to find other pen flowers. There were many different ways to accomplish this, but since I had already succeeded in drawing pen circles, I decided to draw connecting circles with random colors in order to make flowers. 

Highly inspired by @P0lliw0g's Pen flower drawing: https://scratch.mit.edu/projects/76609616/ ","Press the green flag to start the project, then click anywhere on the screen. In order to make imperfect flowers, click close to the edges (is this a feature or a bug? TBD). Turn sound on for random notes when each flower appears.",2745846,https://cdn2.scratch.mit.edu/get_image/project/235601849_480x360.png,2018-07-05T16:47:23.000Z,2018-07-06T09:55:43.000Z,2018-07-06T09:55:43.000Z,29,6,1,0,0,,
235615393,Getting Unstuck Day 2: Flower Stamp,"**Thank you so much to @mstone326 for your help in getting unstuck! I'm so happy I was able to get this project to be what I envisioned!**

Field image from public domain pictures. 
Flower drawing loosely based off of this tutorial: https://www.drawingnow.com/tutorials/119946/how-to-draw-a-flower-step-by-step/

I had a lot of fun with this challenge! I wanted to challenge myself to learn something new, so I looked at the flower drawing tutorial and used the paint editor to make my flowers. My students always struggled with the paint editor, so I wanted to spend more time using it to see what might be frustrating for them. It was definitely more time-consuming than I thought!

What you currently see (the random colored flowers) is only one part of what I had hoped to make. I also want to make a little ""flower palette"" where you can choose what color flower to stamp. I couldn't get this to work last night because of the way I programmed the flowers to stamp (any time the background is clicked). You can see what I was trying to do if you look at my ""purple"" broadcast blocks. Would love any advice for how to make this extra part of my project work!","Press the green flag to start. Then, click where you'd like to make a flower garden!

If you'd like to add different color flowers, press the space bar and click on the color you want!",19163721,https://cdn2.scratch.mit.edu/get_image/project/235615393_480x360.png,2018-07-05T19:42:10.000Z,2018-07-09T00:23:08.000Z,2018-07-06T17:22:59.000Z,42,5,1,0,0,,
235616850,Unstuck Day 2 - Flower Surprise! ,"This was a fun project to make! I enjoyed playing around with the paint editor to create my flower—it makes me even more excited for 3.0's redesigned editor! 

The one thing I found trickey about this project was that I couldn't figure out why a flower kept popping up whenever I'd press the green button. That's why I did the ""wait x seconds"" block— I imagine it was taking the press of the green button as a 'mouse down'...Does anyone have any thoughts about a different way to approach this?","Unstuck Challenge Day 2:
Display a flower each time that the user clicks on the background. There are at least three different ways of programming this in Scratch—what will your approach be?

I wanted to play with the idea of tesselation— when you click you don't know if you will get a flower or a bird!",24267830,https://cdn2.scratch.mit.edu/get_image/project/235616850_480x360.png,2018-07-05T20:06:17.000Z,2018-07-06T16:49:17.000Z,2018-07-05T20:20:32.000Z,17,3,1,0,0,,
235590337,21 Days of Flowers,"I'm quite fond of the visual effects I played with in this project. If I had more time, I would figure out how to implement this with cloning instead of with stamping. I wanted to use cloning because I wanted the petals to fall away at some point—but I couldn't figure it out (yet!).

Credits
I found the petal via a Google Image search for ""petal"". I found the poem at poets.org: https://www.poets.org/poetsorg/poem/petals","Every time you click on the background, a flower appears. After 21 clicks (in honor of the 21 days of Getting Unstuck), a poem about petals appears, and the project resets. Everything is iterative!

",39526,https://cdn2.scratch.mit.edu/get_image/project/235590337_480x360.png,2018-07-05T15:18:40.000Z,2018-07-24T11:27:50.000Z,2018-07-06T10:01:17.000Z,69,21,9,0,0,,
235644324,Bouquet,"This project was created for day two of Getting Unstuck.

What I like about this project: 
It was fun figuring out how to generate text using Scratch. 

What I would work on, if I had more time: 
I would add a feature such that, once in a while, one of the letters in each word would have a single letter with a hint of color. ",Click the background.,56239,https://cdn2.scratch.mit.edu/get_image/project/235644324_480x360.png,2018-07-06T03:32:06.000Z,2018-07-06T14:01:40.000Z,2018-07-06T10:08:28.000Z,41,13,2,0,0,,
235674403,4 Flower Garden,"This was fun. I wanted to draw my own sprites, something I never do, and obviously I am still terrible at (I am comfortable with my terrible art abilities!) But I really wanted my flowers to appear randomly around the page, so it was fun messing around with random, and then I realized that random could fit inside broadcast! So I could make the broadcast be one of 4 randomized flowers. 
Setting up the x/y I always find it easier to use the x/y stage. However, when I switched over to something nice for flowers it looked like I had made my flowers TOO random. They were growing in the concrete. So I limited my Y coords randomness to stay inside the mulch where the flowers belonged. ",Click anywhere on the stage to create one of four flowers. ,22706156,https://cdn2.scratch.mit.edu/get_image/project/235674403_480x360.png,2018-07-06T11:11:11.000Z,2018-07-06T11:33:40.000Z,2018-07-06T11:30:11.000Z,28,5,1,0,0,,
235674621,Getting Unstuck Day 2,The fill with emptiness tool rocks.  Thank you to all the super smart people out there.,"When Green flag is pressed, simply click on the backdrop to make flowers appear.",24826697,https://cdn2.scratch.mit.edu/get_image/project/235674621_480x360.png,2018-07-06T11:14:04.000Z,2018-07-08T20:59:35.000Z,2018-07-06T11:44:09.000Z,15,4,1,0,0,,
235675752,Getting Unstuck: Day 2,"This took me back to my Logo days. I fell in love with Logo because it was a fun way to explore the beauty of geometry. If I had all day, I would create more geometrical flowers to make a Math Garden! ","Click the green flag to get started.
Click anywhere on the background to draw a flower with a stem.",17807175,https://cdn2.scratch.mit.edu/get_image/project/235675752_480x360.png,2018-07-06T11:28:52.000Z,2018-07-06T12:33:55.000Z,2018-07-06T11:54:26.000Z,18,6,2,0,0,,
235676661,Getting Unstuck Day02 - Flower Clicker,"This is a remixed (❤️) project, originally co-created this spring by students and me (a Lego flower grew next to the computer with WeDo motor also). The original was not activated by a mouse click.","Click = Flower!

Nice suggestion for a watering can. I added one!",14632339,https://cdn2.scratch.mit.edu/get_image/project/235676661_480x360.png,2018-07-06T11:41:07.000Z,2018-07-06T19:55:01.000Z,2018-07-06T11:50:01.000Z,20,4,1,0,0,,
235678171,Getting Unstuck Day2,"What did you like most about your project? I like the random size/colour. I also like brightening up that brick wall, it's crying out for some flowers in this garden. 

What would you do with it next, if you had more time? I love the idea of geometric art flowers. I'd change my sprite to use the pen function and do some flower patterns instead.",,17809789,https://cdn2.scratch.mit.edu/get_image/project/235678171_480x360.png,2018-07-06T12:00:50.000Z,2018-07-06T12:11:49.000Z,2018-07-06T12:07:27.000Z,21,4,1,0,0,,
235677200,day 2 flower surprise,I wanted the flowers to be random but in the grass but sometimes they bunch too much. How can I change that?,"Click anywhere on the grass to make flowers grow. My mother always said gardens should be planted in threes. My sister likes to coordinate colors so I compromised in slight color changes to keep color families together. Of course, a garden always needs a supervisor and of course the sun had to get in on the fun too.",124064,https://cdn2.scratch.mit.edu/get_image/project/235677200_480x360.png,2018-07-06T11:49:09.000Z,2018-07-06T14:34:31.000Z,2018-07-06T12:11:00.000Z,10,2,1,0,0,,
235678003,Flower! - Getting Unstuck! - Day 2,"The one thing that I had to get unstuck was that I was 'stamping' my flower so when I was using the pen for the stem it was in front of it.. but that wasn't the desired way.  So I changed the stem to a costume and stamped it first and then the petals and then the centre. 
This was more the desired outcome!","I used a function and some random numbers to create my flowers for this challenge today. 

Click the mouse on the background and the flower of a random number of petals (4-8) and colour will appear. 

Enjoy!",19641362,https://cdn2.scratch.mit.edu/get_image/project/235678003_480x360.png,2018-07-06T11:58:49.000Z,2018-07-08T02:43:12.000Z,2018-07-06T12:19:27.000Z,16,5,2,0,0,,
235675310,day2 - poppy field 2,,,34225248,https://cdn2.scratch.mit.edu/get_image/project/235675310_480x360.png,2018-07-06T11:23:14.000Z,2018-07-06T12:23:22.000Z,2018-07-06T12:23:22.000Z,5,2,1,0,0,,
235677342,Getting unstuck - dag 2,"Display a flower each time that the user clicks on the background.
#GettingUnstuck!",Click on the green grass to add some fine flowers.,25631396,https://cdn2.scratch.mit.edu/get_image/project/235677342_480x360.png,2018-07-06T11:51:02.000Z,2018-07-06T12:28:39.000Z,2018-07-06T12:28:39.000Z,26,4,1,0,0,,
235680354,Getting Unstuck Day 2,,Every click makes a flower of variable size bloom in the position in which you click.,14159575,https://cdn2.scratch.mit.edu/get_image/project/235680354_480x360.png,2018-07-06T12:28:41.000Z,2018-07-06T12:31:38.000Z,2018-07-06T12:29:29.000Z,11,5,1,0,0,,
235679303,growingflowers,Put a background in the backpack and use it as sprite. Easy but it works.,Click on the background to see ,33890948,https://cdn2.scratch.mit.edu/get_image/project/235679303_480x360.png,2018-07-06T12:15:06.000Z,2018-07-06T12:35:23.000Z,2018-07-06T12:30:48.000Z,7,2,1,0,0,,
235679825,simple flowers,I forgot to put the clear in at the start to get rid of all the stamps!,,33472226,https://cdn2.scratch.mit.edu/get_image/project/235679825_480x360.png,2018-07-06T12:21:31.000Z,2018-07-06T13:06:54.000Z,2018-07-06T12:43:02.000Z,10,2,1,0,0,,
235678334,Day 2 - click to grow flowers,I used clones to make copies of the original flower. It just came natural to clone and move the new clone to the mouse position on the screen.,Just click the green flag and see what happens.,24154277,https://cdn2.scratch.mit.edu/get_image/project/235678334_480x360.png,2018-07-06T12:03:00.000Z,2018-07-06T12:43:49.000Z,2018-07-06T12:42:43.000Z,8,2,1,0,0,,
235682013,day_2,,,8010550,https://cdn2.scratch.mit.edu/get_image/project/235682013_480x360.png,2018-07-06T12:47:06.000Z,2018-07-06T12:54:57.000Z,2018-07-06T12:54:57.000Z,13,3,1,0,0,,
235675924,Day 2: Planting the 8-bit flower,,Click anywhere to make it bloom! :),24957617,https://cdn2.scratch.mit.edu/get_image/project/235675924_480x360.png,2018-07-06T11:31:14.000Z,2018-07-09T09:09:24.000Z,2018-07-06T13:00:56.000Z,8,3,1,0,0,,
235682482,Getting Unstuck Day 2,"I decided to do this in as unusual way as I could think of:
- the backdrop detects clicks
- it creates a clone of a costumeless drawing sprite for each click
- it uses the pen with a large pen size value to draw circles without having to move the pen

I liked this approach because the clones mean you could be drawing more than one flower at a time. I think it's fun not to have any costumes for the sprite - so no worrying about hiding the original sprite when using clones. I could add some more variety to the flowers drawn by having a whole set of parameters beyond size and colour. Maybe the pen could be used to draw spirograph flowers. Stalks would be fun. Maybe add an animated bee to enjoy the flowers.
","Getting Unstuck Day 2

Display a flower each time that the user clicks on the background. There are at least three different ways of programming this in Scratch—what will your approach be?",2314547,https://cdn2.scratch.mit.edu/get_image/project/235682482_480x360.png,2018-07-06T12:52:23.000Z,2018-07-06T13:38:19.000Z,2018-07-06T13:11:59.000Z,9,2,1,0,0,,
235677346,FIORI NELLO SPAZIO /Getting Unstuck 2,Ho sbirciato qualche progetto. Grazie a tutto il gruppo.,"Getting Unstuck  Secondo giorno.

Fiori che sbocciano e ruotano nello spazio.",13746945,https://cdn2.scratch.mit.edu/get_image/project/235677346_480x360.png,2018-07-06T11:51:05.000Z,2018-07-06T13:15:41.000Z,2018-07-06T13:08:26.000Z,14,6,1,0,0,,
235682439,day2,,,8507982,https://cdn2.scratch.mit.edu/get_image/project/235682439_480x360.png,2018-07-06T12:51:47.000Z,2018-07-06T13:16:22.000Z,2018-07-06T13:16:21.000Z,10,2,1,0,0,,
235681332,My flower garden ,#Getting Unstuck Day 2,"Click green flag to start.

Click stage to see all the flowers in my garden. ",158902,https://cdn2.scratch.mit.edu/get_image/project/235681332_480x360.png,2018-07-06T12:39:03.000Z,2018-07-25T04:35:52.000Z,2018-07-06T13:18:10.000Z,13,5,2,0,0,,
235679573,Watch the Garden grow ,"Spend way too much time erasing background. Can not figure out how the erase background feature in the bitmap works. So ... Then had some trouble with the appearing and disappearing. So decided to use a couple of broadcasts. (Cheap shot.. I know). And of course when I was all done.. I realized the background had yellow, not orange BE susans! Oh well ! ",,14017205,https://cdn2.scratch.mit.edu/get_image/project/235679573_480x360.png,2018-07-06T12:18:24.000Z,2018-07-06T13:31:18.000Z,2018-07-06T13:24:35.000Z,14,2,1,0,0,,
235684010,Day 2,,Click the background to add more flowers.,22256610,https://cdn2.scratch.mit.edu/get_image/project/235684010_480x360.png,2018-07-06T13:09:02.000Z,2018-07-06T13:27:29.000Z,2018-07-06T13:27:03.000Z,3,2,1,0,0,,
235682866,Getting Unstuck Day 2,"Most of the time I spent on this went into drawing the flower. I was inspired to work on my digital drawing skills by a student I worked with this summer. My biggest problem with the digital drawing has always been impatience, but I am working on it. 

If I had more time before today's soccer matches, I would have drawn different flowers rather than duplicating and changing the colors.",Click the upper half of the stage to plant flowers in the garden.,17767933,https://cdn2.scratch.mit.edu/get_image/project/235682866_480x360.png,2018-07-06T12:56:46.000Z,2018-07-06T13:32:11.000Z,2018-07-06T13:32:11.000Z,21,4,1,0,0,,
235676015,us2-Click on the Beach,Used conditionals on x & y coordinates to generally restrict the placement to areas with sand and to ensure a full tree or umbrella shows. ,"Press Green Flag to begin. 
- Choose Palm Tree or Umbrella
- Click the beach image to plant your choice in the sand.",22788794,https://cdn2.scratch.mit.edu/get_image/project/235676015_480x360.png,2018-07-06T11:32:13.000Z,2018-07-06T13:36:56.000Z,2018-07-06T13:30:54.000Z,8,2,1,0,0,,
235683010,Day 2 Flower Challenge of Getting Unstuck,"This is the Day 2 Challenge of Getting Unstuck. 

",Click on Green Flag to start then whenever you click more flowers appear,588430,https://cdn2.scratch.mit.edu/get_image/project/235683010_480x360.png,2018-07-06T12:58:02.000Z,2018-07-06T13:40:12.000Z,2018-07-06T13:30:44.000Z,23,6,1,0,0,,
235683940,Flowers in the Rain,"I was going to have a bunch of flower costumes, then I thought about drawing flower shapes.

It was raining this morning, so I added that, too.
Thunder sound from www.freesoundeffects.com","Getting Unstuck Day 2: Display a flower each time that the user clicks on the background.

Click on the background.  If you like to click fast, use turbo mode.

If you wait, rain will start to water your flowers.",399245,https://cdn2.scratch.mit.edu/get_image/project/235683940_480x360.png,2018-07-06T13:08:13.000Z,2018-07-23T22:55:00.000Z,2018-07-06T13:49:41.000Z,14,3,2,0,0,,
235685977,Gordon_Day 2 Getting Unstuck,"need to work on the timing required to pause the ""track the mouse script"" so that the sprite has draw flowers but not too much time to lag.",Click green flag to start.  When you click in the play field you will draw a flower.  Click the space bar to clear all flowers.,18900622,https://cdn2.scratch.mit.edu/get_image/project/235685977_480x360.png,2018-07-06T13:29:40.000Z,2018-07-06T14:01:43.000Z,2018-07-06T13:56:00.000Z,9,3,1,0,0,,
235685844,Day 2 of Getting Unstuck,"Day 2 of Getting Unstuck, la sfide continua.
Alla ricerca di blocchi mai usati, ma sicura che ci sono. Sperimentando varie ipotesi per poi raggiungere un risultato, che non sarà mai definitivo, perchè una volta condiviso vengono in mente nuove idee ed ipotesi.",Clicca sulla bandierina verde e segui le istruzioni di Scratch,10086796,https://cdn2.scratch.mit.edu/get_image/project/235685844_480x360.png,2018-07-06T13:28:29.000Z,2018-07-06T14:03:40.000Z,2018-07-06T14:01:28.000Z,21,5,1,0,0,,
235687774,Day 2-Click to create flower - Growing a Garden,"Day 2 Getting Unstuck - Display a flower each time that the user clicks on the background. 

I used multiple costumes with different kinds of flowers and an operator to choose a random costume. I used this same approach to play different tones for each stamp and give the user time to move the cursor. I think it would be neat to create a variable so a voice sang the name of each kind of flower in the project.",Click on the background to create your garden.,16509596,https://cdn2.scratch.mit.edu/get_image/project/235687774_480x360.png,2018-07-06T13:49:08.000Z,2018-07-18T01:20:19.000Z,2018-07-06T14:26:09.000Z,20,7,2,0,0,,
235689796,Getting Unstuck Day 2,"After the trauma of yesterday this worked really well so I am feeling a lot better about this.
I still had to look at someone else's code, but I'd nearly got it right.",Click the background to make the flowers appear,3297086,https://cdn2.scratch.mit.edu/get_image/project/235689796_480x360.png,2018-07-06T14:13:32.000Z,2018-07-06T14:29:28.000Z,2018-07-06T14:29:28.000Z,8,2,1,0,0,,
235690101,Flower Frenzy,"So, I maybe interpreted this project differently than others, but I got a chance to play around with cloning...and I had never actually used the ""when stage clicked"" block before!",Just click!,18678040,https://cdn2.scratch.mit.edu/get_image/project/235690101_480x360.png,2018-07-06T14:18:20.000Z,2018-07-06T14:30:29.000Z,2018-07-06T14:29:26.000Z,4,2,1,0,0,,
235690003,Unstuck Day 2,,,8448794,https://cdn2.scratch.mit.edu/get_image/project/235690003_480x360.png,2018-07-06T14:16:44.000Z,2018-07-06T14:31:04.000Z,2018-07-06T14:31:04.000Z,6,2,1,0,0,,
235691379,Challenge2Flower,"Ran into issues with the clone limit, but, upon advice from karenb, I fixed it with the stamp block. ","After the wizard finishes speaking, click for flowers. ",2190314,https://cdn2.scratch.mit.edu/get_image/project/235691379_480x360.png,2018-07-06T14:35:15.000Z,2018-07-24T11:45:34.000Z,2018-07-06T14:38:25.000Z,9,2,1,0,0,,
235674911,Getting Unstuck Challenge 2,"I love playing in Scratch as much as my students do.

I pulled in an image of a cactus and editing it to make sure the background was empty. I added a water droplet sound for fun.","Click on the green flag to start. When you click your mouse on the background, cacti will appear.",21000359,https://cdn2.scratch.mit.edu/get_image/project/235674911_480x360.png,2018-07-06T11:17:58.000Z,2018-07-06T14:39:38.000Z,2018-07-06T14:37:50.000Z,4,1,1,0,0,,
235690906,Getting Unstuck #2,,,18174236,https://cdn2.scratch.mit.edu/get_image/project/235690906_480x360.png,2018-07-06T14:28:52.000Z,2018-07-06T14:44:28.000Z,2018-07-06T14:44:28.000Z,6,1,1,0,0,,
235688453,Beautiful flowers,,"Click the green flag to start, then click anywhere on the picture and four pictures will eventually pop up.  ",18512618,https://cdn2.scratch.mit.edu/get_image/project/235688453_480x360.png,2018-07-06T13:57:16.000Z,2018-07-06T14:56:47.000Z,2018-07-06T14:56:47.000Z,5,1,1,0,0,,
235691826,Day 2 Flowers,,Start by clicking on the green flag. Click anywhere to make flowers. Use the space bar to clear flowers.,3079669,https://cdn2.scratch.mit.edu/get_image/project/235691826_480x360.png,2018-07-06T14:41:04.000Z,2018-07-06T15:02:44.000Z,2018-07-06T15:00:04.000Z,31,11,3,0,0,,
235674469,Droppin' Daisies,"I'd never used pen blocks in a project before, and used this project to try it out. For help, I used the tips window quite a bit, and also searched online to read about pen blocks on the Scratch Wiki and Discussion Forum pages.

I used variables on sliders so new Scratchers can play with the behavior of the project before they even hit the 'See Inside' button. This also gives them some familiarity with what each variable block affects, so they will have some background knowledge once they start looking at the scripts.

This variables idea is more developed in the Bug Maker project I made back in January: https://scratch.mit.edu/projects/200011652/#player","Click the stage to have the butterfly drop a seed. Pick your daisy color and brightness with the variable sliders, or turn up 'Variety!' and be surprised!

What variable settings did you use to make your garden?

Made for Day 2 of 'Getting Unstuck' (display a flower each time that the user clicks on the background)

",27306974,https://cdn2.scratch.mit.edu/get_image/project/235674469_480x360.png,2018-07-06T11:12:05.000Z,2018-07-28T19:02:35.000Z,2018-07-06T15:03:18.000Z,27,6,2,0,0,,
235691231,Day 2 Getting Unstuck part 2,Second attempt at this and I decided to refine my first idea once I'd had a look at other people's.  I feel that I've really learnt a lot today. ,Click the grass to make your garden grow.,3297086,https://cdn2.scratch.mit.edu/get_image/project/235691231_480x360.png,2018-07-06T14:33:03.000Z,2018-07-06T15:04:01.000Z,2018-07-06T15:04:01.000Z,16,2,1,0,0,,
235690291,Getting Unstuck: Day 2,"Reflection

I wanted to generate a variety of different flowers from a simple set of rules and I wanted them to be animated as they were being drawn onto the screen. To accomplish this, I started with a simple flower shape and set it to hidden at the start. When the stage is clicked, the sprite is cloned and a process begins that creates a randomly generated flower. Two loops are used, one for creating the size and colors, while the other is used to animate the flower as it grows. Once an animation completes, the image is stamped. Once then entire process completes, the clone is deleted to prevent the project from slowing down. If I spent more time on this I would have created custom flower graphics.",Click screen to generate a flower.,26264460,https://cdn2.scratch.mit.edu/get_image/project/235690291_480x360.png,2018-07-06T14:21:12.000Z,2018-07-06T15:24:59.000Z,2018-07-06T14:51:54.000Z,21,6,2,0,0,,
235684481,Get Unstuck #2 Flowers,My first time using the stamp command. Changing the color seemed to be a natural choice.,Click to plant the flowers,199913,https://cdn2.scratch.mit.edu/get_image/project/235684481_480x360.png,2018-07-06T13:14:31.000Z,2018-07-06T15:19:58.000Z,2018-07-06T15:10:17.000Z,9,4,2,0,0,,
235690771,GettingUnstuck_#2,"This project was created for Getting Unstuck Day2. I'm going to apply the Clone function and randomly change the costumes of the flower sprite. By the way, I want to let the flowers bloom have different scales, so I use the y-coordinate as the parameter while setting up the size.   ","Click the background, and the flowers will be blooming. ",31325002,https://cdn2.scratch.mit.edu/get_image/project/235690771_480x360.png,2018-07-06T14:26:58.000Z,2018-07-26T03:38:13.000Z,2018-07-06T15:07:10.000Z,15,5,3,0,0,,
235692086,Unstuck Day #2,"Unstuck Day #2
Display a flower each time that the user clicks on the background.","Click on the background to draw a random flower.
Press the spacebar to clear the screen.
",24464388,https://cdn2.scratch.mit.edu/get_image/project/235692086_480x360.png,2018-07-06T14:44:17.000Z,2018-07-06T15:30:41.000Z,2018-07-06T15:23:27.000Z,8,3,1,0,0,,
235692495,Getting Unstuck: Day 2,"Getting Unstuck: Day 2
Challenge: Display a flower each time that the user clicks on the background. There are at least three different ways of programming this in Scratch—what will your approach be? 

I had fun doing this project. I used a new block: go to mouse-pointer.
","Click on the background in any place, will appear a flower.",17615581,https://cdn2.scratch.mit.edu/get_image/project/235692495_480x360.png,2018-07-06T14:50:27.000Z,2018-07-22T14:57:32.000Z,2018-07-09T15:12:36.000Z,8,1,1,0,0,,
235695579,Planting Flowers,"I was trying to use ""clone,"" but after the first click, every flower was cloning instead of adding one at a time. I looked at some other projects and they used ""stamp,"" which I had never tried. I learned something new today!",Click on the background to plant a flower.,13189460,https://cdn2.scratch.mit.edu/get_image/project/235695579_480x360.png,2018-07-06T15:28:42.000Z,2018-07-06T16:27:24.000Z,2018-07-06T15:51:47.000Z,13,2,1,0,0,,
