id,title,description,instructions,author/id,image,history/created,history/modified,history/shared,stats/views,stats/loves,stats/favorites,stats/comments,stats/remixes,remix/parent,remix/root
237270727,LogicGates ver.2.0,"Music: Armin Van Buuren vs. Vini Vici feat. Hilight Tribe - Great Spirit

","Turn on the light bulb, changing the position of the switches and using knowledge of the logical circuits.
Pressing the switch changes its state.
Only six levels, but you can do more.",139209,https://cdn2.scratch.mit.edu/get_image/project/237270727_480x360.png,2018-07-24T16:30:52.000Z,2018-07-24T18:13:35.000Z,2018-07-24T18:13:35.000Z,19,8,3,0,0,,
237271348,Jumping Pico maybe  improved copy,"I have tried with a basic jump block with a y velocity variable
I don't understated the gravity stuff though - grateful for help here
And why is Pico so low on my screen?

","Press the  green flag to start and  L and R to walk and U to jump. Collect fruit for points and balloons for floatiness!
When you 5 for floatiness you win",33472226,https://cdn2.scratch.mit.edu/get_image/project/237271348_480x360.png,2018-07-24T16:38:14.000Z,2018-07-24T18:26:37.000Z,2018-07-24T17:56:35.000Z,2,1,0,0,0,,
237279501,Day 20 REMIX -Space Race Day 9 colour sensing ,"This was fun although i couldnt work out how to 'remix'my own project so i made a copy and saved it.

I chose to remix this as I enjoyed adding the elements at the start when I first worked on this.    I enjoyed remixing it, but I also do love working from (excuse the pun) scratch!","Day 20 
REMIXED to add score and screen change.  Hope you enjoy!
see instructions below
added (A key makes the rocket do a loop-the-loop!)

Day 9 
#CreativeComputing
Catch the space junk!
Green flag to start game.
Space bar to get in position
S key to allow the space junk to fly!


Enjoy!",24864870,https://cdn2.scratch.mit.edu/get_image/project/237279501_480x360.png,2018-07-24T18:06:21.000Z,2018-07-25T12:13:15.000Z,2018-07-24T18:47:07.000Z,6,4,0,0,0,,
237283930,unstuck 20 copy of my unstuck11 ,"I thought this project is a nice introduction to Broadcasting 
So I translated it to Dutch. 
After that I added one more broadcasting.",Find a project that uses broadcasting and remix it.unstuck 20 is the copy of my remix. Sometimes I saw projects with the used blocks on the stage. I tried to do the same for more clarification. The timing is discutable: What to show first?,1072279,https://cdn2.scratch.mit.edu/get_image/project/237283930_480x360.png,2018-07-24T18:55:06.000Z,2018-07-24T19:03:05.000Z,2018-07-24T18:59:28.000Z,5,1,0,0,0,236453028,177768853
235705089,Getting Unstuck Day 2 Revised,"I decided to use the clone block. This was a great challenge for me, I have never used the clone block or checked for a mouse click before.
I noticed I had to add a wait so a flower is not placed when I cleck the green flag.

7/24 - update to use the clone block from the stage which works better. Also added a different flower and multiple costumes in different colors. Used random to select the color and size of the clone.
","Click the green flag to begin planting flowers.
Updated from Day 20.
",11305008,https://cdn2.scratch.mit.edu/get_image/project/235705089_480x360.png,2018-07-06T17:38:36.000Z,2018-07-24T19:05:01.000Z,2018-07-06T17:59:56.000Z,9,4,1,0,0,,
237284300,Bug Party planner 2.0 (Getting Unstuck Day 20) ,"Thanks to @Mittensbrother and the Getting Unstuck team for the bug, thanks to @ceebee for the dancing code, thanks to @chrisg for the dancing flower, thanks to @TheDiamonGamer for the idea of the dancing pizza, thanks to @Bubblebomb for the idea of the dancing stickman. Thanks to @ScratchCat for the cool Scratch cat sprites, and thanks to @TheLibrary for the code blocks I used for the confetti.","Plan your own Bug Party. Please answer the questions of the bug.

For Day 20 of Getting Unstuck I added a new backdrop, a party hat for the bugs, and disco lights! The challenge of today was to revise one of your previous day Unstuck projects.

",11833500,https://cdn2.scratch.mit.edu/get_image/project/237284300_480x360.png,2018-07-24T18:59:41.000Z,2018-07-26T14:12:25.000Z,2018-07-24T19:10:26.000Z,16,7,0,0,0,237009654,237009654
237286327,Jumping Pico helped out with gravity,"Thank you mstone326 for explaining gravity and y velocity to me!


","Press the  green flag to start and  L and R to walk and U to jump. Collect fruit for points and balloons for floatiness!
",33472226,https://cdn2.scratch.mit.edu/get_image/project/237286327_480x360.png,2018-07-24T19:27:09.000Z,2018-07-24T22:24:01.000Z,2018-07-24T19:51:00.000Z,2,0,0,0,0,,
237268990,Slinky Remix Unstuck #20,"I thought this would be quick and easy - ha! I spent hours remixing this, but I'm really happy with how it turned out. In the original project I defined a block called ""circle"", the sprite drew the circle, moved a little, and made another circle. It was a cool design, but I wanted it to look more like a real slinky.  I ended up almost completely remaking the entire project. In the end I made the sprite the actual circle and stamped it. The code is pretty simple, so it doesn't look like I spent hours on it, but I kept trying different things and then tweaking it until I came up with this.",Click the green flag to begin,124311,https://cdn2.scratch.mit.edu/get_image/project/237268990_480x360.png,2018-07-24T16:12:08.000Z,2018-07-24T19:59:34.000Z,2018-07-24T19:59:34.000Z,43,11,5,0,0,,
237287241,Day 20 remix Day 17,"Thank you kfugle for your advice.  I remixed this and created a script for each color with lots of broadcast/receive blocks for all the combinations of right and wrong conditions.  Took a lot of thought and errors, but I think it finally works.  Boy did my code grow!  Along with my skills :-)",Follow the prompts after the green flag,11885888,https://cdn2.scratch.mit.edu/get_image/project/237287241_480x360.png,2018-07-24T19:40:59.000Z,2018-07-24T20:08:21.000Z,2018-07-24T20:08:21.000Z,6,2,0,0,0,,
237278244,Get Smart enhanced_GU_Day20,"Day20 changes include: addition of background music, additional backdrops (including psychedelic flowers as a clue for the final puzzle), only one question per mission, & tightened up some code.
Original comments: This project took on a life of its own. I didn't get stuck today. Oh, wait, I spoke too soon. When running my project to check it, sometimes the sprite with the intro words becomes very large & off the screen. (Is this b/c I have both bitmap & vector graphics running at the same time?) 
Since the project is multi-faceted, it took a very long time to accomplish.There is so much more that can be done to enhance it. 
Inspiration for the Q & A came from @karenb 's project with the escape room. 
Credits:
https://www.wouldyoubelieve.com/sounds/SorryAboutThatChief.wav
https://www.wouldyoubelieve.com/sounds/missedit.wav (and loving it)
https://en.wikipedia.org/wiki/Get_Smart
http://pngimg.com/download/35689
http://ew.com/gallery/25-greatest-tv-spies-ever/
https://en.wikipedia.org/wiki/Get_Smart#/media/File:Get_Smart_with_Fang_1966.jpg
https://en.wikipedia.org/wiki/Clock#/media/File:Wooden_hourglass_3.jpg
https://giphy.com/gifs/get-smart-RU0RlIKOscMvu
http://soundbible.com/1611-TV-Static.html
https://www.riddles.com
https://www.televisiontunes.com/Get_Smart.html","Click the green flag to begin. Then, help Maxwell Smart, Secret Agent 86, on his missions. Answer questions correctly to reveal a secret! 
(If you want to peek, the answers are in a list.) The questions are chosen at random from a list of 10. You will answer 1 question at a time. If you get one wrong, you will be given another question (or perhaps the same one, again, It's random!)",24741621,https://cdn2.scratch.mit.edu/get_image/project/237278244_480x360.png,2018-07-24T17:52:55.000Z,2018-07-24T20:38:03.000Z,2018-07-24T20:16:29.000Z,8,4,1,0,0,,
237289525,Jumping Pico gets balloons,"Thank you mstone326 for explaining gravity and y velocity to me!


","Press the  green flag to start and  L and R to walk and U to jump. Collect fruit for points and balloons for floatiness!
",33472226,https://cdn2.scratch.mit.edu/get_image/project/237289525_480x360.png,2018-07-24T20:13:08.000Z,2018-07-24T20:28:31.000Z,2018-07-24T20:28:11.000Z,4,2,0,0,0,,
237290861,Unstuck Day 20 - Keyboard Appearance remixed,"I changed this from the original the clothing items (and dani) select randomly, but used arrow keys to move through the backdrops. 

My next version would give the user more control to toggle through each of the clothing items and dani options, maybe even toggle through different hair colors, like the backdrop.",This is a remixed dress-up program using keys from day four.,14632339,https://cdn2.scratch.mit.edu/get_image/project/237290861_480x360.png,2018-07-24T20:33:54.000Z,2018-07-24T20:42:42.000Z,2018-07-24T20:40:33.000Z,5,5,0,0,0,,
237290309,Getting Unstuck: Day 20,"This is my project for Day 20 of the Getting Unstuck programming challenge. I chose to review my ""Getting Unstuck: Day 4"" project because I would have liked to add the possibility of inserting new fishes but I didn't do it because of time. In this new version the user can insert new fish at any time by pressing the SPACE button.

Challenge archive:
https://us18.campaign-archive.com/home/?u=5dd4d8b32f719a30cbde507c6&id=cc0b423621","First, create a studio and add all of your Getting Unstuck projects to it. Done, here is the link: https://scratch.mit.edu/studios/5253085/

Second, choose one of your projects from a previous day of Getting Unstuck, make a copy of it, and revise it. 

Press B = the fish gets a little bigger
Press S = the fish gets a little smaller
Press M = the fish changes its appearance
Press SPACE = add a new colored fish (this is a new feature!)",34314391,https://cdn2.scratch.mit.edu/get_image/project/237290309_480x360.png,2018-07-24T20:25:22.000Z,2018-07-24T20:46:36.000Z,2018-07-24T20:43:01.000Z,11,7,0,0,0,,
237295562,Getting Unstuck Day 20,"With respect to the project I prepared during the day #9, here I've introduced levels and hence the game is a bit more difficult :)",Click on the central button and repeat the proposed sequence.,14159575,https://cdn2.scratch.mit.edu/get_image/project/237295562_480x360.png,2018-07-24T21:48:29.000Z,2018-07-24T21:52:29.000Z,2018-07-24T21:48:56.000Z,8,3,0,0,0,,
237295057,Day 20-Revisit/Remix day 3 - Wind Instruments,"Day 20 - First, create a studio and add all of your Getting Unstuck projects to it. https://scratch.mit.edu/studios/5246745/


Second, choose one of your projects from a previous day of Getting Unstuck, make a copy of it, and revise it. 

This is my project from day 3. I added the ability to play all the wind instruments after clicking 6 in a row. You can reset the visual effects with space bar, but it also creates some clones. Lots of stuff going on here. I think I like it.","Green Flag
Click on pinwheels to hear music
Click 6 for all to play at the same time
Length of tone increases over time
Click spacebar to clear visual effects and create clones",16509596,https://cdn2.scratch.mit.edu/get_image/project/237295057_480x360.png,2018-07-24T21:40:28.000Z,2018-07-24T22:14:56.000Z,2018-07-24T22:07:14.000Z,8,3,0,0,0,,
237296490,Tag Day20: Getting Unstuck Day 13 copy,"Getting Unstuck Day 13

The idea of interacting with the mouse led me to the idea of tag. I don't know if my project really fulfills the brief, but I enjoyed making it.
If I were to continue working on it, I would introduce a few other elements, such as making the reaction of ""running away"" sprites dependent on their distance to ""it."" 
In addition, I would have the characters call out ""You're it!"" or ""I'm it!"" when they were tagged.
So, I've worked a bit more on making my sprites a bit more individual in their strategies. In addition, I made Scratch Cat's speed more like that of the other sprites.",Press the green flag. Play tag as Scratch Cat.,3485356,https://cdn2.scratch.mit.edu/get_image/project/237296490_480x360.png,2018-07-24T22:03:36.000Z,2018-07-24T22:28:20.000Z,2018-07-24T22:28:20.000Z,5,2,0,0,0,,
237023264,Getting Unstuck: Day 20 - copy GU 13-2,"Ho scelto il progetto Getting Unstuck Day 13 versione 2
Ho cercato di migliorare l'effetto neve e ho aggiunto il movimento avanti/indietro al personaggio.
I chose the Getting Unstuck Day 13 version 2 project
I tried to improve the snow effect and added the movement back and forth to the character.

Credits: 
https://www.vecteezy.com
music - https://www.youtube.com/audiolibrary/music","Fare clic sulla bandierina verde.
Utilizza:
- puntatore del mouse
- freccia in alto
- freccia in basso
Click the green flag.
Uses:
- mouse pointer
- up arrow
- down arrow",19789360,https://cdn2.scratch.mit.edu/get_image/project/237023264_480x360.png,2018-07-21T16:51:41.000Z,2018-08-07T11:40:05.000Z,2018-07-24T22:34:04.000Z,12,3,0,0,0,,
237248182,Getting Unstuck #20,"For day 20 I decided to rethink day 7. I wan't overjoyed with my day 7 project. And I thought rather than trying to make something that ended with a static result, something that constantly moved may be more interesting.
I included some of the cloning ideas that I worked with yesterday. I'm happier with this than day 7's project. I could still tinker with this for ages if I had the time.",Just press the green flag.,141519,https://cdn2.scratch.mit.edu/get_image/project/237248182_480x360.png,2018-07-24T12:22:43.000Z,2018-07-25T02:41:53.000Z,2018-07-24T22:40:42.000Z,6,5,0,0,0,,
237300448,Getting Unstuck Day 20 - Day 9 revisited,"I didn't know what to revisit. I spent ages going between projects. I went through the getting unstuck cards and played with some featured projects. When I returned to my getting unstuck studio I saw my ""robot line follower"" from day 9 and knew it was the one from the notes I'd written about what I'd like to try with more time. I'd never normally write notes like that, so I think I will try to in future to capture my thoughts at the time rather than allowing them to drift away. 

I have been thinking about line following robots. Seemed like the perfect opportunity to try out very simple rules, eg move forwards; if touching red turn right; if touching blue turn left. Seems to work surprisingly well. I like the idea that Scratch could be used to prototype real world robot algorithms.

I started with Scratch Cat rather than a ball, but extremities would ""catch"" on the colours and lead to twirling and getting stuck.

I said: ""I'd like to experiment further with different angles and number of steps. Maybe with a timer to see how fast the ball completes the track. This could be automated to determine the best parameters.""

I've started this. Runs are now automated with randomly selected parameters. I need to sort the list on time to create a proper sense of which parameters work best or even better, plot a surface with the 2 parameters to see the ""shape"" of the parameter space. I also need to add jitter to the start point to see how robust each result is.

Sometimes the robot cheats and returns to the gate by going the wrong way down the track. Maybe need multiple gates to track this?

Oh dear - I said I was going to get an early night tonight...","Getting Unstuck Day 20 - Revisiting Day 9

Create a project that involves the touching color blocks in the Sensing category (i.e., touching color? and color is touching?).

Just run the project and the ball will use simple rules to travel around the uncoloured track. It will run over and over with different speed and angle parameters and store them in 3 lists: time for run, speed and angle. Press s/h to show/hide the lists.",2314547,https://cdn2.scratch.mit.edu/get_image/project/237300448_480x360.png,2018-07-24T23:04:34.000Z,2018-07-25T10:04:57.000Z,2018-07-24T23:34:43.000Z,7,4,0,0,0,,
237303047,Wandering Race for Watermelon,"This is a remix of Getting Unstuck #7 Pen patterns Wandering for Watermelon https://scratch.mit.edu/projects/236164578/
At a suggestion from a fellow Scratcher's comment, I added a watermelon explosion.

Reflection:  I have enjoyed creating new challenges each day.  I would recommend the 21 days Getting Unstuck challenge to everyone.  The community was great and I would wait for the 7 am email to come to find out what was the challenge.  Early on I would jump right in to create.  Later I would think about the challenge during my day and then code with a plan.

See you at the Scratch Conference!","Getting Unstuck #20 Revise a previous challenge project.

Click the green flag.  Notice whether Gobo gets out before Scratch Cat finishes drawing the circle and rays.",399245,https://cdn2.scratch.mit.edu/get_image/project/237303047_480x360.png,2018-07-24T23:36:21.000Z,2018-07-25T00:30:58.000Z,2018-07-25T00:30:41.000Z,7,5,0,0,0,,
237272027,Day 20-Revised copy of Day5-platform:MajorTomCat ,"I decided to go back to my Day5 platform game.  I was very stuck on day 5 but had a lot help from @mstone326 and @HESteachers. Both who were kind enough to remix my original project https://scratch.mit.edu/projects/235953588/
Using my backpack, I brought in some of their scripts in this version and made some adjustments.  To be honest, I am still not happy with this project, but my time tonight is limited, as I got to pack up and get ready to travel tomorrow for the Scratch@MIT Conference!!!! 

Music: David Bowie Space Oddity ","Click green flag to start.  Level 1 get Major TomCAT to his rocket. Level 2 give Major TomCAT a happy ending and get him home.
Arrow keys to move left and right and Space key to jump.  When you touch the jetpack, you can fly too. 

Day 20 challenge: choose one of your projects from a previous day of Getting Unstuck, make a copy of it, and revise it. 
I chose https://scratch.mit.edu/projects/235953588/  ",1294980,https://cdn2.scratch.mit.edu/get_image/project/237272027_480x360.png,2018-07-24T16:46:13.000Z,2018-07-25T01:20:08.000Z,2018-07-25T01:04:00.000Z,10,3,1,0,0,,
237031277,Unstuck Day 20 Remix of Day15,"Day 20 is Day 15 project remixed  - oops NOT remixed.  I jforgot - 
If I just make changes to the project instead of remixing it the first project is GONE!!!!! 
It is gone from My Stuff and it is gone from the original Day 15 Unstuck Studio.
I wanted to make a project that had a series of unrelated actions so that a player needed to figure out what was happening in this project.
Sorry it is so late today.  I arrived in Boston this morning and had to decide whether to do the Unstuck homework or ... play hookey and see the sites.  The tourist in me won out!!! Visited JFK Museum.  ",Click on the Green Flag to start and read the instructions.  Then the game starts with the clicking of the Space Bar.  Are you able to figure out the coding of a project by watching it?  What are the 8 coding actions in this game? ,14232182,https://cdn2.scratch.mit.edu/get_image/project/237031277_480x360.png,2018-07-21T19:54:27.000Z,2018-08-01T17:15:53.000Z,2018-07-21T20:09:40.000Z,4,2,0,0,0,,
237308410,Day 19-FIRE!,"Although I'm not doing anything fancy, I'm getting so much better at using Scratch! I try to do fancy stuff and it's not working for me yet. Oh, well, little by little!","We are having wildfires near Yosemite (About an hour from my home). I decided to make a depiction of the fire being put out for good!
Press flag to start, press space key for the fire to grow. (Somebody didn't put out their campfire :(
Watch the fire get extinguished!

",10309968,https://cdn2.scratch.mit.edu/get_image/project/237308410_480x360.png,2018-07-25T00:32:53.000Z,2018-07-25T01:11:39.000Z,2018-07-25T01:10:26.000Z,12,4,0,0,0,,
237314314,Day 20 HELP What animal are you? REMIX2 ,I need more questions too. That would probably help make it more useful.,"This is the project I cannot figure out. It is supposed to be one of those quizzes that tells you what kind of animal you are based on some questions. Well, I got everything to work, except the only problem is, if there is a tie (I used variables to assign a score to answers). Can anybody help me figure out how I'd go about giving a score if none of the animals have the majority of answers?",10309968,https://cdn2.scratch.mit.edu/get_image/project/237314314_480x360.png,2018-07-25T01:45:36.000Z,2018-07-26T02:09:02.000Z,2018-07-25T01:46:02.000Z,2,1,0,0,0,,
237190289,Unstuck Day 20: Cat Chase revised,"This is a basic remix of the game Cheese Chase by John Woodcock from the book Coding Games in Scratch. The first time I made Cheese Chase, it was so difficult! 


When I posted this game for day 9, I only had the dog, the cat and the ghost.  Now, I added the crabs to increase the difficulty.  I also put in the message 'Game Over' to signal the end of the game.  The one thing that I can't seem to get is how to stop the music when the game is completed.","Click on the green flag to begin. You will be using the arrow keys to try and navigate the dog to catch the cat.  If the dog touches the blue wall, it will stop.  Every time you touch the cat, you will score 10 points. 
There are a few things that can stop you, though.  If a crab touches the dog, the dog won't be able to move and the game is over.  Also, there is a ghost that will randomly pop up.  If it touches the dog, the game is over.  Have fun!",34190490,https://cdn2.scratch.mit.edu/get_image/project/237190289_480x360.png,2018-07-23T21:38:01.000Z,2018-07-25T02:20:09.000Z,2018-07-25T02:15:46.000Z,2,1,0,0,0,,
237298318,Ninja Duck v1.5,"This is an updated version of Ninja Duck v1.0, now with another challenge.
I used variables to control each level.
I added music and cloning features on enemies to make it more challenging too.
                                          ---Credits---
+ Song: ""A-END"" by Labbed is licensed under a Creative Commons Attribution-ShareAlike 3.0 Unported License.
","Press the green flag and then the play button.
Choose ""Challenge I"" or ""Challenge II"" to start.
 ++Challenge I++
Try to avoid the enemies in 20 seconds to win the challenge.
Press Left and Right arrow keys to move the Duck.
Use Up key to jump.

 ++Challenge II++
Try to avoid the baloons in 30 seconds to win the challenge.
Press Left and Right arrow keys to move the Duck.
Use Up key to jump.
Don't touch water or you'll slip.

Enjoy it!

                            --Getting Unstuck Day 20--
First, create a studio and add all of your Getting Unstuck projects to it. Second, choose one of your projects from a previous day of Getting Unstuck, make a copy of it, and revise it. ",4413079,https://cdn2.scratch.mit.edu/get_image/project/237298318_480x360.png,2018-07-24T22:30:17.000Z,2018-08-07T19:14:22.000Z,2018-07-25T02:44:33.000Z,5,2,0,0,0,,
237319523,Haiku vs Cut-Up: Revisited (Unstuck 20) ,I'm so glad that revisiting an earlier project was the prompt for Getting Unstuck 20. I was in a bit of a rush and had problems tracking down the right music to set the mood for the first version. (Although it was tempting to re-revisit #19.),"Press the flag to let Beat poet and author William Borroughs tranform your words into a poem using the ""cut-up"" technque.

Additions in this revisit: now with motion and music plus a more Blue Note records vibe.",27690149,https://cdn2.scratch.mit.edu/get_image/project/237319523_480x360.png,2018-07-25T02:36:34.000Z,2018-07-25T03:04:13.000Z,2018-07-25T03:03:47.000Z,1,0,0,0,0,,
237320061,Getting Unstuck Challenge #18 copy,"A remix of Challenge #18.
I was pushed for time when creating this one and wasn't totally happy with the result, so have now added sounds and fixed the issue of too many comments appearing at once - just by changing the broadcast with a broadcast and wait block!

Have so enjoyed this challenge experience.
Being in a different timezone meant it felt like I was always coming late to the party!
I realize I often interpreted the instructions differently to others, sometimes being THAT kid that didn't read instructions carefully!
I loved seeing others creative coding talents and know the future of coding is very excited if our students are being exposed to such brilliant minds.
I look forward to the next set of challenges and to presenting them to students.  Thankyou!",Click green flag and watch.,13484475,https://cdn2.scratch.mit.edu/get_image/project/237320061_480x360.png,2018-07-25T02:42:52.000Z,2018-07-25T03:06:38.000Z,2018-07-25T03:06:38.000Z,1,0,0,0,0,,
237308797,Flower remix! - Getting Unstuck! - Day 20,,"I took my project from Day 2 to remix it.  I liked it as a basic project and thought there might be some interesting ways to add to it. 

I added a random factor for the starting colours and also the differences between colours of the parts of the flowers. 

I also added the random size factor. 

The last thing I changed was I was bored of clicking.  So now it is based on the mouse pointer location. ",19641362,https://cdn2.scratch.mit.edu/get_image/project/237308797_480x360.png,2018-07-25T00:37:29.000Z,2018-07-25T03:37:09.000Z,2018-07-25T00:44:44.000Z,3,1,0,0,0,,
237328024,My flower garden (copy)-2,"This is my favourite challenge. I used up more time than I had budgeted but it gave me great satisfaction. : )

I decided to try adding a counter to introduce a whole lot of new flowers in a new backdrop with music. It worked.

Credits:
1. New flowers are copied from ""I Wrote You A Note"" by Lizi Boyd.
2. The original flowers I learnt to draw from Chika Miyata's book entitled ""How to Draw Almost Everything: An Illustrated Sourcebook"".","Click green flag to start.

Click stage to see all the flowers in my garden. 

Getting Unstuck #Day 20",158902,https://cdn2.scratch.mit.edu/get_image/project/237328024_480x360.png,2018-07-25T04:30:59.000Z,2018-07-25T04:45:23.000Z,2018-07-25T04:32:59.000Z,11,5,1,0,0,,
