id,title,description,instructions,author/id,image,history/created,history/modified,history/shared,stats/views,stats/loves,stats/favorites,stats/comments,stats/remixes,remix/parent,remix/root
235696014,Unstuck Day 2,"Using graphics effects for these sprites created a conflict with the script that said ""hide / forever [ if mouse down ] > show"".

Using the If / else block instead of the mere if block solved this problem.","Click the green flag, then click the stage and move your cursor around while holding the mouse down.

One flower will follow the mouse; a second flower will follow the first flower.

Update: at @paulinah's suggestion, a flower appears wherever the mouse is",33815227,https://cdn2.scratch.mit.edu/get_image/project/235696014_480x360.png,2018-07-06T15:34:38.000Z,2018-07-07T15:49:11.000Z,2018-07-06T15:55:27.000Z,6,3,1,0,0,,
235688017,Getting Unstuck Day 2 - flowers,"This one I started out by checking out all the other project. I got tons of ideas of how to randomize the flower size and color.  I can now see the value of students remixing other projects. I learned a lot just by checking out how others had done it!

Two things I'd like to learn how to do:
1) I want the flowers to fade/disappear after a few seconds so the user has to keep adding flowers. Perhaps using clones?
2) I used conditionals to restrict where the user could click to plant a flower (so they can't click off the screen). But I found that flowers still ended up hanging off the screen. I need to figure out how to make it so the flowers can't hand half off the screen.","Click the green flag to start. Click anywhere in the dirt to plant a flower. Make your flower garden grow!

Created for Getting Unstuck Day 2: Display a flower each time that the user clicks on the background.",2803184,https://cdn2.scratch.mit.edu/get_image/project/235688017_480x360.png,2018-07-06T13:52:11.000Z,2018-07-06T16:06:41.000Z,2018-07-06T16:01:51.000Z,11,3,1,0,0,,
235695093,Untstuck_Day2_Wynne,I used the stamp tool.  I'm not sure why I had to change the values of x and y to make it stamp where the mouse was clicked.  That took some trial and error to figure out.,Help spruce up the landscape by adding flowers.  Press the space bar or the green flag to clear and start over.,21171472,https://cdn2.scratch.mit.edu/get_image/project/235695093_480x360.png,2018-07-06T15:22:37.000Z,2018-07-07T01:22:25.000Z,2018-07-06T16:17:41.000Z,6,1,1,0,0,,
235699186,Getting Unstuck Day 2 - flowers remix,"The original project poster asked about making the flowers not go off screen. I also added one possible fading clone script.

The off-the-edge code checks to see if the sprite is touching the edge before stamping. If it does, it points towards the center and moves ten steps, then repeats until it is not touching the edge.

To point towards the center, I hid a ball sprite at x:0 y:0 and had the flower sprite point towards that sprite.","Click the green flag to start. Click anywhere in the dirt to plant a flower. Make your flower garden grow!

Created for Getting Unstuck Day 2: Display a flower each time that the user clicks on the background.",14632339,https://cdn2.scratch.mit.edu/get_image/project/235699186_480x360.png,2018-07-06T16:17:10.000Z,2018-07-06T16:47:33.000Z,2018-07-06T16:22:35.000Z,10,3,1,0,0,235688017,235688017
235681964,Unstuck 2 - Flowers,"Fun oppurtunity to play a little bit with randomness (petal color and leaf placement). Started with the idea that there would be more moving parts, so I set everything up as functions (new blocks) but I ended up not really needing to. Halfway through I started thinking about petal placement and the Fibbonoci sequence, but that will have to wait for another project!",Click and enjoy!,7902,https://cdn2.scratch.mit.edu/get_image/project/235681964_480x360.png,2018-07-06T12:46:39.000Z,2018-07-06T16:45:03.000Z,2018-07-06T16:24:51.000Z,6,2,1,0,0,,
235694667,day2,,,23593293,https://cdn2.scratch.mit.edu/get_image/project/235694667_480x360.png,2018-07-06T15:17:30.000Z,2018-07-06T16:25:45.000Z,2018-07-06T16:25:44.000Z,6,1,1,0,0,,
235696407,Flower Power,Unplug Day 2: Display a flower each time that the user clicks on the background. ,Click the green flag to start. Click anywhere on the background to see a flower.,25332755,https://cdn2.scratch.mit.edu/get_image/project/235696407_480x360.png,2018-07-06T15:39:36.000Z,2018-07-06T16:54:39.000Z,2018-07-06T16:04:46.000Z,19,2,1,0,0,,
235699623,Unstuck Day 2 Rushing,"I used a lesson I teach my 4th and 5th graders each year as the inspiration for this challenge.  Learning about functions is part of our computer science curriculum and this is a fun way to help them practice creating functions with parameters.

I created two functions -- one for the flower and one for the stem.  Using the ""pick random number"" block made it very easy to have different color flower petals and centers -- as well as flowers with different numbers of petals.  

This project was adapted from a lesson I found in a DK publishing book called ""Coding Projects in Scratch"". ","Draw flowers using Functions!  Click the Space Bar to clear any ""gardens"" and Click the Green Flag to start the program.  Every time you click your mouse on the stage, you will grow a flower. ",7525698,https://cdn2.scratch.mit.edu/get_image/project/235699623_480x360.png,2018-07-06T16:23:34.000Z,2018-07-06T17:38:25.000Z,2018-07-06T16:39:55.000Z,24,9,5,0,0,,
235697206,Getting Unstuck #2: Interactive flowers,"Scratch project was created as activity #2 of the ""Getting Unstuck"" project of the Creative Computing Lab at the Harvard Graduate School of Education.
Day #2 Challenge: Display a flower each time that the user clicks on the background. 
I used the stamp block after seeing other similar projects! My first choice was the clone block, but I realized stamp works better!
Article: http://scratchfromscratch.com/pdfs/chapter5.pdf",Press the green flag.,1202362,https://cdn2.scratch.mit.edu/get_image/project/235697206_480x360.png,2018-07-06T15:50:41.000Z,2018-07-07T17:23:33.000Z,2018-07-06T16:38:00.000Z,12,2,1,0,0,,
235696410,GettingUnstuck#2 - Multicoloured Flower Power,"Getting Unstuck challenge/exercise#2 - ""Display a flower each time that the user clicks on the background""

Started off thinking I would need lots of flower sprites. Then it got messy and some searching suggested clones. Check out the use of the ""clone"" variable's use to stop clone's being cloned on later clicks.

Based on other people's work it looks like the ""stamp"" block may have made things easier (so lesson learned for today!)",Click the grassy background to make a new flower appear (a different colour with each click!),15872912,https://cdn2.scratch.mit.edu/get_image/project/235696410_480x360.png,2018-07-06T15:39:39.000Z,2018-07-06T17:03:08.000Z,2018-07-06T16:42:51.000Z,10,1,1,0,0,,
235689291,Getting Unstuck Challenge 2 - Plant,"My wife has several of these in our yard. Thought I'd use it as my idea. And yes, that is me...........

I have to work out the layering system for multiple clones and their location within the planter, stored in a list. Each flower has an id, size and y position stored in a list. Will add that later on. 

I also plan to turn this project into a Counting Game for my Kindergarten/1st Grade students. Ex: Please plant 2 red, 1 pink, 1 orange flower. Once they do they will watch them grow, then the next plant instructions will come.

I also may add a save system to reload your planter if you wanted","Click the Green Flag

Click the planting area of the flower bed. 

Added delete function. Hold space and click a flower you planted to delete it from the box 
",3158946,https://cdn2.scratch.mit.edu/get_image/project/235689291_480x360.png,2018-07-06T14:06:53.000Z,2018-07-07T02:15:11.000Z,2018-07-06T16:46:29.000Z,21,8,2,0,0,,
235701746,Unstuck Day 2 Rushing remix,"This is a great original project. I modified the script so the ball follows the mouse around, then checks to see if it is touching the green grass color before creating a clone. It lags a little bit so won't always make a flower if I click too fast.

I also made the stalk length and width vary slightly. What can I say? I actively seek ways of adding random blocks to my code.","Draw flowers using Functions!  Click the Space Bar to clear any ""gardens"" and Click the Green Flag to start the program.  Every time you click your mouse on the stage, you will grow a flower. ",14632339,https://cdn2.scratch.mit.edu/get_image/project/235701746_480x360.png,2018-07-06T16:53:15.000Z,2018-07-06T17:00:07.000Z,2018-07-06T16:57:39.000Z,4,2,1,0,0,235699623,235699623
235696256,Basil Flowers [editing],"I'd like to keep working to get the flowers to stay, and THEN to create a scissor sprite which can be used to cut off the flowers to keep the delicious leaves growing!

scissor sprite from:
https://pngtree.com/element/down?id=MjcxNTg2Nw==&type=1",The basil is eager to grow and ready to bloom! Press the basil to bloom flowers!,25705937,https://cdn2.scratch.mit.edu/get_image/project/235696256_480x360.png,2018-07-06T15:37:37.000Z,2018-07-24T10:24:12.000Z,2018-07-06T16:59:29.000Z,19,4,1,0,0,,
235692994,I love flowers - - Getting Unstuck day 2,,"Click on the green flag.
Click anywhere on the background to display a new flower.

<-><-><-><-><-><-><-><-><-><-><-><-><-><-><-><-><-><->
Getting Unstuck: Day 2 - #CreativeComputing

A flower is displayed each time that the user clicks on the background.
<-><-><-><-><-><-><-><-><-><-><-><-><-><-><-><-><-><->",24583107,https://cdn2.scratch.mit.edu/get_image/project/235692994_480x360.png,2018-07-06T14:56:32.000Z,2018-07-06T17:02:02.000Z,2018-07-06T17:02:02.000Z,23,6,1,0,0,,
235699416,Getting Unstuck: Day 2. A world of flowers,,"Every time you click on the background, many flowers appear.",18190669,https://cdn2.scratch.mit.edu/get_image/project/235699416_480x360.png,2018-07-06T16:20:19.000Z,2018-07-06T17:14:28.000Z,2018-07-06T17:14:28.000Z,8,3,1,0,0,,
235675028,#GettingUnstuck_2,,,16962202,https://cdn2.scratch.mit.edu/get_image/project/235675028_480x360.png,2018-07-06T11:19:28.000Z,2018-07-06T17:21:18.000Z,2018-07-06T17:21:18.000Z,5,1,1,0,0,,
235702225,#GettingUnstuck2 Growing GIF Flowers,"Flower taken from http://www.gifs.cc/flowers.shtml

Clones need some extra CPU, so please don't create a lot :)","Press Green flag and follow the instructions.

This project is part of #GettingUnstuck initiative #CreativeComputing, Day 2

""Display a flower each time that the user clicks on the background. There are at least three different ways of programming this in Scratch—what will your approach be?""

",1112440,https://cdn2.scratch.mit.edu/get_image/project/235702225_480x360.png,2018-07-06T17:00:09.000Z,2018-07-18T16:12:15.000Z,2018-07-06T17:32:07.000Z,10,4,1,0,0,,
235704309,Getting Unstuck Day 2,,,32626504,https://cdn2.scratch.mit.edu/get_image/project/235704309_480x360.png,2018-07-06T17:27:43.000Z,2018-07-06T20:31:58.000Z,2018-07-06T20:29:28.000Z,6,2,1,0,0,,
235702110,Flower gardener Day 2 Getting Unstuck,"What did you like most about your project? I love the different flowers and that if you hold down your mouse, they keep growing in one spot.

What would you do with it next, if you had more time? I originally wanted the flowers to come one per click, so I would try to figure out how to make that happen.","Click the green flag, click where you want to plant a flower. 

Press the space bar to clear your flowers.",28676433,https://cdn2.scratch.mit.edu/get_image/project/235702110_480x360.png,2018-07-06T16:58:26.000Z,2018-07-09T19:36:35.000Z,2018-07-06T17:53:44.000Z,11,2,1,0,0,,
235705089,Getting Unstuck Day 2 Revised,"I decided to use the clone block. This was a great challenge for me, I have never used the clone block or checked for a mouse click before.
I noticed I had to add a wait so a flower is not placed when I cleck the green flag.

7/24 - update to use the clone block from the stage which works better. Also added a different flower and multiple costumes in different colors. Used random to select the color and size of the clone.
","Click the green flag to begin planting flowers.
Updated from Day 20.
",11305008,https://cdn2.scratch.mit.edu/get_image/project/235705089_480x360.png,2018-07-06T17:38:36.000Z,2018-07-24T19:05:01.000Z,2018-07-06T17:59:56.000Z,9,4,1,0,0,,
235697829,Getting Unstuck Day 2 #1,,"Click on the background to add a flower. I uploaded a flower petal and worked with different ways to repeat it to make a flower. I had to adjust the rotational axis so it was at the end of the flower petal, not the center by default. I also added a black ellipse on the end to create the center part of the flower.",17824064,https://cdn2.scratch.mit.edu/get_image/project/235697829_480x360.png,2018-07-06T15:58:43.000Z,2018-07-06T18:06:14.000Z,2018-07-06T15:59:12.000Z,5,1,1,0,0,,
235706419,Getting Unstuck Day 2 #2,,Click on the background to add a flower. Instead of uploading a flower petal I drew a petal using the Scratch editor. When you draw the axis is the center already so I just drew my petal out from the center. This worked too.,17824064,https://cdn2.scratch.mit.edu/get_image/project/235706419_480x360.png,2018-07-06T17:56:49.000Z,2018-07-06T18:07:34.000Z,2018-07-06T18:02:31.000Z,9,4,2,0,0,,
235704185,Day 2,"After clicking through yesterday's studio, I really wanted to make use of the variables. I just never think of using them! However, this was my automatic solution and I had a hard time pushing myself into a new way - I might play with this more or create a new one later.

Music - Vivaldi Spring Movement I Allegro by John Harrison with the Wichita State University Chamber Players via Free Music Archive",Click the Green Flag,18341966,https://cdn2.scratch.mit.edu/get_image/project/235704185_480x360.png,2018-07-06T17:26:10.000Z,2018-07-06T18:14:53.000Z,2018-07-06T18:00:42.000Z,14,4,1,0,0,,
235614853,Unstuck Day 2: Daisy Days,"Made daisy sprites.
Took me a while to figure out how to change flowers - first time using ""costumes"".  Appreciate having many samples of coding stamps and clones as examples!  ",Display a flower each time that the user clicks on the background. ,18337230,https://cdn2.scratch.mit.edu/get_image/project/235614853_480x360.png,2018-07-05T19:33:26.000Z,2018-07-06T18:04:04.000Z,2018-07-06T18:04:04.000Z,29,6,2,0,0,,
235704919,Day 2 - plant flowers in the desert,"Getting Unstuck: Day 2
Display a flower each time that the user clicks on the background","click on the stage where you want a flower grows up.

",2143382,https://cdn2.scratch.mit.edu/get_image/project/235704919_480x360.png,2018-07-06T17:36:13.000Z,2018-07-06T20:49:29.000Z,2018-07-06T18:10:21.000Z,17,4,2,0,0,,
235701889,Untitled-4,,"Натисніть зелений прапорець, щоб розпочати роботу з проект.",34214776,https://cdn2.scratch.mit.edu/get_image/project/235701889_480x360.png,2018-07-06T16:55:14.000Z,2018-07-06T18:18:51.000Z,2018-07-06T18:17:36.000Z,9,2,1,0,0,,
235706472,Getting Unstuck | Day 2 | 21 Days of Flowers remix,"I changed it to one day, just to mess around with the clone code you left in the script area. 

I tried a few basic shapes (line, ellipse, circle) then made each petal a clone, growing then shrinking, changing colors along the way. Is this closer to ""falling petals?""","Every time you click on the background, a flower appears. After 21 clicks (in honor of the 21 days of Getting Unstuck), a poem about petals appears, and the project resets. Everything is iterative!",14632339,https://cdn2.scratch.mit.edu/get_image/project/235706472_480x360.png,2018-07-06T17:57:34.000Z,2018-07-06T18:34:45.000Z,2018-07-06T18:21:59.000Z,14,2,2,0,0,235590337,235590337
235705607,Getting Unstuck 2,I used clones to create a flower whenever the mouse was down. I had to add some waits in to prevent it from being a little too sensitive and creating a ton of flowers at once.,"Click the green flag to get started, then click the background to add a flower to the flowerbed. You can also hold the mouse down to add multiple flowers. Click the squirrel to remove the flowers.",18044195,https://cdn2.scratch.mit.edu/get_image/project/235705607_480x360.png,2018-07-06T17:45:55.000Z,2018-07-06T19:17:38.000Z,2018-07-06T18:22:14.000Z,6,1,1,0,0,,
235699394,Getting Unstuck Day 2 flower power,Well I cheated... I went through the questions board.  A lot of this thinking can be attributed to P444.  So P444 if you are out there... Thank you so much.  For what it is worth I did spend a good hour trying to figure this out before going to the boards. ,Click where you want the picture of the flower to appear. ,34141039,https://cdn2.scratch.mit.edu/get_image/project/235699394_480x360.png,2018-07-06T16:20:01.000Z,2018-07-06T18:27:28.000Z,2018-07-06T18:24:09.000Z,4,1,1,0,0,,
235707351,Unstuck Day 2,If I had more time I would find a better flower or take more time to draw the one I made a little neater.,,26877789,https://cdn2.scratch.mit.edu/get_image/project/235707351_480x360.png,2018-07-06T18:09:53.000Z,2018-07-06T18:34:02.000Z,2018-07-06T18:32:59.000Z,6,1,1,0,0,,
235708476,Day 2 Unstuck Flower Creation,"I like the simplicity of the stamp tool here.  But what I really wanted to do was use the pen down tool and draw out my flower with commands.  

Unfortunately I kept running into issues with letting it run after the mouse down was detected.",Display a flower each time that the user clicks on the background. There are at least three different ways of programming this in Scratch—what will your approach be? ,20446522,https://cdn2.scratch.mit.edu/get_image/project/235708476_480x360.png,2018-07-06T18:24:34.000Z,2018-07-06T18:53:33.000Z,2018-07-06T18:51:59.000Z,8,2,1,0,0,,
235709545,Getting Unstuck | Day 2 | 21 Days of Flowers remix,"I attempted the clone approach to make the petals fade after a few seconds. It was only semi-successful. Making all the petals clones very quickly made the program glitch like crazy. I combined the clone/stamp approaches to at least the get the last petal to fall and fade away. It still gets a little glitchy if you click too fast though. If you wait a few seconds for old clones to be deleted before adding new ones it's okay.

I thought this project was so pretty, and I liked the idea of leaving in unused code blocks with comments to show process. I will definitely use that with my students next year. Thanks Karen!","Every time you click on the background, a flower appears. After 21 clicks (in honor of the 21 days of Getting Unstuck), a poem about petals appears, and the project resets. Everything is iterative!",18044195,https://cdn2.scratch.mit.edu/get_image/project/235709545_480x360.png,2018-07-06T18:39:12.000Z,2018-07-06T19:14:03.000Z,2018-07-06T19:09:30.000Z,6,2,1,0,0,235590337,235590337
235689859,Flower chain reation! (Getting Unstuck Day 2),"Thinking about something appearing when the stage was clicked reminded me something. And then I realized it was one of my first scratch projects.
So I adapted it in a floral version.
Modifying a code I had written a lot of years ago is hard (I regret I didn't comment it out) and I notice now I know a bit better Scratch so I could make it simpler.
Anyway, I'm very proud of this game because I played it on prehistorical smartphones :) and I like how it is similar to the original game.
If I had more time I would have use images with higher quality and simplified the code.","One click per level.
Trigger a flower chain reaction!

P.s. There is at least one magic easter egg :)",2417641,https://cdn2.scratch.mit.edu/get_image/project/235689859_480x360.png,2018-07-06T14:14:28.000Z,2018-07-06T19:32:31.000Z,2018-07-06T19:17:07.000Z,19,7,3,0,0,,
235710022,day 2,,press green flag and injoy,34188789,https://cdn2.scratch.mit.edu/get_image/project/235710022_480x360.png,2018-07-06T18:46:25.000Z,2018-07-07T04:41:08.000Z,2018-07-06T19:29:55.000Z,7,1,1,0,0,,
235709095,Let flowers bloom,"This was a good excuse to explore Scratch colors; I've never really taken the time to do that. If I had more time, I'd investigate ways to filter out certain color ranges.","Click the stage to plant a flower ; )
Click the X to clear the stage.",1188602,https://cdn2.scratch.mit.edu/get_image/project/235709095_480x360.png,2018-07-06T18:34:02.000Z,2018-07-06T19:47:01.000Z,2018-07-06T19:32:11.000Z,9,3,2,0,0,,
235711805,Hayfever,"One downside of looking to the studio to be inspired... you want to recreate some of the best projects and you  don't get creative yourself... at least that's what I had trouble with this time.  

Again, I am struggling with keeping things light and fun... god, I must be a blast around the kids!  ","Getting Unstuck - Day #2.

Click anywhere on the stage to paint a flower.  Be careful - don't paint too many flowers...:)
",2876976,https://cdn2.scratch.mit.edu/get_image/project/235711805_480x360.png,2018-07-06T19:12:25.000Z,2018-07-06T19:47:21.000Z,2018-07-06T19:44:43.000Z,14,3,1,0,0,,
235712146,Getting Unstuck: Day 2,,,26997619,https://cdn2.scratch.mit.edu/get_image/project/235712146_480x360.png,2018-07-06T19:17:43.000Z,2018-07-06T19:55:27.000Z,2018-07-06T19:55:26.000Z,11,3,2,0,0,,
235692278,Getting Unstuck Day 2 Flower Clones on Mouse,,,11634746,https://cdn2.scratch.mit.edu/get_image/project/235692278_480x360.png,2018-07-06T14:46:59.000Z,2018-07-08T17:16:34.000Z,2018-07-06T19:46:26.000Z,9,1,1,0,0,,
235711054,Unstuck - Day 2,"This was a tough challenge!  But we enjoyed making it!  Again, I worked with my daughter to complete this project.  Here are some things we tried.
First we found a background that would be suitable for planting flowers.
Then we created a flower sprite with three costumes. We wanted a different flower to appear where your mouse was pointing each time you clicked your mouse.
We experimented with the stamp block under pen, but could not make the flower appear when we clicked, so we added the if...then conditional with a mouse down sensing block in it.  It still wasn't working.  I explained to my daughter that when you clicked the green flag, it only checked one time to see if the mouse was down, so we would need a forever block wrapped around it, so the program would constantly check to see when the mouse was down.  The stamp feature still would not work, so we experimented with the create a clone of myself block.  It was working, but only one flower would be stamped, so we added a next costume block.  Now it printed three different flowers all at once.  Adding a wait block solved that issue.  Next, we wanted to hide the initial flower, so we added the hide block before the forever and put in a show block after the if...then conditional.  Finally, we had to decide whether or not to keep the Scratch Cat.  Of course, we kept him - he's the hero.  He gives the user a purpose and directions for planting a garden.

After looking at other people's projects, I liked how jrushing72 used functions to define drawing random sized/colored flowers.  I may use that example for my define a block lesson later this year.  I also found a project that had a similar problem as mine and I made a suggestion to add a wait block.     
",Click the green flag to start!,2456527,https://cdn2.scratch.mit.edu/get_image/project/235711054_480x360.png,2018-07-06T19:01:57.000Z,2018-07-06T19:56:50.000Z,2018-07-06T19:40:54.000Z,7,2,1,0,0,,
235705501,Unstuck 2,I wanted a variable that gives exactly three flowers (which was the hardest part),"Starts with green flag
Spacebar asks for the size of the flower
Pen draws the flower
",1072279,https://cdn2.scratch.mit.edu/get_image/project/235705501_480x360.png,2018-07-06T17:44:28.000Z,2018-07-06T20:12:44.000Z,2018-07-06T20:03:58.000Z,13,1,1,0,0,,
235714243,Day 2 - Getting Unstuck,I thought this lesson was going to take a lot longer but actually really like what I came up with rather quickly.  It also sparked a number of ideas for projects to integrate into other content areas.  ,The schools flower bed is looking a little bare.  Click the green flag and then move the flowers around and click to fill in the empty spaces with some colorful flowers.  ,21213359,https://cdn2.scratch.mit.edu/get_image/project/235714243_480x360.png,2018-07-06T19:53:03.000Z,2018-07-06T20:09:15.000Z,2018-07-06T20:04:51.000Z,10,1,1,0,0,,
235694837,Day 2 roses,Click the mouse for more roses.,,214,https://cdn2.scratch.mit.edu/get_image/project/235694837_480x360.png,2018-07-06T15:19:28.000Z,2018-07-06T20:11:52.000Z,2018-07-06T20:11:52.000Z,11,4,1,0,0,,
235713998,Getting Unstuck: Day 2,,,9505598,https://cdn2.scratch.mit.edu/get_image/project/235713998_480x360.png,2018-07-06T19:48:40.000Z,2018-07-06T20:19:32.000Z,2018-07-06T20:19:32.000Z,17,2,1,0,0,,
