id,title,description,instructions,author/id,image,history/created,history/modified,history/shared,stats/views,stats/loves,stats/favorites,stats/comments,stats/remixes,remix/parent,remix/root
235712536,Bloom to Fade: Getting Unstuck Day 2 Flowers,"Getting Unstuck Day 2 Flowers

Creativity: 
I realized right away that if you kept clicking and adding more flowers, the screen would get really full so that there would have to be some way for the flowers to disappear or be removed. I decided that their petals would fall to the ground before they faded away.

Production:
Fairly straightforward with a bit of testing and iteration. Drawing the flowers with Scratch's drawing tools was not that difficult. I did run into a bug where the flowers wouldn't change colour each time I clicked, because I put the code for that inside the ""When a clone is created"" block, rather than before the creation of the clone. That means each clone started at the first colour and only changed colour once, so they all ended up at the same colour. Additionally, I had some trouble working out the code to make the size of the flower depend on the y-position of the mouse when clicked. I did have to use my math skills on that one to figure out how to make the size a function of the y-position.

Getting Unstuck:
I went back to good old paper and pencil to graph the size of the flower as a function of the y-position of the mouse. I used y=mx+b and initially messed up on calculating my b value. The great thing about Scratch is that when I tested it, I saw immediately that the program wasn't doing what I expected it to do, so that I knew I had made an error. Not sure I would have caught that without the immediate feedback. Not so much getting unstuck with my coding as my coding helping me get unstuck with my math!
Still not sure how to make the flowers appear when the mouse button comes up, as you can simply hold the mouse down as you move it around on the screen.",Move the mouse around and click anywhere on the green grass!,3485356,https://cdn2.scratch.mit.edu/get_image/project/235712536_480x360.png,2018-07-06T19:23:58.000Z,2018-07-07T17:48:05.000Z,2018-07-06T20:09:55.000Z,10,2,1,0,0,,
235710051,Rose Clicker,"Getting Unstuck Challenge Day 2: ""Display a flower each time that the user clicks on the background."" After playing around with unlimited rose clicks, I decided to keep score and limit it to a dozen, followed by a final message from the sun. Not too complicated, but fun!","Click the green flag to start, then click anywhere on the screen to grow a long-stemmed rose. Once you've grown a dozen, you'll receive a special message!",17801875,https://cdn2.scratch.mit.edu/get_image/project/235710051_480x360.png,2018-07-06T18:47:00.000Z,2018-07-06T20:27:48.000Z,2018-07-06T20:27:48.000Z,9,2,1,0,0,,
235709811,Day 2 - Getting Unstuck,,,26079479,https://cdn2.scratch.mit.edu/get_image/project/235709811_480x360.png,2018-07-06T18:43:04.000Z,2018-07-24T22:18:49.000Z,2018-07-06T20:48:01.000Z,26,11,6,0,0,,
235716222,Moon Garden,"I've always liked creating ""interactive gardens"", so I was happy to have a chance to tinker with a new type of interactive garden as part of the Getting Unstuck initiative (challenge #2), organized by the ScratchEd Team: https://gettingunstuck.gse.harvard.edu

The project using cloning to create multiple flowers. At first, I tried to broadcast a message directly from the stage to the flower sprite, telling it to clone. But that led to a bug, since the clones were also receiving the broadcast message. So I added a ""seed"" sprite as an intermediate sprite (between the stage and flower).","Click anywhere on the moon to plant a seed, then watch your flower grow!",167,https://cdn2.scratch.mit.edu/get_image/project/235716222_480x360.png,2018-07-06T20:29:24.000Z,2018-07-08T12:40:19.000Z,2018-07-06T20:56:06.000Z,131,23,10,0,0,,
235713288,Getting Unstuck Day 2,I learned about vector drawing by making this project. I had no experience with it before this project. ,Click the background and see a surprise. ,266894,https://cdn2.scratch.mit.edu/get_image/project/235713288_480x360.png,2018-07-06T19:35:52.000Z,2018-07-06T21:26:03.000Z,2018-07-06T21:01:50.000Z,6,1,1,0,0,,
235715012,Getting Unstuck Day 2,"To continue my ocean theme, I decided to have coral reef appear instead of regular flowers for the challenge of displaying a flower every time the background is clicked. By having the coral change color with each click, I added a bit of the vibrancy that coral reef naturally brings to the oceans. 

This was definitely more of a challenge, but it certainly helped to be able to see how others approached the task. ",Click the green flag. Then click anywhere to make the coral reef appear. ,10722024,https://cdn2.scratch.mit.edu/get_image/project/235715012_480x360.png,2018-07-06T20:07:42.000Z,2018-07-06T21:06:51.000Z,2018-07-06T20:55:39.000Z,12,2,1,0,0,,
235718263,Unstuck 2,I have learned how to use the category PEN in a creative way. Never thought that PEN can be so powerful :) ,,13846307,https://cdn2.scratch.mit.edu/get_image/project/235718263_480x360.png,2018-07-06T21:06:27.000Z,2018-07-06T21:13:35.000Z,2018-07-06T21:09:41.000Z,6,1,1,0,0,,
235715546,Getting Unstuck - Day 2,It took longer for me to create the flower I wanted and to get a transparent background than to make the actual program. I did jump into cloning this time...I have wanted to figure out how to do that and decided this was a good time to look through the tutorials. Took forever to figure out how to make the flower go away in the beginning with the green flag.,Mom's vase is empty. Click to place fill Mom's vase with pretty flowers! Click the green flag to start over!,2360384,https://cdn2.scratch.mit.edu/get_image/project/235715546_480x360.png,2018-07-06T20:16:29.000Z,2018-07-06T21:17:47.000Z,2018-07-06T21:17:47.000Z,15,1,1,0,0,,
235694882,Getting Unstuck Day #2: Flowers Dance,"Getting Unstuck: Day 2 - Display a flower each time that the user clicks on the background.
I remixed an old project to adapt it to the Day#2 challenge, making it interactive. It was not easy because there were so many sprites to control. 
The original project was made inspired by a wonderful e-card I received from a friend.
I tried to explore, wondering how could we make an e-card using Scratch. To give originality, I used a picture from an oil work made by myself.
From the picture, each small group of flowers was cut off to became a separated sprite. 
Each one goes into the valse ""dancing"".
Music:  Tchaikovsky's ""Flowers Valse"". 


","click on the green flag to start.
Then click on the ground to add flowers to the vase.



",2176961,https://cdn2.scratch.mit.edu/get_image/project/235694882_480x360.png,2018-07-06T15:19:53.000Z,2018-07-10T00:30:56.000Z,2018-07-06T21:27:55.000Z,18,6,1,0,0,,
235717690,Unstuck 02 - Click to show flower,Thank you to PinkGoldPeachyKeen for ideas on structure.,Click the mouse to show a flower.,19123745,https://cdn2.scratch.mit.edu/get_image/project/235717690_480x360.png,2018-07-06T20:56:03.000Z,2018-07-06T21:22:07.000Z,2018-07-06T21:19:16.000Z,18,2,1,0,0,,
235713302,in flanders fields,"In my country is war now and more than 10 000 people were killed. This project for their memory. Two things are very difficult for me - make working code and write this text by English, and I apologize for this.",Click to any place on stage and the red flower will grow up. I,23356305,https://cdn2.scratch.mit.edu/get_image/project/235713302_480x360.png,2018-07-06T19:36:04.000Z,2018-07-06T21:45:08.000Z,2018-07-06T21:31:53.000Z,8,1,2,0,0,,
235715853,Getting Unstuck: Day 2,Used Code Club Ghostbusters project to help with the random flower effect,Keep clicking on the stage,34197892,https://cdn2.scratch.mit.edu/get_image/project/235715853_480x360.png,2018-07-06T20:22:17.000Z,2018-07-12T21:29:13.000Z,2018-07-06T20:54:56.000Z,5,1,1,0,0,,
235719371,Roses Growing - Ungar Challenge #2,"I couldn't figure out how to allow the user to sprout multiple flowers at a time . I wanted each flower to fade after about 2 seconds, but in theory the user should be able to spout multiple flowers in different areas at the same time. Couldn't do it :-)",Click the green flag and then click anywhere on the background to insta-plant a flower.,34185712,https://cdn2.scratch.mit.edu/get_image/project/235719371_480x360.png,2018-07-06T21:28:37.000Z,2018-07-07T23:39:51.000Z,2018-07-06T21:50:09.000Z,5,1,1,0,0,,
235678783,Getting Unstuck: Day 2,"Image:
https://www.vecteezy.com/vector-art/124781-pansies-vector-collection

WOW! How exhausting! It helped me to look at the published projects. Thanks!!!","Click the green flag.
Show a flower every time the user clicks on the background.",19789360,https://cdn2.scratch.mit.edu/get_image/project/235678783_480x360.png,2018-07-06T12:08:28.000Z,2018-07-06T22:05:34.000Z,2018-07-06T20:01:01.000Z,9,2,1,0,0,,
235681367,flower power day 2,,"Click on green flag to start.
Click on the screen for the flower to appear",11349852,https://cdn2.scratch.mit.edu/get_image/project/235681367_480x360.png,2018-07-06T12:39:31.000Z,2018-07-06T22:35:01.000Z,2018-07-06T22:35:00.000Z,7,3,1,0,0,,
235721549,Day Two Tupac ,"This was hard. I worked on it without looking for a long time, but then I had to cheat. I found out that some of my ideas were on the right track but just not quite right. I'm starting to think this format is a little buggy. Idk, maybe I'm just frustrated because I couldn't figure it out on my own.

Thanks for the help, misspsmith",Click on the background and you get more flowers.,10309968,https://cdn2.scratch.mit.edu/get_image/project/235721549_480x360.png,2018-07-06T22:16:13.000Z,2018-07-25T01:19:22.000Z,2018-07-06T22:44:24.000Z,8,1,2,0,0,,
235719852,Getting Unstuck Day 2,I looked inside the beautiful project by rbotero for ideas on how to create this program. I tweaked the structure slightly so the flowers were not continuously generated when the mouse is clicked but rather allows time for the user to move around the screen to different locations before clicking again. When creating this project I learned more about the pen scripts. Previously I had never thought to use the stamp tool. I like that my project stamps the flower in three different colors.,First click the green flag to start/reset the program. Then click somewhere on the screen to plant a flower. You may repeat this process as many times as you desire. Have fun!,22156688,https://cdn2.scratch.mit.edu/get_image/project/235719852_480x360.png,2018-07-06T21:37:35.000Z,2018-07-06T23:04:34.000Z,2018-07-06T22:37:52.000Z,6,2,1,0,0,,
235720900,Getting Unstuck: Day 2,"Unstuck thanks to @rbotero 's work

Icons made by Freepik from https://www.flaticon.com/ is licensed by Creative Commons BY 3.0",,599612,https://cdn2.scratch.mit.edu/get_image/project/235720900_480x360.png,2018-07-06T22:00:54.000Z,2018-07-06T22:56:04.000Z,2018-07-06T22:56:04.000Z,7,2,1,0,0,,
235719912,Cherry blossom,"- What did you like most about your project? 

I like the zoom effect on flowers.

- What would you do with it next, if you had more time?
If I have more time I'd like to draw my own flowers and make an animation of a cherry tree where flowers could blossom little by little.

--Credits--
I found the images on pixabay website:
https://pixabay.com/en/","Click the mouse anywhere on the background and a flower will appear.

Getting Unstuck Day 2: Display a flower each time that the user clicks on the background.

--Approach--
I decided to make a simple project by using the cloning.
At first, when I tested the program the flower appeared constantly and I didn't like it, so I used the ghost effect to disappear it thanks to a comment by @scratchteacheralpha032.
After that, I added a wait block each time I pressed the mouse, because I realized that when the flower started as a clone, it appeared like 3 flowers.
Then, I added like a zoom effect on the flower using ""repeat blocks"" and ""change size blocks"".
",4413079,https://cdn2.scratch.mit.edu/get_image/project/235719912_480x360.png,2018-07-06T21:38:54.000Z,2018-07-19T19:24:43.000Z,2018-07-06T22:45:30.000Z,11,2,1,0,0,,
235722935,Getting Unstuck Challenge Day 2,I've always loved using fading out clones of sprites. Click to leave a permanent record of this blooming flower. Thanks to giphy for the gif file.,,4610900,https://cdn2.scratch.mit.edu/get_image/project/235722935_480x360.png,2018-07-06T22:47:57.000Z,2018-07-06T23:05:28.000Z,2018-07-06T23:04:29.000Z,6,3,1,0,0,,
235722379,#Getting Unstuck День2,,,34214931,https://cdn2.scratch.mit.edu/get_image/project/235722379_480x360.png,2018-07-06T22:36:38.000Z,2018-07-06T23:10:30.000Z,2018-07-06T23:10:30.000Z,3,2,1,0,0,,
235706183,Magic flowers Getting Day 2 Getting Unstuck ,"Getting Unstuck Day 2: tinkering with interactive flowers.

Credits
I found the flower via Pixabay.com",Click on the green flag ,8789156,https://cdn2.scratch.mit.edu/get_image/project/235706183_480x360.png,2018-07-06T17:53:20.000Z,2018-08-01T19:59:10.000Z,2018-07-06T23:10:05.000Z,13,2,1,0,0,,
235713416,Unstuck flowers,"Yesterday I tried not to be influenced by other people's projects, so I made my project before looking at others. Today I tried the opposite approach: I started with a tour of other people's gardens, I picked my favorite flowers, put them in my backpack and planted them in my project. I see it as a way to celebrate diversity and getting inspired by others.

Thanks to: 
@mizzpeters @karenb @ClarendonRoadCC @carlapoppi @chrise07
@clarimer @edmondmm @PinkGoldPeachyKeen @mres @colemantigers and all the unstuck friends for their beautiful flowers and inspiration!",Click on the grass to make flowers appear!,2286560,https://cdn2.scratch.mit.edu/get_image/project/235713416_480x360.png,2018-07-06T19:38:12.000Z,2018-07-19T01:49:21.000Z,2018-07-06T23:20:29.000Z,23,7,2,0,0,,
235689403,Day 2 - Flower Power,"I used the exercise to explore adding gifs. I tried using Photoshop to help automate the process, but between it and Fireworks, couldn't find a way to import them with a clear background. PNGs import with clear backgrounds but wouldn't import in the order I wanted which is why I ended up using a black background. Also found the maximum file size pretty quickly as each GIF used a lot of space. GIFs were posted on GIPHY. Fun!",Click,109272,https://cdn2.scratch.mit.edu/get_image/project/235689403_480x360.png,2018-07-06T14:08:26.000Z,2018-07-07T23:34:37.000Z,2018-07-06T23:31:24.000Z,6,2,1,0,0,,
235722518,Flower Power (Getting Unstuck Day 2),"Thanks to @rbotero for the script to clear the background at the beginning and the idea to use the stampe. 


Lots of playing around to get it the way I wanted.",Click the mouse to add flowers.  Click the space bar to stop.,34198395,https://cdn2.scratch.mit.edu/get_image/project/235722518_480x360.png,2018-07-06T22:39:37.000Z,2018-07-15T04:06:10.000Z,2018-07-06T23:49:28.000Z,8,2,1,0,0,,
235720231,Bug School,"This project responds to the prompt for Getting Unstuck:  Day 2:  ""Display a flower each time that the user clicks on the background. There are at least three different ways of programming this in Scratch—what will your approach be?'""
I originally thought that the ""Prof"" sprite would draw the flowers, but realized that the coding would take a lot of time!  So I decided to go with the Stamp block and have a few different flower drawings in the form of costumes.

 I did get stuck at one point, and used the strategy ""Ask a friend.""  My teenage son was a great resource person :) ","Click on the green flag to start, then click anywhere on the blackboard!",527557,https://cdn2.scratch.mit.edu/get_image/project/235720231_480x360.png,2018-07-06T21:46:21.000Z,2018-07-07T00:31:48.000Z,2018-07-07T00:28:40.000Z,13,5,1,0,0,,
235727354,Getting Unstuck Day 2 ,"This project is not at all what I visioned. For some reason there is a strip of the background on the right side where my flowers will not appear. There seems to be some problem with where my mouse goes. If you have suggestions please comment and let me know how I could fix it. 

I started this project thinking I would use the clone option however, I went with the stamp block. I might try to remix this and use the clone block.
I did enjoy creating my flowers and playing around with the color effect. ",Use the mouse pointer to click around the screen. With each click of the mouse a new flower will appear. ,24781756,https://cdn2.scratch.mit.edu/get_image/project/235727354_480x360.png,2018-07-07T00:27:48.000Z,2018-07-09T00:18:17.000Z,2018-07-07T01:20:13.000Z,6,2,1,0,0,,
235725685,Day 2 Unstuck-Watercolor Flower,"I chose to use the clone block.  At first, I was going to use the stamp and hide, and then  I thought it would be easier to use the clone.  

WATERCOLORS - music by Marcelo Cesena and Dorian Rimsin","My answer to Day 2 Unstuck: Display a flower each time that the user clicks on the background.

Click on green flag to start and click where ever you would like to see a pretty orange flower!",1294980,https://cdn2.scratch.mit.edu/get_image/project/235725685_480x360.png,2018-07-06T23:53:29.000Z,2018-07-07T02:31:17.000Z,2018-07-07T01:28:20.000Z,12,3,1,0,0,,
235674874,Sunflower Garden (pen),"I wanted to create sunflowers by drawing with the pen blocks. One challenge I had was creating the color gradient on the petals to make them look like they were changing from orange to yellow-- I tried a few different ways but ultimately settled on changing color and shade in a loop and experimenting until I got the colors I wanted.

I had fun learning about the math of sunflowers! The seeds are in spirals called Fermat's spirals: https://en.wikipedia.org/wiki/Fermat%27s_spiral

Song: ""Song for a Pea"" for Podington Bear","Click to place a sunflower!

One thing that I've loved about Scratch since I first started using it is that it allows you to apply math to create art. On the surface, this doesn't look like it uses math, but actually, it uses a lot of trig. Take a look inside!",246290,https://cdn2.scratch.mit.edu/get_image/project/235674874_480x360.png,2018-07-06T11:17:35.000Z,2018-07-09T21:13:29.000Z,2018-07-07T02:00:24.000Z,733,118,72,0,0,,
235730240,Untitled,"Having never done Scratch before, these challenges are really pushing my thinking.  I tried drawing my own sprite this time and learned the difference between cloning and duplicating.",clicking any key creates a clone of a drawn flower Sprite.  The clones are stacked on each other and can be moved.  The green flag erases the beach to start again.,34205973,https://cdn2.scratch.mit.edu/get_image/project/235730240_480x360.png,2018-07-07T01:21:06.000Z,2018-07-07T02:29:44.000Z,2018-07-07T02:19:57.000Z,5,3,1,0,0,,
235728896,Day 2 - Flowers in the Sky,"Stars are the flowers of the sky, right? I learned about clones while doing this project. I found that use the When I am Clicked for the background, worked better than ""if mouse down."" ",Click on the green flag. Then click anywhere in the sky. A new star will appear and spin.,31044612,https://cdn2.scratch.mit.edu/get_image/project/235728896_480x360.png,2018-07-07T00:57:50.000Z,2018-07-07T02:33:17.000Z,2018-07-07T02:11:59.000Z,12,2,1,0,0,,
235733210,GettingUnstuckDay2Flowers,,Getting Unstuck Day Two excercise.  Click on the stage to make more flowers,18198558,https://cdn2.scratch.mit.edu/get_image/project/235733210_480x360.png,2018-07-07T02:14:15.000Z,2018-07-07T04:36:08.000Z,2018-07-07T02:33:47.000Z,15,4,2,0,0,,
235700989,Unstuck Day 2 - Increasing Flowers,"Challenge: Display a flower each time user clicks on background.

I realized that if I used broadcast on the background script, it would only allow me to create 9 clones. By changing the background script to create a clone of the flower when clicked, I can now create infinite clones. I had never done cloning before and found this tricky. But it makes sense now.

Update: I added a second background, changed the flower sprites to have multiple colors flowers and snazzed up the butterfly.","Click on flag to start. Then click on background to make flowers appear. When the sun sets, the flowers will disappear, although you can click and add more.",10715270,https://cdn2.scratch.mit.edu/get_image/project/235700989_480x360.png,2018-07-06T16:42:42.000Z,2018-07-28T01:09:15.000Z,2018-07-07T00:11:07.000Z,9,1,1,0,0,,
235733196,Unstuck Day 2: Flowers,"I uploaded one of my pictures to use as the sprite.  I went to the costume tab and used the eraser to get rid of the background so only the flower was visible. I really wasn't sure how to make the flowers disappear, so thank you to augusto- I looked at your script for help.","Click on the green flag to begin. Each time you click on the stage, new flowers will appear.",34190490,https://cdn2.scratch.mit.edu/get_image/project/235733196_480x360.png,2018-07-07T02:13:56.000Z,2018-07-07T03:04:37.000Z,2018-07-07T02:56:28.000Z,9,1,1,0,0,,
235692482,Chihuly Flowers (Getting Unstuck #2),"I recently visited the Biltmore in Asheville and saw the Chihuly glass exhibit. I used pictures from that visit as my ""flowers"". I made different stage backdrops for each ""flower"" and coded it using ""when stage clicked"" and ""next backdrop"". ",Click the green flag to begin.,124311,https://cdn2.scratch.mit.edu/get_image/project/235692482_480x360.png,2018-07-06T14:50:17.000Z,2018-07-07T02:52:04.000Z,2018-07-07T02:45:34.000Z,7,1,1,0,0,,
235734743,Getting Unstuck Challenge 2,"Am loving the variety of ideas from others - ranging from simple to complex coding.
This challenge allows for creativity via the creation of the sprite and how to code.
I chose to shape create my sprite.
I chose to add the random block to create different sizes, using a simple stamp block as well.
Inspires a range of ideas for curriculum areas - maths, science in particular.",Click the green flag to fill the garden with different sized sunflowers.,13484475,https://cdn2.scratch.mit.edu/get_image/project/235734743_480x360.png,2018-07-07T02:43:36.000Z,2018-07-07T03:21:55.000Z,2018-07-07T03:15:54.000Z,14,1,1,0,0,,
235736424,Day 2,,Click on the screen to add a flower,24884035,https://cdn2.scratch.mit.edu/get_image/project/235736424_480x360.png,2018-07-07T03:19:20.000Z,2018-07-07T03:36:54.000Z,2018-07-07T03:26:31.000Z,10,1,1,0,0,,
235734808,Getting Unstuck: Day 2,"Thank you @clarimer for inspiring me!

I learned how to use random operators to program for colour, size and tone. 
I simply wanted to try it!

Music: Xochipitzahuatl (Flor Menudita) - Tempus Quartet
"," Jose Guadalupe Posada's Catrina loves flowers! Click on the green flag and decorate her hat, her dress, all around her!",32493591,https://cdn2.scratch.mit.edu/get_image/project/235734808_480x360.png,2018-07-07T02:44:58.000Z,2018-07-12T00:32:00.000Z,2018-07-07T03:44:17.000Z,19,5,4,0,0,,
235716385,Getting Unstuck: Day 2,"Credit:
blackboard eraser clip art : https://clipartuse.com/blackboard-eraser-clipart-68138",Click the background to fill the screen with flowers.  Eraser keeps the screen from getting too filled up.,17257831,https://cdn2.scratch.mit.edu/get_image/project/235716385_480x360.png,2018-07-06T20:32:25.000Z,2018-07-07T13:02:07.000Z,2018-07-07T04:51:55.000Z,9,2,1,0,0,,
235700354,Unstuck Day 2 - Flower Power,,,18558561,https://cdn2.scratch.mit.edu/get_image/project/235700354_480x360.png,2018-07-06T16:34:05.000Z,2018-07-07T01:34:31.000Z,2018-07-07T01:34:31.000Z,10,1,1,0,0,,
235743837,Unstuck Day 2,If i have many times i want make the flower dance ^_^,Just click the background please....,34216021,https://cdn2.scratch.mit.edu/get_image/project/235743837_480x360.png,2018-07-07T06:19:36.000Z,2018-07-11T03:30:15.000Z,2018-07-07T06:20:06.000Z,14,1,1,0,0,,
235744521,Day-2,"I way - move the sprite to another place
II way - use ""stamp""
III way - use cloning
Scratch On!
Happy Summer!","Getting Unstuck - Day 2
Display a flower each time that the user clicks on the background. 
Choose one of the three ways to solve the problem - press 1, 2 or 3
Move cursor and press mouse button
Move the cursor and press the mouse button to display the flower.
Back - return to main screen",139209,https://cdn2.scratch.mit.edu/get_image/project/235744521_480x360.png,2018-07-07T06:36:03.000Z,2018-07-07T07:30:41.000Z,2018-07-07T07:23:17.000Z,10,2,1,0,0,,
235747402,Unstuck #2,I found this quite tricky. But here it is.,,141519,https://cdn2.scratch.mit.edu/get_image/project/235747402_480x360.png,2018-07-07T07:37:28.000Z,2018-07-07T07:43:02.000Z,2018-07-07T07:42:18.000Z,6,1,1,0,0,,
235744996,Getting Unstuck: Day 2,,"""Display a flower each time that the user clicks on the background. There are at least three different ways of programming this in Scratch—what will your approach be?""",5819312,https://cdn2.scratch.mit.edu/get_image/project/235744996_480x360.png,2018-07-07T06:46:53.000Z,2018-07-08T07:13:53.000Z,2018-07-07T10:37:11.000Z,9,1,1,0,0,,
235754602,GettingUnstuck-02,Tanks to angiulina84 for the nice proposal to change size depending on y coordinate,"Let's make it bloom!
Click on the ground to have flowers blooming. Green flag to clean.
I plan to add more kind of flowers and have different things happening when clicking on the sky.",25876369,https://cdn2.scratch.mit.edu/get_image/project/235754602_480x360.png,2018-07-07T10:04:35.000Z,2018-07-07T16:51:38.000Z,2018-07-07T10:57:22.000Z,7,2,1,0,0,,
235709480,Getting Unstuck: Day 2,,"1. Click the flag.
2. Click the background.
3. See the flower appear.",14143361,https://cdn2.scratch.mit.edu/get_image/project/235709480_480x360.png,2018-07-06T18:38:39.000Z,2018-07-07T11:31:26.000Z,2018-07-07T11:31:26.000Z,15,1,1,0,0,,
