id,title,description,instructions,author/id,image,history/created,history/modified,history/shared,stats/views,stats/loves,stats/favorites,stats/comments,stats/remixes,remix/parent,remix/root,,description,instructions
235644438,Getting Unstuck Day 1,"I saw HeloisaZal's idea. What an amazing effect! I tried it and I did my best:D. I like how it looks when you animate real pictures, though editing them is difficult. Useful way to animate a project if you want to work fast. I usually ask students to draw their own ideas but this is a great way to animate too. ",Click green flag to start. Greetings from Mexico!,32493591,https://cdn2.scratch.mit.edu/get_image/project/235644438_480x360.png,2018-07-06T03:35:02.000Z,2018-07-06T04:21:58.000Z,2018-07-06T04:21:58.000Z,10,1,1,0,0,,,,,
235643852,Bird Watching,,Click the green flag to enjoy a little bird watching with Abby.,17755152,https://cdn2.scratch.mit.edu/get_image/project/235643852_480x360.png,2018-07-06T03:21:59.000Z,2018-07-06T05:59:40.000Z,2018-07-06T04:30:04.000Z,5,1,1,0,0,,,,,
235645823,Getting Unstuck Day #1: Collision,"Getting Unstuck Day 1

Sprite-sprite collisions are always tricky for students - for example, which sprite should ""own"" the collision detection? How do you avoid race conditions when both sprites collide? For this challenge I opted to avoid using broadcasts and instead went with a simpler approach that has each sprite detect collision separately and respond independently using timers.

To up the challenge level I decided to create a ""wander"" function to replicate a behavior students frequently ask for but have difficulty replicating. A couple of surprising difficulties arose out of this.

First, I couldn't easily couple timed costume changing animations with a smooth movement function. For the cat I resolved this by setting a separate forever loop to animate the costume, but for the dog I attempted a more sophisticated approach that still required a separate forever loop, but uses the mod of a constantly incrementing variable to determine when to animate, which has the benefit of easily stopping animation when the two collide at the cost of being more difficult for a student to understand (would be simpler if Scratch exposed a ""frames elapsed"" var like it does for seconds or minutes).

The second issue is one the frequently trips students (and me!) up when combining collisions at animations - the sprites' collision footprint changes every time the costume changes, which makes it more finicky than feels necessary to respond to collisions only once. I had to push sprites off by several pixels any time a collision was detected to avoid recolliding when the costume changes.",,1092342,https://cdn2.scratch.mit.edu/get_image/project/235645823_480x360.png,2018-07-06T04:02:20.000Z,2018-07-06T04:58:49.000Z,2018-07-06T04:23:06.000Z,6,2,1,0,0,,,,,
235621434,NicholasCatSplat,"Hey. This is a little game I made with my 8 year old son with a little input from my 11 yo. He loves Scratch and really likes creating with it. 

It was fun working with him because I got to teach him about X and Y axes. 
I don't always know how to approach Scratch because I love it when I'm given a challenge, but I have problems thinking of something myself. Being given a challenge and working with my sons really helped me. 
I liked the range of graphics that other people used to create their animations.

Idea - Nathaniel
Art - Nicholas
Programming - Ian and Nicholas","Click the Green Flag. Avoid the pink blob by moving the cat using the up, down, left, and right arrows.",4737145,https://cdn2.scratch.mit.edu/get_image/project/235621434_480x360.png,2018-07-05T21:21:48.000Z,2018-07-06T05:07:12.000Z,2018-07-06T04:55:05.000Z,5,1,1,0,0,,,,,
235649917,Butterfly (Getting Unstuck1),,"Click green flag to start. 
Greetings from Bulgaria!",24864175,https://cdn2.scratch.mit.edu/get_image/project/235649917_480x360.png,2018-07-06T05:30:57.000Z,2018-07-06T05:53:42.000Z,2018-07-06T05:50:12.000Z,7,1,1,0,0,,,,,
235653081,Friendly Wizards - #GettingUnstuck,,Click on the green flag,7503612,https://cdn2.scratch.mit.edu/get_image/project/235653081_480x360.png,2018-07-06T06:26:50.000Z,2018-07-06T06:37:27.000Z,2018-07-06T06:36:52.000Z,4,1,1,0,0,,,,,
235584528,Unicorns in space,"Unstuck Day #1
Create a project that whenever two sprites collide, one of them says, ""Excuse me!"" and the other sprite says, ""Certainly.""

WHAT I LEARNED:  my greatest challenge is to keep it simple.  I was going down the rabbit hole of cool animations and wanting to get the logic just perfect.  I wanted my project to be humorous but got stuck in the details - BIG NOTE for when I work with the kids! ",Click the Green Flag,2876976,https://cdn2.scratch.mit.edu/get_image/project/235584528_480x360.png,2018-07-05T14:24:39.000Z,2018-07-06T07:03:11.000Z,2018-07-06T06:58:52.000Z,9,1,1,0,0,,,,,
235654641,Getting Unstuck Day1,"Take a moment to reflect on your creative process in the Notes and Credits section of your project. 

What did you learn from creating this project? That there are so many ways to do the same thing and if you had time you could happily tweak for hours to enhance even the tiniest components. 

What did you notice about how other people approach the challenge? There's such a wide range of projects even though the task is so focussed. The project where roles changed after sunset was a great creative idea, also I'll be looking at the 3d projects some more as they look great. ",,17809789,https://cdn2.scratch.mit.edu/get_image/project/235654641_480x360.png,2018-07-06T06:53:18.000Z,2018-07-06T07:18:16.000Z,2018-07-06T07:03:20.000Z,5,1,1,0,0,,,,,
235583725,in the fishdom ,,green flag to start,33592099,https://cdn2.scratch.mit.edu/get_image/project/235583725_480x360.png,2018-07-05T14:16:35.000Z,2018-07-06T07:07:46.000Z,2018-07-06T07:07:45.000Z,8,1,1,0,0,,,,,
235655513,#GettingUnstuck_1,"I´ve seen incredible projects of other people and of course It´s a good way to improve my skills. It´s interesting learn how other people change size of sprites to create a 3D emotion.
",,16962202,https://cdn2.scratch.mit.edu/get_image/project/235655513_480x360.png,2018-07-06T07:07:46.000Z,2018-07-06T08:44:33.000Z,2018-07-06T08:00:25.000Z,6,1,1,0,0,,,,,
235660979,GettingUnstack_Day1,,,15734681,https://cdn2.scratch.mit.edu/get_image/project/235660979_480x360.png,2018-07-06T08:14:38.000Z,2018-07-06T08:33:57.000Z,2018-07-06T08:33:57.000Z,9,1,1,0,0,,,,,
235666603,Day One: Funky Cow,I like to upload funny gifs and I like animations!,This is my Day One Getting Unstuck with Scratch project,27658530,https://cdn2.scratch.mit.edu/get_image/project/235666603_480x360.png,2018-07-06T09:30:36.000Z,2018-07-08T01:48:49.000Z,2018-07-06T10:55:52.000Z,20,6,2,0,0,,,,,
235667549,Getting Unstuck | Day 1 | A Bear and A Cat remix,,"This is my project for Day 1 of Getting Unstuck!

Press the green flag.",20575890,https://cdn2.scratch.mit.edu/get_image/project/235667549_480x360.png,2018-07-06T09:42:02.000Z,2018-07-06T10:18:06.000Z,2018-07-06T10:18:06.000Z,11,1,1,0,0,235478923,235478923,,,
235614672,Unstuck Day 1,"I made Mario and Pink Gold Peach sprites and imported them to my Sprite folder.
I played around with timing of speech, so Peach's response was slightly delayed from Mario's ""Excuse me!""
Looking forward to Day 2!","Whenever Mario and Pink Gold Peach collide, Mario says, ""Excuse me!"" and Pink Gold Peach says, ""Certainly.""",18337230,https://cdn2.scratch.mit.edu/get_image/project/235614672_480x360.png,2018-07-05T19:29:56.000Z,2018-07-15T14:35:45.000Z,2018-07-05T23:27:49.000Z,12,1,1,0,0,,,,,
235674988,Random Fish,"I created this project for Day 1 of the ScratchEd ""Getting Unstuck"" adventure (https://gettingunstuck.gse.harvard.edu/about.html). 

I decided to play with randomness, and see where it would lead me...

(I didn't explicitly follow all of the instructions for the challenge -- but that's part of the point!)",Click the Green Flag,167,https://cdn2.scratch.mit.edu/get_image/project/235674988_480x360.png,2018-07-06T11:19:02.000Z,2018-07-06T12:19:37.000Z,2018-07-06T11:35:37.000Z,94,8,3,0,0,,,,,
235674799,GETTING UNSTUCK 1 Day,"Non conosco l'Inglese, cerco di barcamenarmi con Google traduttore. Chissà come finirà!!!","Attività, in ritardo, del primo giorno, con soluzione molto semplice.


",13746945,https://cdn2.scratch.mit.edu/get_image/project/235674799_480x360.png,2018-07-06T11:16:22.000Z,2018-07-06T11:45:03.000Z,2018-07-06T11:45:03.000Z,5,2,1,0,0,,,,,
235669739,Avery and Pico Getting Unstuck! - Day 1,,"Avery and Pico bump into each other at the Movies...  and wonder which movie they will see!

Click the green flag to start",19641362,https://cdn2.scratch.mit.edu/get_image/project/235669739_480x360.png,2018-07-06T10:12:55.000Z,2018-07-08T02:43:25.000Z,2018-07-06T11:55:31.000Z,5,2,1,0,0,,,,,
235568868,Getting Unstuck Day 1,"Spent quite a bit of time adding complexity to try to make the walking look better, but in the end decided that I liked the slightly crazy cartoon feel of the far too fast costume changes.

I dived in and implemented the brief as written. I'm very impressed that others took this as the kernel of the project and built an enormous, often very funny, nut around it. Maybe I should spend more time thinking creatively about the brief before I start coding.  ","Project for Day 1 of Getting Unstuck

Create a project that whenever two sprites collide, one of them says, ""Excuse me!"" and the other sprite says, ""Certainly."" ",2314547,https://cdn2.scratch.mit.edu/get_image/project/235568868_480x360.png,2018-07-05T12:11:50.000Z,2018-07-11T20:04:34.000Z,2018-07-06T12:39:53.000Z,8,1,1,0,0,,,,,
235681930,Getting Unstuck: Day 1,Polite cats :-),,24912473,https://cdn2.scratch.mit.edu/get_image/project/235681930_480x360.png,2018-07-06T12:46:15.000Z,2018-07-16T16:40:39.000Z,2018-07-06T13:04:08.000Z,3,1,1,0,0,,,,,
235682645,Unstuck Day 1 - Cat and Lion Collide,"
Challenge: 2 sprites collide, one says ""Excuse me"" while the other says ""Certainly.""

After looking at other examples, I realized how blah my project is. I loved that others were so creative with their movement. Plus some wrote other words that made it far more entertaining. Technically mine works, but it could have been a lot better.

Updated: Added backgrounds, costumes for lion, changed movement for both sprites and added variable for number of steps cat is taking.

",Click on flag to begin.,10715270,https://cdn2.scratch.mit.edu/get_image/project/235682645_480x360.png,2018-07-06T12:54:05.000Z,2018-07-27T01:26:28.000Z,2018-07-06T13:13:28.000Z,4,1,1,0,0,,,,,
235682968,Getting Unstuck Day #1 v2 Infinite Walk,"Unstuck Day #1
Create a project that whenever two sprites collide, one of them says, ""Excuse me!"" and the other sprite says, ""Certainly."" ","Click the green flag to play the animation.
",24464388,https://cdn2.scratch.mit.edu/get_image/project/235682968_480x360.png,2018-07-06T12:57:34.000Z,2018-07-06T13:21:33.000Z,2018-07-06T13:17:56.000Z,6,1,1,0,0,,,,,
235608446,Gordon_Unstuck Day 1,"This project if for Getting Unstuck Day 1.

 ",Click green flag to start program,18900622,https://cdn2.scratch.mit.edu/get_image/project/235608446_480x360.png,2018-07-05T18:05:23.000Z,2018-07-05T18:31:02.000Z,2018-07-05T18:29:33.000Z,13,1,1,0,0,,,,,
235566944,Hungry?,,"Click green flag to start.


#Getting Unstuck  Day 1",158902,https://cdn2.scratch.mit.edu/get_image/project/235566944_480x360.png,2018-07-05T11:55:20.000Z,2018-07-06T13:31:41.000Z,2018-07-06T13:29:46.000Z,12,3,1,0,0,,,,,
235681729,It Just Takes One,,Click the Green Flag to begin,1196430,https://cdn2.scratch.mit.edu/get_image/project/235681729_480x360.png,2018-07-06T12:44:10.000Z,2018-07-06T13:49:32.000Z,2018-07-06T13:38:33.000Z,10,2,1,0,0,,,,,
235581313,Unstuck Day 1,This was a complete disaster!  The task was to get the sprites to interact - that was the easy bit!  What I couldn't do was to make the sprites walk backwards and forwards across the stage.  A complete nightmare!,,3297086,https://cdn2.scratch.mit.edu/get_image/project/235581313_480x360.png,2018-07-05T13:55:42.000Z,2018-07-05T15:01:26.000Z,2018-07-05T14:58:57.000Z,9,1,1,0,0,,,,,
235683098,Getting Unstuck: Day 1,"Reflection

When I started, I had a few goals in mind. I wanted to create a situation in which two sprites are always colliding with one another. This was accomplished by simply having the two sprite walk back and forth.

A second goal of mine was to ensure that the conditions of the project always start the same way. Location, direction, color, etc, are initialized at the beginning for both sprites.

I wanted to organize the the program. This was accomplished using the a define block for checking collision, and creating a broadcast/receive pair.

Last, I wanted to add a delay to prevent the dialog from being re-triggered should the sprites collide for multiple frames in a row. I learned to use the timer so that there is a minimum 2 second delay before a collision will trigger the dialog again.
",,26264460,https://cdn2.scratch.mit.edu/get_image/project/235683098_480x360.png,2018-07-06T12:58:50.000Z,2018-07-06T14:05:08.000Z,2018-07-06T13:49:24.000Z,10,1,1,0,0,,,,,
235674069,Butterflies,,Click the flag,3602053,https://cdn2.scratch.mit.edu/get_image/project/235674069_480x360.png,2018-07-06T11:07:07.000Z,2018-07-06T14:07:47.000Z,2018-07-06T14:07:30.000Z,13,4,1,0,0,,,,,
235687818,Unstuck Day 1,,,8448794,https://cdn2.scratch.mit.edu/get_image/project/235687818_480x360.png,2018-07-06T13:49:40.000Z,2018-07-06T14:16:04.000Z,2018-07-06T14:15:05.000Z,6,1,1,0,0,,,,,
235688310,Surprise,"Getting Unstuck: Day 1 
https://gettingunstuck.gse.harvard.edu/about.html 

",Click the green flag.,2481164,https://cdn2.scratch.mit.edu/get_image/project/235688310_480x360.png,2018-07-06T13:55:46.000Z,2018-07-06T14:57:12.000Z,2018-07-06T14:14:52.000Z,23,6,2,0,0,,,,,
235684430,Challenge 1,"One of my first ""creative"" scratch programs based on the Getting unstuck challenge day 1.   Not the greatest design as the actions are based on screen geography and not methods but you have to start somewhere.  ",,34141039,https://cdn2.scratch.mit.edu/get_image/project/235684430_480x360.png,2018-07-06T13:13:52.000Z,2018-07-06T15:25:31.000Z,2018-07-06T14:48:20.000Z,7,1,1,0,0,,,,,
235689398,Unstuck_day1_Wynne,"It was interesting to see how other people had the sprites move once they touched.  With the divers, they would touch several times before getting far enough away to not trigger the say block so I had one hide and show up at a random location.","The challenge was to create a project that whenever two sprites collide, one of them says, ""Excuse me!"" and the other sprite says, ""Certainly.""",21171472,https://cdn2.scratch.mit.edu/get_image/project/235689398_480x360.png,2018-07-06T14:08:23.000Z,2018-07-06T15:15:38.000Z,2018-07-06T15:10:42.000Z,6,2,1,0,0,,,,,
235698647,diver and octupus,"Desenvolvido por Filipe Mendes no Desafio 1 do "" Getting Unstuck""
#GettingUnstuck",Press the green flag for begin.,2980392,https://cdn2.scratch.mit.edu/get_image/project/235698647_480x360.png,2018-07-06T16:09:46.000Z,2018-07-06T16:18:58.000Z,2018-07-06T16:16:27.000Z,6,1,1,0,0,,,,,
235697917,geeting unstuck-day1,,,34188789,https://cdn2.scratch.mit.edu/get_image/project/235697917_480x360.png,2018-07-06T15:59:58.000Z,2018-07-06T16:18:49.000Z,2018-07-06T16:18:48.000Z,8,1,1,0,0,,,,,
235688793,From A to Z Getting Unstuck Day 1,"What did you learn from creating this project? 
I learned how to get sprite to interact with each other by using the broadcast blocks. It wasn't simple, but the possibilities now seem endless.

What did you notice about how other people approach the challenge?
Everyone did something different! It was helpful to look at other projects to get ideas that I could then blend into my own. ",Press the green flag to get started.,28676433,https://cdn2.scratch.mit.edu/get_image/project/235688793_480x360.png,2018-07-06T14:01:08.000Z,2018-07-06T16:47:51.000Z,2018-07-06T16:42:11.000Z,2,1,1,0,0,,,,,
235701565,Challenge #1,,,3101944,https://cdn2.scratch.mit.edu/get_image/project/235701565_480x360.png,2018-07-06T16:50:48.000Z,2018-07-06T16:52:02.000Z,2018-07-06T16:52:02.000Z,16,5,2,0,0,,,,,
235699079,#GettingUnstuck1 - Hello Mr. Gobo,"Scratchy should be there, and I decided to add Gobo with a mexican hat... because mexican hats are funny =)","Press Green flag and follow the instructions.

This project is part of #GettingUnstuck initiative #CreativeComputing, Day 1

""Create a project that whenever two sprites collide, one of them says, ""Excuse me!"" and the other sprite says, ""Certainly.""""

",1112440,https://cdn2.scratch.mit.edu/get_image/project/235699079_480x360.png,2018-07-06T16:15:53.000Z,2018-07-18T16:11:43.000Z,2018-07-06T16:51:39.000Z,8,0,0,0,0,,,,,
235703387,Getting Unstuck day 1,,,32626504,https://cdn2.scratch.mit.edu/get_image/project/235703387_480x360.png,2018-07-06T17:15:33.000Z,2018-07-06T17:26:17.000Z,2018-07-06T17:24:51.000Z,5,1,1,0,0,,,,,
235703238,UnstuckDay 1 NBB,"At first reading this feels like a simple project. However, there are many questions that need to be answered: 
How will the sprites move?
What will end the program?
Will both sprites need to check for a collision?
As a teacher, I would need to provide much more direction for an assignment such as this. However, this challenge can be introduced at different times throughout a unit as students learn more.",Click the green flag to start.,11305008,https://cdn2.scratch.mit.edu/get_image/project/235703238_480x360.png,2018-07-06T17:13:34.000Z,2018-07-06T17:37:19.000Z,2018-07-06T17:34:07.000Z,4,1,1,0,0,,,,,
235704219,Getting Unstuck 1,Went with the simplest solution!,Press the green flag to begin.,34228007,https://cdn2.scratch.mit.edu/get_image/project/235704219_480x360.png,2018-07-06T17:26:34.000Z,2018-07-06T17:42:02.000Z,2018-07-06T17:37:31.000Z,7,1,1,0,0,,,,,
235705468,Getting Unstuck Day 1,It was all about timing.  I first starting using a IF THEN block but it didn't work.  The sprite never sensed the prince.  ,,26877789,https://cdn2.scratch.mit.edu/get_image/project/235705468_480x360.png,2018-07-06T17:43:58.000Z,2018-07-06T18:07:38.000Z,2018-07-06T18:06:30.000Z,5,1,1,0,0,,,,,
235705525,Competition for Resources: GettingUnstuck1 Collision,"Part of the Getting Unstuck project.
Creativity:
I started thinking about a story where one character might say ""Excuse me!"" to another, which got me thinking about how Canadians are stereotyped as excessively polite. There's the beaver. American Independence Day was only two days ago, so there's the eagle. Those sprites I had to find online, as these animals did not exist in Scratch's library. A bit of fiddling to get them the right size, with transparent backgrounds. Where would a beaver and an eagle interact? At a lake. The lake background comes from Scratch's library, and the heron that's already there provided the ""conflict"" necessary for any good story.
Production:
A bit fiddly, as I mentioned, to get outside images into Scratch. As for the code, I am not convinced that there isn't a more elegant way to take care of the timing between the ""thought bubbles"" of each character, rather than just hard-coding all the glide, wait, and thought blocks. Likewise with the collision at the end. I used an ""if"" block, but I have a feeling that there are more elegant ways of accomplishing that little bit of interaction.
Getting Unstuck:
There was a lot of testing and iterating to get the timing right for the thought bubbles. Initially, I had ""forever"" blocks around the ""if"" blocks to sense when the two characters were touching, but I realized I didn't need them as the two characters would only touch once, and in a defined sequence. It's not like in a game where two sprites might touch at any time, so you would need the ""forever"" block to account for that.","Nothing to do, just press the green flag!",3485356,https://cdn2.scratch.mit.edu/get_image/project/235705525_480x360.png,2018-07-06T17:44:49.000Z,2018-07-06T20:35:26.000Z,2018-07-06T18:36:05.000Z,8,2,1,0,0,,,,,
235621427,HTGU - Day 1,"Notes: I got stuck and my own pride prevented me from doing much other than unsystematically trying lots of different blocks (and refusing to use resources available to me).

It's not all bad.  I learned about many things in Scratch:
 - Direction
 - Costume centers
 - Cloning
 - Sensing","My original idea was to have 2 sets of eyeballs in a black room randomly moving around.  However, I wanted to have only 1 sprite move at a time, and the collision would cause the roles to swap.

Turns out that implementing the movement swapping was not as easy to do or is error prone with the approach I took.

The balls often get stuck (no pun intended).",24244805,https://cdn2.scratch.mit.edu/get_image/project/235621427_480x360.png,2018-07-05T21:21:44.000Z,2018-07-07T02:21:15.000Z,2018-07-06T19:00:30.000Z,11,1,1,0,0,,,,,
235606748,Getting Unstuck Day 1 Bouncing Off Aquarium,,,11634746,https://cdn2.scratch.mit.edu/get_image/project/235606748_480x360.png,2018-07-05T17:45:50.000Z,2018-07-08T17:15:49.000Z,2018-07-06T19:51:48.000Z,8,2,1,0,0,,,,,
235609492,Getting Unstuck Challenge 1,"This project was created for Scratch ED's Getting Unstuck Challenge. The task was to have two sprites collide, with one of the saying, ""Excuse me!"" While the other one says, ""Certainly!"" 

In honor of my love of the ocean and my favorite upcoming week, Shark Week, I decided to do an under the sea theme. ",Click the green flag. ,10722024,https://cdn2.scratch.mit.edu/get_image/project/235609492_480x360.png,2018-07-05T18:18:05.000Z,2018-07-05T19:11:39.000Z,2018-07-05T19:04:28.000Z,13,1,1,0,0,,,,,
235717845,Unstuck-1,I love how others have found different solutions for the same input. I learned also how to move sprites in different ways (using random numbers),,13846307,https://cdn2.scratch.mit.edu/get_image/project/235717845_480x360.png,2018-07-06T20:58:26.000Z,2018-07-06T21:05:56.000Z,2018-07-06T21:02:07.000Z,14,1,1,0,0,,,,,
235715878,Drop-in Spider,"I started with the idea of a spider dropping, but wasn't sure who would be the landing pad...until I started browsing the sprite library. Sitting outside to work on this inspired taking a shot for the background. Although this shouldn't be a surprise, I was surprised at how little tweaks, actions & interactions can take more than a little time!  With more time, I'd like to see if I could streamline things a bit and name the sprites & costumes fittingly,  but for now....here it is.
I love seeing all the clever scenarios people have come up with in their projects!",Press the green flag to start.,52693,https://cdn2.scratch.mit.edu/get_image/project/235715878_480x360.png,2018-07-06T20:22:47.000Z,2018-07-06T21:15:37.000Z,2018-07-06T21:14:55.000Z,5,2,1,0,0,,,,,
235718512,day 1,,,3035045,https://cdn2.scratch.mit.edu/get_image/project/235718512_480x360.png,2018-07-06T21:11:17.000Z,2018-07-06T21:20:36.000Z,2018-07-06T21:20:36.000Z,3,1,1,0,0,,,,,
235707886,Unstuck_1,"broadcasting is very helpful
",Kitty meets creature ,9694576,https://cdn2.scratch.mit.edu/get_image/project/235707886_480x360.png,2018-07-06T18:17:11.000Z,2018-07-06T21:32:58.000Z,2018-07-06T21:28:00.000Z,3,1,1,0,0,,,,,
235721930, #GettingUnstuck День1,, #GettingUnstuck День1,34214931,https://cdn2.scratch.mit.edu/get_image/project/235721930_480x360.png,2018-07-06T22:25:07.000Z,2018-07-06T22:29:22.000Z,2018-07-06T22:29:22.000Z,7,1,1,0,0,,,,,
235700139,Day-1,,Click the green flag,30506213,https://cdn2.scratch.mit.edu/get_image/project/235700139_480x360.png,2018-07-06T16:31:09.000Z,2018-07-06T22:44:52.000Z,2018-07-06T17:10:33.000Z,3,1,1,0,0,,,,,
235687456,Getting Unstuck: Day 1,,,599612,https://cdn2.scratch.mit.edu/get_image/project/235687456_480x360.png,2018-07-06T13:45:12.000Z,2018-07-06T14:36:55.000Z,2018-07-06T14:36:55.000Z,10,2,1,0,0,,,,,
235700354,Unstuck Day 2 - Flower Power,,,18558561,https://cdn2.scratch.mit.edu/get_image/project/235700354_480x360.png,2018-07-06T16:34:05.000Z,2018-07-07T01:34:31.000Z,2018-07-07T01:34:31.000Z,10,1,1,0,0,,,,,
235730987,UnStuck Day 1 AC,,,27094795,https://cdn2.scratch.mit.edu/get_image/project/235730987_480x360.png,2018-07-07T01:34:18.000Z,2018-07-07T01:46:22.000Z,2018-07-07T01:46:21.000Z,6,1,1,0,0,,,,,
235733437,Getting Unstuck Challenge #1 ,"Simple task that inspires many creative ideas.
Great task to present to students.
Could relate to several curriculum areas, by changing basic dialogue.
 - reading, science health, even asking math questions.
Cant wait to present to students next term.",Click on the green flag.,13484475,https://cdn2.scratch.mit.edu/get_image/project/235733437_480x360.png,2018-07-07T02:17:58.000Z,2018-07-25T03:19:29.000Z,2018-07-07T02:24:16.000Z,7,2,1,0,0,,,,,
235735728,Day 1,,,24884035,https://cdn2.scratch.mit.edu/get_image/project/235735728_480x360.png,2018-07-07T03:04:15.000Z,2018-07-07T03:11:56.000Z,2018-07-07T03:11:56.000Z,8,1,1,0,0,,,,,
235742491,Unstuck Day 1,"I have learn about add sprite, make a sprite move, coordinate of sprite, time management of sprite to move and said some think ",PLANE & CAR,34216021,https://cdn2.scratch.mit.edu/get_image/project/235742491_480x360.png,2018-07-07T05:46:39.000Z,2018-07-07T05:55:24.000Z,2018-07-07T05:49:20.000Z,6,2,1,0,0,,,,,
