id,title,description,instructions,author/id,image,history/created,history/modified,history/shared,stats/views,stats/loves,stats/favorites,stats/comments,stats/remixes,remix/parent,remix/root
235902074,Space Nyan: Getting Unstuck Day 5 Jumpin n Flyin,"Getting Unstuck Day 5 project, jumping and flying

Creativity: 
I wanted to use a gif, as I learned how from another scratcher recently to import a gif to make an animated sprite. I also wanted to make more of a game-type project, with a score and a clear end-point. Often, the sprites I use depend on what I can find through Google Image Search :-/ So, NyanCat flies through space!

Production:
Lots of sprites, each with animation. It was fun and easy to make a sprite blink quickly between two or three costumes to give them more interest. Getting the objects flying through space at an appropriate speed and spaced out enough was also difficult. I feel I could still improve that aspect of the game.
In addition, I did manage to make NyanCat react every time it got hit, but I wasn't quite sure how to use the ""Touching sprite"" sensor in such a way as to only react once, rather than continuously as the two sprites passed over each other. I ended up putting ""Wait"" blocks in my ""If touching"" blocks, but as always, I wonder if there isn't a more elegant way of doing this.

Getting Unstuck:
So I've realized that I always think there is a more elegant way of doing things... but I rarely go look for it or ask for help. I do like to try to figure things out on my own. I have been using the ""help"" commands more often. Part of it is that I'm not sure how to find the specific information that I'm looking for. 
Another scratcher recently remixed one of my projects and indicated another way of doing something (waiting for keyboard input), so I've made sure to reuse that new strategy in this project.","Click the green arrow, then follow the onscreen instructions.",3485356,https://cdn2.scratch.mit.edu/get_image/project/235902074_480x360.png,2018-07-09T14:10:45.000Z,2018-07-09T15:58:29.000Z,2018-07-09T15:34:47.000Z,9,1,1,0,0,,
235894257,SALTA e VOLA - Day 5,"Ci sarebbe voluta sicuramente una variabile per controllare i movimenti della rana e della farfalla, ma , per ora, non sono riuscita a metterla a punto.",Clicca sulla bandierina verde.,13746945,https://cdn2.scratch.mit.edu/get_image/project/235894257_480x360.png,2018-07-09T13:03:56.000Z,2018-07-09T15:46:38.000Z,2018-07-09T15:44:09.000Z,17,2,0,0,0,,
235895392,Day 5 - Air show,"Can't get touch sprite to work on this. Maybe something to do with the clouds being clones? If anyone knows please share! Plane sound came from Freesound site. 

Day 5 - Create a project that involves one or more sprites jumping or flying. For example, you could animate a bird flying through the clouds or a video-game character jumping across lava.","Click flag to start. Use up, down, right, left arrows to navigate plane above and below the clouds.",109272,https://cdn2.scratch.mit.edu/get_image/project/235895392_480x360.png,2018-07-09T13:14:46.000Z,2018-07-25T01:14:27.000Z,2018-07-09T15:47:16.000Z,6,3,1,0,0,,
235910976,Getting Unstuck 5,"I used my daughter's gymnastics photo as a jumping-off point, so to speak. I had never played around with moving pieces of pictures around to create some kind of animation, so that was fun.

The one thing that bugs me is the way the speech bubble moves back and forth when she waves, but I don't think there's anything I can do about that.",Click the green flag to start.,18044195,https://cdn2.scratch.mit.edu/get_image/project/235910976_480x360.png,2018-07-09T15:26:06.000Z,2018-07-10T01:37:32.000Z,2018-07-09T16:01:01.000Z,17,7,1,0,0,,
235838905,Getting Unstuck: Day 5,"Immagini SVG: https://www.flaticon.com/
Musica: Il carnevale degli animali di Camille Saint-Saëns
Ho utilizzato come sprite le immagini scaricate dal sito citato; il formato SVG mi ha consentito di personalizzarle utilizzando l'editor di Scratch.
Per il movimento del fondale marino, ho applicato quanto appreso dal tutorial Google First ""In alto mare"" 
(v. https://antonellamazzobel.netboard.me/scratch/?tab=48913)
",Clicca sulla bandierina verde per visualizzare l'animazione.,19789360,https://cdn2.scratch.mit.edu/get_image/project/235838905_480x360.png,2018-07-08T19:48:53.000Z,2018-07-09T16:12:03.000Z,2018-07-09T16:05:47.000Z,21,7,3,0,0,,
235907766,Day 5 - Getting Unstuck,"REMIX from:
- my #GettingUnstuck1 (https://scratch.mit.edu/projects/235616461/)
-  a @whiskito project (https://scratch.mit.edu/projects/235888016/)

Project part of #GettingUnstuck initiative #CreativeComputing, Day 5, ""Flying Leap""

""Create a project that involves one or more sprites jumping or flying. For example, you could animate a bird flying through the clouds or a video-game character jumping across lava.""","Go for a walk, but be very, very careful!
Movements:
- left & right arrow keys to move Scratchy
- up arrow to jump
- up arrow twice to fly",26079479,https://cdn2.scratch.mit.edu/get_image/project/235907766_480x360.png,2018-07-09T14:57:57.000Z,2018-07-24T22:20:28.000Z,2018-07-09T16:13:31.000Z,10,3,1,0,0,235888016,235888016
235910471,Getting Unstuck: Day 5,"Getting Unstuck: Day 5.
Challenge: Create a project that involves one or more sprites jumping or flying. For example, you could animate a bird flying through the clouds or a video-game character jumping across lava. 

I'm very happy! I was able to animate a parrot flying through the clouds and a dinosaur jumping to catch the parrot. I do not understand why the parrot does not feel like touching the dinosaur ...
Matt Stone wrote the code that solves my problem. Thank you, Matt Stone!!!  ",Click the green flag.,17615581,https://cdn2.scratch.mit.edu/get_image/project/235910471_480x360.png,2018-07-09T15:21:38.000Z,2018-07-22T15:01:28.000Z,2018-07-09T16:08:07.000Z,29,2,0,0,0,,
235914701,day-5,,,16822769,https://cdn2.scratch.mit.edu/get_image/project/235914701_480x360.png,2018-07-09T16:02:26.000Z,2018-07-09T16:20:16.000Z,2018-07-09T16:20:16.000Z,13,4,1,0,0,,
235912128,Cat and stars,Getting Unstuck Day5: Create a project that involves one or more sprites jumping or flying.,"Click the green flag to start.
Move with LEFT and RIGHT arrows.
Jump with SPACEBAR.
Catch the stars if you like.",25332755,https://cdn2.scratch.mit.edu/get_image/project/235912128_480x360.png,2018-07-09T15:37:44.000Z,2018-07-09T16:48:16.000Z,2018-07-09T16:38:32.000Z,10,2,0,0,0,235892227,235892227
235915717,GettingUnstuck#5 - Crash and escape!,"Getting Unstuck challenge #5 - ""Create a project that involves one or more sprites jumping or flying"".

This uses glide for all the movement of both the rocket and the alien. I'm sure there's better ways to make the movement more fluid and turn and move the sprite at the same time. Hopefully other people's submissions will provide some hints.",Press SPACE to lift off and watch how things go.,15872912,https://cdn2.scratch.mit.edu/get_image/project/235915717_480x360.png,2018-07-09T16:12:50.000Z,2018-07-09T17:06:02.000Z,2018-07-09T17:04:40.000Z,3,1,1,0,0,,
235916422,Platform jumps,"Man, I forgot how tough simple physicsy stuff is in Scratch. Lots of competing challenges here for a student, from just understanding and implementing the physics model to grappling with challenges with sprite-sprite interactions and figuring out the right order of instructions to make everything work. I went with a really simple sprite shape to help simplify the collision issues, but still spent a good deal of time debugging my logic.",,1092342,https://cdn2.scratch.mit.edu/get_image/project/235916422_480x360.png,2018-07-09T16:20:33.000Z,2018-07-09T18:17:38.000Z,2018-07-09T17:12:11.000Z,14,5,1,0,0,,
235917287,DAY 5 - CASTLE GHOSTS,"HO PRESO SPUNTO DA ALTRI PROGETTI, MA POI L'HO PERSONALIZZATO E MODIFICATO TOTALMENTE. GRAZIE, COMUNQUE, A CHI MI HA AIUTATO.","CLICCA SULLA BANDIERINA VERDE.
I FANTASMI VOLERANNO SUL CASTELLO E QUANDO SI ""SCONTRERANNO"" UNO DI LORO CAMBIERA' COLORE. ",34259094,https://cdn2.scratch.mit.edu/get_image/project/235917287_480x360.png,2018-07-09T16:28:20.000Z,2018-07-19T14:00:55.000Z,2018-07-09T17:19:43.000Z,6,2,0,0,0,,
235912793,Volpe del deserto,,"Fai in modo che la volpe non tocchi il sasso che ha davanti. Per schivarlo, puoi saltare premendo il tasto ""spazio"".",34169307,https://cdn2.scratch.mit.edu/get_image/project/235912793_480x360.png,2018-07-09T15:43:22.000Z,2018-07-27T09:37:12.000Z,2018-07-09T17:14:09.000Z,4,1,0,0,0,,
235918657,Rosaria day 5,,,33786606,https://cdn2.scratch.mit.edu/get_image/project/235918657_480x360.png,2018-07-09T16:41:14.000Z,2018-07-09T17:27:09.000Z,2018-07-09T17:17:48.000Z,14,1,0,0,0,,
235918660,Unstuck Day 5: Jumping,"I made this project in response to the prompt for Challenge #4 of the Getting Unstuck initiative from the ScratchEd Team:
https://gettingunstuck.gse.harvard.edu
For this project I wanted to remind myself how to give a jumping sprite some feeling of gravity. I thought I would remember how from having done it before but ended up having to look up a strategy by searching other scratch projects. This seems very simple. There is a gravity variable that starts with a positive value and is added to the y position, and in a repeat loop a small amount is subtracted each loop. So it goes up slower and slower, then heads back down and gets to the original value at the ground.","Just click the green flag, the horse will jump forever!",214174,https://cdn2.scratch.mit.edu/get_image/project/235918660_480x360.png,2018-07-09T16:41:16.000Z,2018-07-09T17:29:07.000Z,2018-07-09T17:24:03.000Z,8,3,0,0,0,,
235917405,Day 5: Crab Accidents,,Use space to make the starfish fly up & down and avoid crab accidents! :),24957617,https://cdn2.scratch.mit.edu/get_image/project/235917405_480x360.png,2018-07-09T16:29:36.000Z,2018-07-09T22:37:47.000Z,2018-07-09T17:38:11.000Z,9,1,1,0,0,,
235919709,Getting Unstuck: Day 5 Underwater Adventure,,"

Create a project that involves one or more sprites jumping or flying. For example, you could animate a bird flying through the clouds or a video-game character jumping across lava. ",25043750,https://cdn2.scratch.mit.edu/get_image/project/235919709_480x360.png,2018-07-09T16:51:47.000Z,2018-07-09T17:48:18.000Z,2018-07-09T16:52:14.000Z,5,1,0,0,0,,
235923934,Unstuck-5,,,34091272,https://cdn2.scratch.mit.edu/get_image/project/235923934_480x360.png,2018-07-09T17:30:42.000Z,2018-08-03T19:50:06.000Z,2018-07-09T17:47:35.000Z,6,1,0,0,0,,
235924421,Unstuck: Day 5,"By Filipe Mendes
","Press the grren flag
When the bat touch the butterfly that dies and desapear",2980392,https://cdn2.scratch.mit.edu/get_image/project/235924421_480x360.png,2018-07-09T17:36:19.000Z,2018-07-09T17:47:40.000Z,2018-07-09T17:45:52.000Z,4,2,0,0,0,,
235907192,Day 5 - Cats in SPAAACE!!,"Moon, Splendid Blue Fairy Wren, and Bachelor Button from Wikimedia commons, sound clips from Free Karaoke Version
I finally used a variable! I love the way so many people made their jumping and falling so realistic, but I just couldn't dig that deep today - work-in-progress!",Click the green flag and follow the prompts from the sprites!,18341966,https://cdn2.scratch.mit.edu/get_image/project/235907192_480x360.png,2018-07-09T14:52:56.000Z,2018-07-09T18:05:02.000Z,2018-07-09T17:53:00.000Z,10,4,2,0,0,,
235924324,Getting Unstuck - Day 5 (sprite jump),"I wanted to try out a gravity effect, and consulted the project below for a tutorial, which was super helpful! If I had more time, I wanted to figure out how to create the same effect if the penguin hops on top of the rainbow. I tried a few things, but couldn't figure out how to get it back to the ""floor"" sprite when he moved off the rainbow.

https://scratch.mit.edu/projects/268679/","Click the right arrow to go forward, the left arrow to go backwards, and the up arrow to jump!",2752403,https://cdn2.scratch.mit.edu/get_image/project/235924324_480x360.png,2018-07-09T17:35:23.000Z,2018-07-09T18:10:08.000Z,2018-07-09T17:56:32.000Z,10,2,0,0,0,,
235922288,Getting Unstuck #5: Sprites jumping or flying,"I found very helpful the link given by Karen Brennan:
https://en.scratch-wiki.info/wiki/Jumping

Scratch project was created as activity #5 of the ""Getting Unstuck"" project of the Creative Computing Lab at the Harvard Graduate School of Education.
Day #5 Challenge: Create a project that involves one or more sprites jumping or flying. For example, you could animate a bird flying through the clouds or a video-game character jumping across lava. ",Press the green flag!,1202362,https://cdn2.scratch.mit.edu/get_image/project/235922288_480x360.png,2018-07-09T17:16:30.000Z,2018-07-10T07:35:58.000Z,2018-07-09T18:06:08.000Z,14,2,1,0,0,,
235908303,GU_Day5,"When I began, I didn't know what I would create. I just started tinkering. 
At one point I inadvertently created an infinite loop with the result that my cursor turned into a spinning pinwheel. 
One challenge was figuring out how to let the user play again without restarting the project. 
I had a tough time finding sound effects that I like...still not satisfied with my  choices. B/c I was trying so many effects, I added variables so I could tweak volume and timing more efficiently. ",Use the arrow keys to move Nano around the city. Discover which objects gain or lose points. ,24741621,https://cdn2.scratch.mit.edu/get_image/project/235908303_480x360.png,2018-07-09T15:02:39.000Z,2018-07-09T18:06:58.000Z,2018-07-09T18:06:58.000Z,6,1,0,0,0,,
235927887,hungry ghost,,Make the ghost fly and catch the candy. This is a favourite with the kids around halloween.  Love the sound effect on this one. ,2876976,https://cdn2.scratch.mit.edu/get_image/project/235927887_480x360.png,2018-07-09T18:07:26.000Z,2018-07-09T18:08:37.000Z,2018-07-09T18:08:03.000Z,9,5,1,0,0,,
235921411,Gordon_Day 5 Getting Unstuck,Need to work on how fast the bat falls and keeping score.,Use the arrow keys to move the bat.  Try to catch the Hippo.,18900622,https://cdn2.scratch.mit.edu/get_image/project/235921411_480x360.png,2018-07-09T17:08:56.000Z,2018-07-10T02:08:39.000Z,2018-07-09T18:07:17.000Z,4,2,0,0,0,,
235915801,Day 5 salta e vola,,,18667079,https://cdn2.scratch.mit.edu/get_image/project/235915801_480x360.png,2018-07-09T16:13:56.000Z,2018-07-09T19:58:25.000Z,2018-07-09T18:08:28.000Z,8,1,0,0,0,,
235898313,5 GIORNO-2,,PREMERE SOLO TASTO BANDIERA E TASTO SPAZIO DOPO UN PAIO DI SECONDI PREMERE a,28304428,https://cdn2.scratch.mit.edu/get_image/project/235898313_480x360.png,2018-07-09T13:40:44.000Z,2018-07-09T18:11:13.000Z,2018-07-09T18:11:12.000Z,6,2,0,0,0,,
235915013,Getting Unstuck Day 5,"The children are all obsessed with the upcoming World Cup match, so my subject matter was almost chosen for me!  I tried to get too clever by having it repeat, but my timings weren't quite right and I ran out of time to tinker.","Click the green flag to score a goal against the Croatian goalkeeper!
(Yes, I know goalies don't wear that colour shirt!, it's poetic licence!",3297086,https://cdn2.scratch.mit.edu/get_image/project/235915013_480x360.png,2018-07-09T16:05:50.000Z,2018-07-09T18:25:09.000Z,2018-07-09T18:25:08.000Z,11,1,0,0,0,,
235887090,Getting Unstuck: Day 5,,Use up arrow to jump in order to avoid the witch.,24340467,https://cdn2.scratch.mit.edu/get_image/project/235887090_480x360.png,2018-07-09T11:30:39.000Z,2018-07-09T18:54:29.000Z,2018-07-09T18:47:28.000Z,7,1,0,0,0,,
235931635,Unstuck Day 5 - James Jumps,"I needed some help figuring out what to do for this one, so I turned to my son James. After brainstorming what would jump or fly, we decided on him jumping over the Grand Canyon. Oh, and he wanted Scratch Cat's body. No problem!",Just click the green flag!,7902,https://cdn2.scratch.mit.edu/get_image/project/235931635_480x360.png,2018-07-09T18:38:04.000Z,2018-07-09T19:04:43.000Z,2018-07-09T19:02:23.000Z,9,2,0,0,0,,
235931888,Jumping sprite,"I have not manipulated layers before, so today I learned how to keep the frog in front of the lily pads. For jumping, I used a simple two-step combination of glides.","Click the green flag to start, then click the lily pads in order to make the frog jump to the bug.",13189460,https://cdn2.scratch.mit.edu/get_image/project/235931888_480x360.png,2018-07-09T18:40:01.000Z,2018-07-09T19:06:24.000Z,2018-07-09T19:03:54.000Z,9,2,0,0,0,,
235931324,Getting Unstuck day 5,I have a vague memory of working on a project like this a while back. I am pretty please with how I eventually got the sort of realistic gravity effect working. It took a while to figure out how to make the cat stop falling when he reached the ground. Just reversing the loop wasn't reliable because of the dfferences in the costumes. Given more time I would probably make it more game like: animate an ever widening pool of lava to jump across as many times as possible without falling in.,"Use left and right arrow keys to move
Space to jump

Don't fall in the lava",17767933,https://cdn2.scratch.mit.edu/get_image/project/235931324_480x360.png,2018-07-09T18:35:23.000Z,2018-07-24T12:15:40.000Z,2018-07-09T19:18:44.000Z,11,3,0,0,0,,
235931757,Unstuck Day 5,Is there anyway to change or hide Sprits?  I got around this by changing costumes but think there might be a more efficient way to do this.,"Press the green flag to begin and then the ""space"" bar when prompted.",24826697,https://cdn2.scratch.mit.edu/get_image/project/235931757_480x360.png,2018-07-09T18:39:01.000Z,2018-07-09T19:24:09.000Z,2018-07-09T19:24:09.000Z,25,3,0,0,0,,
235935230,Unstuck Day 5,"So in my first version, when the fish change direction, they were upside down!! I went back and copied a costume and flipped it over. In additoin to switching the costume whne the sprite hits the edge, I also had to reset the costume when the green flag is clicked.","Click green flag for instructions, hold space key to make the fish swim.
Each swims back and forth at different speeds.",11305008,https://cdn2.scratch.mit.edu/get_image/project/235935230_480x360.png,2018-07-09T19:10:29.000Z,2018-07-09T19:41:42.000Z,2018-07-09T19:24:14.000Z,9,3,1,0,0,,
235911724,Unstuck 5: Jumping Cat,I really want to figure out how to get the cat to jump on the black line but I have been really struggling. Let me know if you have any advice. ,"Use Arrows to move 
Use Space to Jump",25417130,https://cdn2.scratch.mit.edu/get_image/project/235911724_480x360.png,2018-07-09T15:33:45.000Z,2018-07-12T16:11:58.000Z,2018-07-09T19:30:10.000Z,24,3,0,0,0,,
235934422,Getting Unstuck: Day 5,Looked at Moonhack 2017 to see how to do jumps,"Click the green flag to start

Press the space bar to make Scratchy jump  ",34197892,https://cdn2.scratch.mit.edu/get_image/project/235934422_480x360.png,2018-07-09T19:02:44.000Z,2018-07-09T19:32:46.000Z,2018-07-09T19:31:15.000Z,6,3,0,0,0,,
235934258,"Unstuck 05 Walking, jumping, flying","I wanted to learn how to make sprites have ""classic"" arrow key control, including jumping over a distance. Didn't get too far, but time is limited today and I hope to come back to it. I learned how to define a block (make a procedure) so I'm super happy with that. Will come back to work on this more later but am sharing as is. Note credits, where I remixed to get the mario character with costumes. The beach is calling me NOW.
Thanks to @PrescottRoadrunner for teaching me how to jump in ""Nano Jump on Scratch""","Create a project that involves one or more sprites jumping or flying. For example, you could animate a bird flying through the clouds or a video-game character jumping across lava. ",19123745,https://cdn2.scratch.mit.edu/get_image/project/235934258_480x360.png,2018-07-09T19:01:24.000Z,2018-07-10T04:35:02.000Z,2018-07-09T19:37:22.000Z,11,2,0,0,0,125578302,125578302
235922993,Space Scratch,Reto 5: Create a project that involves one or more sprites jumping or flying.,Up & Down Arrows,26161450,https://cdn2.scratch.mit.edu/get_image/project/235922993_480x360.png,2018-07-09T17:21:48.000Z,2018-07-09T19:39:29.000Z,2018-07-09T19:38:56.000Z,10,4,0,0,0,,
235873007,Getting Unstuck: Day 5 - project 2,"I like Scratch too much!!!

Image: https://www.flaticon.com
Music: Ecossaise in E-flat di Kevin MacLeod è un brano autorizzato da Creative Commons Attribution (https://creativecommons.org/licenses/by/4.0/)
Fonte: http://incompetech.com/music/royalty-free/?keywords=ecossaise&Search=Search
Artista: http://incompetech.com/",Clicca sulla bandierina verde per visualizzare l'animazione.,19789360,https://cdn2.scratch.mit.edu/get_image/project/235873007_480x360.png,2018-07-09T07:59:50.000Z,2018-07-09T19:40:10.000Z,2018-07-09T19:40:10.000Z,21,6,1,0,0,,
235886502,FIORI DI VALTELLINA (Lombardia ITALY),Ho creato questo progetto per Getting Unstuck come compito del giorno 2.,"Cliccare sulla bandierina verde, aspettare finchè appare un nuovo sfondo, cliccare sul fiore rosso, viola, bianco (in qualsiasi ordine)...",14651357,https://cdn2.scratch.mit.edu/get_image/project/235886502_480x360.png,2018-07-09T11:22:18.000Z,2018-07-09T19:53:06.000Z,2018-07-09T19:49:30.000Z,9,1,0,0,0,,
235932042,Unstuck Day 5 - Flying,"This is a remix from an earlier project I did with my students. I have added more sprites into the mix and developed this into a game, rather than just a sample of movement and emitting projectiles.

Game portion is a work in progress. Could add lives, change enemy sprites, make it faster as it progresses further into the game, and more.","Challenge:
Create a project that involves one or more sprites jumping or flying. For example, you could animate a bird flying through the clouds or a video-game character jumping across lava.

GOAL of the game: Score 10. Space bar to shoot. Don't get hit.

This sample was created to show how you can control a sprite with UP, DOWN, RIGHT and LEFT to move around the screen, and use SPACE bar to shoot a projectile. 

I used the clone blocks to create a new projectile at whatever point the ship sprite is located at the moment SPACE is pressed.

Look inside for more information. How can you make this better?",25286049,https://cdn2.scratch.mit.edu/get_image/project/235932042_480x360.png,2018-07-09T18:41:23.000Z,2018-07-15T15:43:22.000Z,2018-07-09T20:13:06.000Z,4,3,1,0,0,,
235939042,Unstuck Day 5,I wanted to use a gravity variable in a project and this one was my first attempt as using it with the cat. ,Use the space bar to make the cat jump to catch the balloons. When the cat hits the edge he starts back at the left. You get a point for every balloon you catch. Catch as many as you can in 60 seconds. ,266894,https://cdn2.scratch.mit.edu/get_image/project/235939042_480x360.png,2018-07-09T19:58:57.000Z,2018-07-09T20:25:04.000Z,2018-07-09T20:14:15.000Z,8,3,0,0,0,,
235939090,day 5 Flying,,Click the green flag to see the two birds fly in the sky!,22256610,https://cdn2.scratch.mit.edu/get_image/project/235939090_480x360.png,2018-07-09T19:59:44.000Z,2018-07-09T20:27:57.000Z,2018-07-09T20:27:22.000Z,6,3,0,0,0,,
235938728,GettingUnstuck-05,This time I decided to indulge in my passion for physics (although the dynamics of the cat is just sketched) and SciFi (did you get the reference?),"A muffin is very practical jumping platform.
Green flag to start.
Keep the mouse pressed on the green button to gain initial speed and jump higher and higher. But be careful: if the initial speed is too high you may face unexpected consequences.",25876369,https://cdn2.scratch.mit.edu/get_image/project/235938728_480x360.png,2018-07-09T19:54:42.000Z,2018-07-09T20:46:10.000Z,2018-07-09T20:29:43.000Z,9,3,3,0,0,,
235939809,Getting Unstuck Challenge 5,"What did you like most about your project? 
This is my first time trying the gravity feature. It was fun.

What would you do with it next, if you had more time?
If I had more time, I would add a few players to the game. Flopping is prohibited. :-)","In honor of the World Cup, click on the Green Flag.

Click the up arrow to make the ball stay into the air.",21000359,https://cdn2.scratch.mit.edu/get_image/project/235939809_480x360.png,2018-07-09T20:09:09.000Z,2018-07-09T20:45:34.000Z,2018-07-09T20:42:57.000Z,11,3,0,0,0,,
235917316,Ninja Duck v1.0,"I've created a mini game based on one of the mode games of the ""Ninji Spinki Challenges!!"" game. 
I decided to use simple gravity when the character reaches the ground and a variable to control when it jumps.
The enemies glide in different positions to make it more difficult.

                                              --Questions--
+What did you like most about your project? 
I think I've created cute characters.

+ What would you do with it next, if you had more time?
I would like to add more levels, enemies and music.

                                        --Credits--
- Art design: I've created characters and backgrounds with the Scratch paint editor.

","Press the green flag and then the colorful button to start.
Press Left and Right arrow keys to move the Duck.
Use the spacebar to jump.
Try to avoid the enemies in 15 seconds to win the challenge.
Enjoy it!

**HERE AN UPDATE:**
https://scratch.mit.edu/projects/237298318/
                            --Getting Unstuck Day 5--
Create a project that involves one or more sprites jumping or flying.",4413079,https://cdn2.scratch.mit.edu/get_image/project/235917316_480x360.png,2018-07-09T16:28:39.000Z,2018-07-25T02:49:12.000Z,2018-07-09T20:49:57.000Z,17,3,0,0,0,,
